index,Review,sentiment_predicted,category
1089,실화바탕임에도 창작물처럼 긴장되고 지루할 겨를없이 몰입도 장난아님,1,story
1090,새로운 장르는 높이평가되나 지루하고 따분했던 영화입니다,0,story
1091,결말이 다소 답답했지만 볼만했어요. 손석구 좋아요!,1,story
1092,어렵지만 더 알고 싶어지는 멋진 작품,1,story
1093,"결말이 조금 아쉽다? 반전을 주는건 좋았으나 용두사미에 느낌이 든다. 물론 실화기반이라 결말이 그런거겠지만 ㅋㅋㅋ 여론 조작, 댓글 알바에 대해 생각 해볼 수 있는 기회는 된 것 같다. 실제 몰랐던 사건들도 알게되고, 기대하고 볼 만한 영화는 아니지만 킬링타임용으로는 무난하게 볼만하다.",0,story
1094,생각보다 재밌었네요 강추 ㅎㅎ,1,story
1095,굉장히 독특한 방식의 영화였다 아직ㄷㅎ 영화만으로 생각하면 현실과 영화 구분이 쉽지 않다,1,story
1096,많은걸 생각하게 하는 재미난 영화네요.,1,story
1097,기대가 큰 만큼 별로였던.. 뭔가 핵심으로 가려다 끝나버린 밋밋한 영화,0,story
1098,뭐... 생각하기나름...,0,story
1099,내용에 뼈가 없어 .... 손석구가 아까워,0,story
1100,거짓과 진실의 저울질 좀 더 명확했더라몀,0,story
1101,욕을 너무 많이하길래 기대 안하고 봤음 재밌었는데? 물론... 우리나라는 이런 “명쾌한 답을 내놓지않는 영화”를 좋아하지는않지....,1,story
1102,기대 없이 봤는데 나쁘지 않았습니당,0,story
1103,이 영화가 현재 힘을 못 쓰는 이유는 여론조작 쯤엔 둔감해져버린 대중의 정치적 도덕성 마비도 큰듯 외국 어린아이같은 느낌에 홍당무 허클베리핀이 생각나게하는 홍경이 가장 인상적이었고 손석구는 좋아하고 잘하지만 나레이션마저 너무 그냥 손석구로 느껴지는게 좀 아쉬웠음,0,story
1104,조금 어렵고 무겁긴했지만 나름 볼만했어요,1,story
1105,"결말이 좀 아쉽지만, 배우들의 연기는 볼만해요.",1,actor
1106,"연기력은 기대이상,결말은 호불호",0,actor
1107,아~ 이 가슴 답답함은 영화때문일까? 현 세상때문일까?,1,story
1108,무엇이 사실이고 무엇이 거짓일까... 현실은 영화보다 더 거대한 거짓인데 오히려 진실을 축소하는 것처럼 느껴짐. 우민이라 속지 않기가 쉽지는 않겠지만 노력은 해 봐야겠다... 무서운 세상 거짓 세상의 기만에 당하고만 사는 것은 싫다.,0,story
1109,"결말이 조금 아쉽지만, 재미난 전개. 굿",1,story
1110,잘봤어요 더봐야할듯요 ㅎㅎ,1,story
1111,주인공 임상진 기자 역할맡은 손석구가 범죄도시2의 악역 강해상과 연애빠진로맨스의 박우리보다 훨씬 멋졌습니다 손석구 주연 최고의 영화라고 생각합니다👏👍,1,story
1112,수많은 정보들로 넘쳐나는 지금 시대에 걸맞는 영화. 한순간에 뒤바뀐 분위기를 잘 반영해냈다고 생각한다,1,directing
1113,지금 처해진 대한민국의 현실에 대하여 뼈저리게 느낄 수 있었던 영화. 영화를 보고 난 후 너무 실감나다 못해 무엇이 진실일지 그 누구도 모르는 현실이 무서워서 스크린이 전부 올라가고도 그 자리에서 일어서지 못했다.,1,story
1114,현실을 그대로 묘사했네요. 두려움과 걱정이 앞서네요,1,story
1115,신선하고 새로운 스타일의 영화였어요. 배우들의 연기와 연출이 리얼해서 몰입할 수 있었어요. 끝나고 생각나는 영화네요. 주연 사인방 모두 매력적입니다.,1,directing
1116,정말 현실적인것 같은 스토리.... 결말은 좀 찜찜하긴 하네요 ㅠㅠ,1,story
1117,나쁘지 않은데 몰입도 괜찮고,1,story
1118,나레이션빼고 내용은 흥미진진했어요.,1,story
1119,소소하게 잼있게 보았습니다간만에 영화 즐거웠습니다,1,story
1120,현실이 이런일이 충분히 일어나고있다는걸 알았으면서도 실화인걸알면서 영화를보니까 참.. 마지막이 좀 아쉽습니다.,1,story
1121,일상생활에서 홍수처럼 쏟아지는 댓글들의 진정성 여부를 다루어서 흥미있고 재밌게 봤습니다,1,story
1122,볼만했는데 한방이 부족한듯ㅎ 뭔가 통쾌함이 더있으면 좋을텐데,1,story
1123,결말이 조금 아쉽지만 나름 볼만했어요,1,story
1124,결말이 의외라... 그래도 괜찮게 봤네요.,1,story
1125,생각보다 더 재밌어요.~~,1,story
1126,끝맺지 못한 느낌이 있지만 흥미로운 영화에요. 지루하진 않았음…,1,story
1127,재밌게 봤다. 루즈한 부분도 없어서 집중해서 잘 봤고 마지막즈음에 몹시..놀랐다가 ?? 하고 끝난 감이 없진않지만 너무 적절한 엔딩인 것 같음. 그리고 배우들이 다 연기를 너무 잘해서 그것때문에도 더 재밌게 봄,1,actor
1128,그냥저냥 볼게없어서 봣는데 역시나 그냥저냥 느낌.,0,story
1129,스토리 적으로 아쉬운 부분은 있었으나 배우분들 연기력 좋고 집중 잘되고 개인적으로 만족하며 보았어요. 마지막은 오잉? 싶지만 감독님의 의도라는 글들을보곤 납득 했어요. 거짓이 섞인 진실이 더 진짜같다!!,1,actor
1130,재밌게 잘 봤습니다~~,1,story
1131,음…그냥…그냥 봤네요,1,story
1132,개인적으로 열린결말이 좀 아쉬웠지만 나름 잘 봤어요,1,story
1133,조금 지루한 편이었어요,0,story
1134,"연기도 좋고, 흐름도 좋아요. 재밌어요.",1,actor
1135,굉장히 현실감 있어서 오히려 무섭다.,1,story
1136,결말이 약간 아쉬워요..,1,story
1137,난 어디까지 믿을 수 있을까,1,story
1138,새로운 소재 손석구 그뿐,0,story
1139,"원래 용아맥에서 콩&고질라 다시 보려고 갔는데, 조금 늦게 가서 댓글부대 봤..감독이 확증편향에 빠지길 기획 했다고 하는데, 진실을 파헤치는 외로운 늑대 이미지와 나레이션은 무엇? 손석구 처음 보는데 아나운서 딕션 인줄..그래서 다큐인줄ㅋ see you again~콩&고질라♡",0,story
1140,재밌게 잘 봤습니다! ㅎㅎ,1,story
1141,지루해서 졸았어요 ㅠㅠ,0,story
1142,재미 없어요ㅜㅜ 졸다가 나왔습니다ㅜㅜ,0,story
1143,음 ... 극장을 나갈까말까 여러번고민했어요,1,story
1144,배우들의 연기가 신선했어요. 손석구님 목소리가 매우 빨라서인지 낯설게 느껴지더라구요. 그럭저럭 봤어요. 어떤게 진실인지 알수없을만큼 섬뜩하기도 하고,1,actor
1145,인터넷 말들 다 믿을게 못 되구나 걸러 봐야겠구나 생각드는 내용,0,story
1146,평점이 높지않아서 별 기대없이 봤는데 생각보다 몰입감높고 기존에 보지못했던 스타일의영화라 신선하고 생각을 많이하게만드는 의미깊은 영화였어요! 저는 극호였어요!,1,story
1147,난 진짜 재미있게 봤다.,1,story
1148,마지막 씬에서 엔딩 크래딧이 올라갈때까지 멍때리게 만드는 영화. 내가 방금까지 본 내용이 맞는지 어느게 진실인지 곱씹어보게 만들게됨,1,story
1149,마지막 반전은 좋습니다. 그 반전을 위한 앞부분이 약간 애매합니다.,0,story
1150,"스토리, 연기 좋았어요. 하지만 촬영, 조명 너무 돈을 안 썼어요.",0,actor
1151,나쁘지 않았습니다 하지만 마지막이 아쉽네여,1,story
1152,댓글부대 댓글부대 댓글부대,0,story
1153,간만에 지루하지 않은 영화를 봤네요 몰입하고 생각하게 만드는 영화네요 그래서 지루하지 않았습니다,1,story
1154,속빈강정. 껍데기만 잡고 빙빙 도는 듯한 느낌,0,story
1155,"친구들 연기도 좋았고, 킬링타임 영화로 괜찮은듯ㅎㅎ",1,actor
1156,영화도 좋았고 무대인사도 아주 좋았습니다,1,story
1157,"실재의 어디까지가 진실인지 알 수 없는 인터넷 속 이야기들과 댓글들의 혼란스러움을 잘 느껴졌으며, 그 속에서 당하는 사람과 이를 이용하는 사람의 경계가 불분명한 지금의 그 모습이 기자를 통해 반영되었다.",1,story
1158,손석구 김성철 이 영화 왜 선택했어어 좋은 배우들 데리고 식상하게 찍기,0,actor
1159,샷 shor 룩look 좋네요,1,story
1160,무난무난~합니당 연기들도 좋아용,1,actor
1161,기대하지 않았지만 큰 만족을 선사한 영화 생각보다 몰입감있게 볼 수 있었던 영화 킬링타임용,1,story
1162,마지막 반전이 좋았음👏👏,1,story
1163,영화 보는 내내 나는 누구에게 속고있는건가 혼란스러웠다. 거대한 질문을 남긴 영화. 계속 곱씹을 수 밖에 없는 여운이 긴 영화이다.,1,story
1164,커뮤니티 로그인 했을때 넘나 절망…,0,story
1165,한편의 다큐를 본 느낌이예요^^,1,story
1166,기대한거보다는 재미가...,0,story
1167,댓글부대. 한국에 꼭필요하다,1,story
1168,"'어, 이렇게 끝나?' 라는 생각이 드는 엔딩이 아쉽지만, 자주 사용했던 인터넷 커뮤니티를 보는 재미와 배우분들의 연기에 몰입해서 시간 가는줄 모르고 봤어요:) PS.쿠키영상은 없어요!",1,directing
1169,댓글부대…댓글부대…댓글부대…,1,story
1170,음~...그냥 잘봤어요~***!!!♡,1,story
1171,무심코 던진돌에 개구리는 맞아죽는다.,0,story
1172,"실화이나 실화같지 않으며 설명이 필요하나 설명없이도 볼수있는 영화입니다.언제 부턴가 ""이 영화는 실화를 바탕으로 제작되었습니다""가 붙는 영화는 더 걸르게 되는거 같아요. 우리 구씨의 연기는 오히려 살인자ㅇ난감 형사 역할이 더 어울려",1,actor
1173,"현혹하는 가상세계, 실재하는 매트릭스.",0,story
1174,재밌어요!!!! 정말 반전의반전의반전 최고!!!!,1,story
1175,아~ 그냥 그랬어요 내용부실 연출그냥,0,directing
1176,다들 평이 안좋길래 많이 기대는 안 하고 봤는데 조명연출이나 분위기 연출이 너무 좋았고 배우님들 연기 넘 잘해요 말싸움을 엄청 하는데 캐릭터 하나하나 성격도 파악되고 몰입됐어요 손석구배우님도 연기 넘 잘해서 표정 하나하나에 몰입됨… 개인적으로 너무 재미있게 봤어용👍,1,story
1177,음..생각보다 찝찝한 결말,0,story
1178,재밌었고 마무리도 뚝 끊기는게 현실감있었음,1,story
1179,시리즈 1편만 두시간 본 느낌. 영화 예고편만 두시간 본 느낌.,0,story
1180,한참 더 재밌어지고 있을 때 끝나버린 ㅠㅠ손석구 배우님 기자연기도 잘 어울리네요 ㅎㅎ,1,actor
1181,재밌었어요더시보려고요사실졸았음,1,story
1182,영화에대한 기대가 컸었는데 관람시 스토리 전개가 불확시실 했고 시사하는바가 없이 내용이 엉성해서 실망하고 나왔네요!ㅜㅜ,0,story
1183,시간가는줄모르고봤음 결말이야...뭐 현재진행형 이라 사이다결말을 줄수없었을거라 그런 생각이 들었음 그래야 계속해서 우리사회에 묻고또 묻고 질문을 던질테니,1,story
1184,가짜가 섞인 진실이 더 끌린다는데 이 영화가 끌리는 것 보니 가짜가 섞인 모양입니다.,0,story
1185,너무너무너무 재미있게 잘 봤습니다,1,story
1186,너무너무너무 재미있게 잘 봤습니다,1,story
1187,신선한 영화입니다. 재밌게 잘 봤어요.,1,story
1188,요즘인터넷 댓글로 여러명 이 사람이 죽이는 정말이지. 살인자이다. 너무나도 감명깊게보았다.,1,story
1189,현실세계에서 지금 우리에게 일어나고 있는일이라서 더욱 현실있게 다가오네,1,story
1190,재밋게봤어요 근데 마무리가 좀..찍다가 돈떨어져서 급하게 마무리한 느낌,1,story
1191,배우연기 좋앗어요~~,1,actor
1192,참신하면서 공감이 많이되는 재밌는 영화로 마지막엔 많은 생각을 하게 만드는 영화네요,1,story
1193,영화기 끝나고나니 세상 밖으로 나가기 무서워졌다,0,story
1194,조작이 난무하는 세상속에 믿을 수 있는건 뭘까요,0,story
1195,잘 관람 했습니다 추천합니다,1,story
1196,가짜뉴스라는 심각성보다 오락거리로 영화화 잘 했구나,0,story
1197,재미있게 잘 봤어요...,1,story
1198,영화를 보고나니 주제 및 메세지는 알겠으나 현재 너무 철지난 논쟁에 화두인걸 메세지 전달을 위해 대중 영화의 재미와 틀을 버렷다? 매우 아쉬운 영화.. 작가적 철학 감독의 의도? 그거하면서 재미나게 영화만드는 감독들이 성공하는 거 그래도 안국진 감독의 다음영화를 기대해봅니다,0,story
1199,볼만했어요 ㅎㅎ 기대 안 했는데,1,story
1200,★★★★ 시종일관 흥미롭게 전개되는 스토리텔링에 두뇌 풀가동 중인데 갑자기 셔터를 내려버리는 허무와 모호함,0,story
1201,끝부분이 아쉽긴한데 재미있었어요,1,story
1202,현실에서도 있을 것 같고 생각을 하게 되는 영화네요. 손석구 연기 좋았어요!,1,actor
1203,기대보다 쫌 스토리나 배우연기가 별로였습니다,0,actor
1204,결말이 별로에요이상해요,0,story
1205,정의로운 영웅 1명이 거대한 음모를 파헤쳐 응징하는 뻔한 영화가 아니어서 좋았어요. 보통의 직장인과 크게 다름 없는 주인공 기자가 진실과 거짓 사이에서 혼란스러워 하는 모습이 현실적이라서 재미있었어요. 통쾌한 사이다 결말에 익숙한 관객은 좀 허망하다 느낄 수 있겠네요.,1,story
1206,손석구님 팬이라 꼭봐야지 하고봤어여..석구오빠스탈 연기에~요즘 온라인의 실상을 보여주는것 같은..새롭기도 무섭기도하고 늘조심해야 될것같은,1,actor
1207,재밌었어용 ㅋㅋㅋ 배우들 연기도 굿!,1,actor
1208,실화라서 특별하게봤어요 좀지루한면있었지만쏘쏘,1,story
1209,많이 약하다. 다큐도 아니고 상상력이 일반인에도 못미치는듯 싶어요.,0,story
1210,내용도 잼있고 연기도 쵝오 아쉬운 결말,1,actor
1211,아... 나름 재밌게 봤었는데 끝이...ㅋ,1,story
1212,많은 것을 생각하게 만드는 영화,1,story
1213,재밌는데 열린 결말인가..? 그래도 재밌어요,1,story
1214,뭐가 진실이고 뭐가 거짓이 섞인 사실인지 아니면 어디까지 진실인지 판단할 수 없는 작금을 잘 표현한듯,1,story
1215,실제 있었던 이야기를 다룬 영화중에 잠오는 영화는 처음이였습니다. 어쩐지 사람들이 안보는 이유가 있었군요...,0,story
1216,생각보다는 재밌었어요 ^_^,1,story
1217,진짜 홍경 너무 잘생겼고 연출이 소음 돋을 정도.끝까지 반전에 반전이었음 아주 굿굿👍🏻👍🏻,1,directing
1218,너무 재미지네요오유옹,1,story
1219,결론 해석하기가 좀 어려웠어요 댓글로 인한 피해사례지적이 좋았어요,0,story
1220,계속 물음표가 남는 영화,0,story
1221,정말 배우가 아깝긴하네요…,0,actor
1222,재밌었어요 결말이 호불호가 갈리는 거 같은데 저는 이런 결말이라 더 영화의 주제의식이 부각된다고 생각했습니다! 연출이나 미감도 나름 예뻐요 ㅋㅋㅋ,1,directing
1223,잘 봤습니다!!...,1,story
1224,"애들 연기 잘하고, 스토리 탄탄하고, 2시간 순삭이엇음.",1,story
1225,연기력하나로끌고가기엔 스토리부족,0,story
1226,속편을엄두해둔 결말인가요,0,story
1227,좋지만 좋지않다!!! 손석구 배유만 좋지만ㅎㅎㅎ 결말이 너무 약하고 쫌더 디테일하게 파야지!!!,0,story
1228,원작도 소설이드만 영화초반에 명예훼손으로 가명을 사용하였다 그런건 안써도 안됬나,0,story
1229,그냥 그냥 내용 생각없이 봐야 재밌다,1,story
1230,"현실감 넘치는 전개방식으로 흡인력을 보여주는 영화임. 근데, 너무 열린 결말이라서~",1,story
1231,마지막이 쫌 아쉽다..,1,story
1232,글쎄요.. 기대만큼은 아니지 않나..,0,story
1233,재미있게 보았네요~~,1,story
1234,손석구 배우의 연기 스펙트럼이 아쉽지만 충분히 공감도는 내용임. 어디까지 진실일까?,1,story
1235,처음 봤을땐 특히 영상미가 너무 좋다고 생각하면서 봤습니다. 영화가 끝나고도 여러가지 생각을 하게 해서 같이 본 사람들이랑 이야기를 할 수 록 재밌었습니다! 결말에 대한 호불호가 있던것 같은데 개봉날 이후로도 여러번 보면 볼 수록 저만의 결말을 찾아가는 과정이 재밌어요.,1,story
1236,열린 결말이 호불호가 있을 수 있다,1,story
1237,소설을 봐야만 어느정도 이해가될 것 같음🥹 초반에우리좋았잖아요... 소설을 읽어서 괜찮긴했고... 사실 김성철 보려고 봤는데 성철이가 너무 잘해줬어요 네...🥲,1,story
1238,시사하는바가 큰 영화였다,1,story
1239,괜찮았어요. 추천합니다.,1,story
1240,소재도 흥미로웠고 재밌게 보았어요,1,story
1241,결말은 아쉽지만 재밌게 봤습니다,1,story
1242,완전 재밌었어요 재미없다는 사람들 잼민이거나 이해 못하는 사람이라 재미없다고 하는 것 같네요,1,story
1243,정말 재미있게 봤습니다.,1,story
1244,재미있게 잘 보았습니다,1,story
1245,내용에 몰입이 너무 안되네요ㅠㅠ,0,story
1246,그냥저냥 기대안하고 보면 볼만해요,1,story
1247,큰 기대는 하지 않는게..,0,story
1248,제법 임팩트 있는 논픽션 스릴러. 요즘 애들은 무섭고 그 아이들은 어른들의 짙은 그림자를 따르며 그 어른들의 그림자는 위험천만하다. 파생력 또한 그 크기가 대단하다.,1,story
1249,결론이 아쉬운~^^ 전체적 분위기는 나쁘지 않았던,0,directing
1250,지루햇음 진짜많이 하품나왔음 이해를 못 해서 그런건지,0,story
1251,"조금 섬찟했지만, 현실에는 기레기가 더 많은 것 같다는 생각이 머리를 떠나지 않음.",0,story
1252,그냥..졸았어요..,0,story
1253,와 소름 보면 볼수록 소름,1,story
1254,그냥 그저 그랬어요 하하하,0,story
1255,음 중간에 잠깐 졸았지만 댓들 무섭네요,0,story
1256,생각보다 그저그랬어요 ㅠㅠ,0,story
1257,앞과 뒤가 다른 영화. 뭬냐… ㅋ 어디서부터 어디까지가 진실이고 허구인지… 뒤통수 맞은건가…? 낚인건가…? 싶어 머리아파오지만 현실도… 다르지않을거 같아 좀 씁쓸한 맛의 영화,0,story
1258,부모님이랑 봤는데 부모님 거의 주무셨음요.. ㅜ,1,story
1259,현대인들의 일상을 담은 듯한 내용이라서 공감도 되고 다른 작품들에서는 볼 수 없었던 독특한 촬영 구도로 인한 연출에 인상깊었음👍,1,directing
1260,마무리가 좀 아쉽긴 했지만~ 재밌게 잘 봤네요~ㅎ,1,story
1261,너무 재미있게 봤습니다 보고 나서 생각할 거리 주는 영화 좋아해요,1,story
1262,진짜 최근본 영화중에 최고였어요 안보면 후회합니다 실화를 바탕으로했다는데 충격!!!! 재있게 각색한거에 충격!! 보는내내 진짜 뒤통수를 몇번 맞은듯 찐찐 잼나요^^~♡강추,1,story
1263,잉? 머야 이게 끝이라고? 라는 생각으로 돌아왔다,0,story
1264,재밌었어요 또보고싶어여,1,story
1265,몰입해서 재밌게 봤어요!!,1,story
1266,적당히 시간 때우기 좋네요,0,story
1267,넘 재밌어요! 찐쾌감은 없지만 보면서도 보고나서도 잔잔하게 재밌음. 지루함이 하나도 없고~,1,story
1268,잼있게봤어요!!!!,1,story
1269,마지막에 좀 혼란스러웠지만ㅋ 재밌게 봤음.,1,story
1270,헷갈려요… 그래서 좋음,1,story
1271,성실한 나라의 엘리스도 그랬듯 시사고발적 성격이나 그 역사적 사실의 단순전달에 그치는게 아니라 영화 자체를 재밌고 새로운 방식으로 만드는데 더 공을 들인 느낌,1,story
1272,후반부가 아쉽지만 전체적으로는 무난,1,story
1273,기대이상 너무 재밋었어요,1,story
1274,음...좀 지루했고 몬가 찝찝하게 끝난 느낌이네요,0,story
1275,인터넷 세상 속 진실과 거짓의 알 수 없는 경계 위에서 아슬아슬하게 뛰어노는 영화. N차 관람인데 볼수록 다른 면이 보이고 새로운 느낌이 든다!!,1,story
1276,진실일까? 거짓일까? 조작일까? 끝까지 헷갈림!,0,story
1277,참 어수선한 영화네요 그래도 잼있게 봤어요 ㅎㅎ,1,story
1278,저는 뭔가 생각을 많이 하게 되는 점이 좋았고 다만 열린결말을 선호하지 않아서 너무 답답하게 느껴졌어요 그래도 연기파 배우들이 연기를 맛깔나게 하셔서 좋았어요,1,actor
1279,맞는거 같기도 하고.. 아닌거 같기도 하고~,0,story
1280,생각보다 재밌어욥 !!!,1,story
1281,생각보다 좋았어요 다른것보다 악역 삼인방의 자연스러운 대사와 연기가 진짜 최고였어요 이스터에그나 결말은 너무 계산적으로 만든게 티나서 안멋있엇어요,1,actor
1282,손석구 배우님 연기 완벽 그 자체..,1,actor
1283,한국 근현대의 단편을 잘 보여줍니다,1,story
1284,재밌게 잘 봤습니다! 현실적이라 무서운(?)영화네요,1,story
1285,몰입도 있게 잘봤습니다~ 옆에 어르신 주무시는 소리와 핸드폰 불빛만 아니면 괜찮았을듯 ㅎ,1,story
1286,재밌게 잘 봤습니다~~,1,story
1287,댓글에 휘둘리지 말자 재밌어요,1,story
1288,반전 지금도 어딘가에서는 여론을 조작하고 있을거라는거,1,story
1289,손석구가 나와 보게 되었는데 홍 경의 연기에 빠져 들고 말았네요. 좀 더 많은 작품에서 볼 수 있었으면 좋겠습니다.,1,story
1290,기대를 안하고 봐서인가 상당히 흥미롭고 재미있었습니다. 최근에 대두된 사회적 문제를 반전 있는 스토리에 녹여낸 의미있는 영화였던 것 같습니다.,1,story
1291,일부분 아쉬운 지점이 영화의 맛을 급감시키는 것 외에는 볼만함,0,story
1292,"지금 우리가 살고 있는 세상과 가장 밀접하게 관련있고 크게 야기되는 문제이기도한 부분인거 같다 뭐가 진실이고 거짓인지 생각하기도 어렵게끔 생각을 거듭하고의심하며 보는데 결국 진실은 그들만이 안다는 것,,, 마무리가 깔끔하지않아 호불호가 가릴거 같다 그래도 갠적으로 높은 평가를 주고싶다",1,story
1293,배우들 연기 다 좋고 재밌었습니다! 몰입감 넘치고 재밌는데 2편이 있는건가 싶었어요!,1,actor
1294,진실일까 거짓일까 전개가 빨라서 좋았어요,1,story
1295,"재밌음 ! 뭘 믿어야할지는 모르겠지만,,…",1,story
1296,어디서부터 어디가 실화인지..,0,story
1297,연기력이 다했네요. 뒤가 좀..,0,actor
1298,아 결말이 넘 찝찝해~~~!!!!,0,story
1299,그냥 킬링타임용으로 소소하게 관람했다.,0,story
1300,스토리 전개가 좋았어요,1,story
1301,결론이 없어서 좀 아쉽네요 ㅎㅎ,1,story
1302,마지막이 허무했지만 전개가 빠르고 재밌었어요!,1,story
1303,정말 너무 재미없는 영화다,0,story
1304,나름 잘 짜여진 잼나는 영화,1,story
1305,재미있다!!! 결말이 조금 아쉽다,1,story
1306,"재밌을거라 생각 했지만, 처음부터 지루하고 재밌어 질만 하니까 갑자기 이상하게 마무리되는 전개 너무 재미없었어요..",0,story
1307,"의외로 정말 재미있게 봤음 끝에 국장한테 너도 만전에 스카웃됬냐고 소리지르고 나올때 정말 사람 정신병 의심병 걸리게 만들기 참 쉽네란 생각이 들정도로 약간 소름이었음 조작이란게 참 무섭다,,",1,story
1308,내용이 흥미진진하고 진부하지 않아요 두시간동안 지루할 틈 없이 집중해서 봤네요 손석구 연기 너무 잘하구요 잘생겼슴니다 암튼 최근 본 한국영화중에 재일 재밌게 봤어요 파묘보다 재밌는 듯 합니다 ㅎㅎ 손선구배우 외에 조연분들 모두 연기 잘하셔서 몰입할 수 있었어요 넘나 잼나네요~ 다들 꼭,1,actor
1309,마지막 결말이 좀 아쉽네요,1,story
1310,다 괜찮았는데 끝맺음이 이상하네 배우 연기력도좋고 징면이 어두운건 싫지만 일부로 어둡게 연출한의도인건 아는데 끝을 어떻게 맺어여할지 몰라서 냅둔느낌,0,directing
1311,많은 생각이 들어요.~~~,1,story
1312,재밌어요 마지막에 완전 반전..,1,story
1313,재미있게 봤어요. 나쁘지 않습니다.,1,story
1314,"전개가 조금 빨랐다면 어땠을까 70년대 후반생, 돈 많고 시간 많고 정치와 경제에 관심 많은 아저씨가 쓴 시나리오 같은 느낌임",0,story
1315,좋아요.재미잇엇어요,1,story
1316,확실히 원작이 기자 출신인 작가님의 소설이어서인지 기자라는 직업에 대한 특성이 잘 반영된 현실성 높은 영화라서 좋았습니다! 전개방식도 매우 흥미진진하거 예상치 못한 결말부의 반전까지!! 영화 내용에 대해 오래오래 곱씹을 수 있는 깊이있는 영화입니다~!,1,story
1317,친구랑 봤는데 좀 애매해요. 후반으로 가면서 나레이션만 많아지네요.영화가 아니고 다큐같아요.,0,story
1318,현실성이 있고 재밌어요 마무리가 아쉬웠어요ㅜ,1,story
1319,내용도 신선하고 마지막까지 생각을 많이 하게 만드네요.,1,story
