index,Review,sentiment_predicted,category
0,현실감 있는 영화 재밌게 봄,1,story
1,역시나 삼성제국의 능력은....,0,story
2,너무 기대했나.. 점점 집중이 안 되고 엥 싶은 결말이었다..🥺,0,story
3,배우분들 연기좋아요~^^ 스토리가 진짜로 있을거 같은 느낌에 더 몰입하면서 보게된 영화,1,story
4,마지막이 난해하긴 했지만 몰입감은 좋았어요 배우들 연기가 진짜 좋아요,1,actor
5,긴장감 있고 생각보다 재미있게 봤어요~,1,story
6,"조금 많이 지루했어요. 중간에 졸다가 마무리만봤어요. 우리구씨님, 그래도 화이팅",0,story
7,몰입감이 엄청난 영화!,1,story
8,"재밌었어요! 근데 결말이 뭔지모르겠어요,,",1,story
9,찝찝하게 끝나는 영화 열린 결말 안 좋아하는 저는 비추요,0,story
10,예매 해놓고 자서 취소도 못 하고 실관람평이 됐네요 손석구 짱!!,0,story
11,막막하면서 참 현실적이라 재밌게봤네요,1,story
12,실제이야기라니 영화 잘봤습니다 좋은영화던데 홍보가 부족했었던것같습니다,1,story
13,거짓에 거짓이 들어가니 뭘 뜻하는지 애매합니다,0,story
14,진행이 박진감이 넘치고 재미있게 봤어요.,1,story
15,색다른 영화 였습니다. 언론장악 빨리 사라지길,0,story
16,배우의 연기는 좋으나~ 뭔가 마무리가 ....,0,actor
17,삼성공화국 생각해보라고 만든건가봐요.,0,story
18,손석구 의리로 봄!!!,0,story
19,"시대의 냄새, 혼돈, 난장판",0,story
20,결말이 이상하고 내용 자체도 난해해서 두 번은 절대 안 볼 거 같아요.,0,story
21,임상진 바보라고 소문내야지,0,story
22,잘봣어요 지옥갈 사람들.. 천벌받길 바랍니다,1,story
23,"그냥 그럭저럭,,,합니다,",0,story
24,좋아요 😀 😀 😀 😀😀😀😀😀😀😀😀,1,story
25,님 이 어땠나요영화어땠나요영화,1,story
26,대단한 주제의식이 있는 듯한 초반부 기세에 비해 까면 깔수록 속이 비어있는 수박 겉핡기식 영화. 배우들의 연기와 신선한 소재는 좋았으나 사회비판이라고 하기엔 내용이 부실하고 오락성으로 즐기기엔 재미가 없다.,0,story
27,영화이지만 현실성 있는 스토리 잘봤습니다.,1,story
28,재미있게 잘 보았어요~<<,1,story
29,재미있게 보다 더 흥미있게 잘 보았네요.좋아요.,1,story
30,연기가 좋고 내용도 재밌었습니다.,1,story
31,재밌게 잘 봤습니다. 잘 만든 영화네요. 추천,1,story
32,영화 그 자체가 괴벨스 이런 참신한 시도는 계속 나와줘야한다. 백종원이 유명하다고 모든 가게가 단짠단짠이면 하향평준화의 시작,0,story
33,"내용을 모르고 가서 그런가 전혀 지루하지 않았고 오히려 재미있게 관람함. 열린 결말인 이유는 영화 내용 대부분이 사실에 가까워서 일부러 그랬다는 생각이 들고(사실을 너무 적시할 수 없으니?), 영화를 보고 나서 실제 사건을 찾아보고 비교하는 재미가 있었음. 평점 보고 고민했는데 보길 잘했음.",1,story
34,gooood gooood gooood,1,story
35,뭔가 심오하다 신기하다 뭔가 소름도돋고,1,story
36,뭐지.... 아. 그냥 열린 결말이면 다니.,1,story
37,"손석구님 보는 맛도 있었고, 온라인 세상에 대해 일장일단에 생각해 볼 지점이 있었어요",1,story
38,시간이 갈수록 뭔가가 아쉬운 이야기. 배우들 연기도 좋고 소재도 좋다. 다만 요즘 기자들에 대한 인식이나 주요 캐릭터에 대한 선정이 아쉬웠다는게 너무 큰거같다. 영화본이후 알아본 바로 원작에선 주인공이 댓글부대던데 확실히손석구의 캐릭터보다 그쪽이 비중이 크다는게 다가와서 참 아쉽다,1,actor
39,지루함 결말도 흐지부지,0,story
40,실화 영화답게 화려함은 없다 다만 우리나라에 몇 없는 저널리즘 영화가 나왔다는게 반갑고 감독의 시도가 멋있다 배우들의 연기는 말할것도없고 손석구 연기가 너무 좋았음,1,actor
41,ㅋㅋㅋㅋ어려운영화...,0,story
42,반전이 숨어있는 영화! 뭐랄까.. 요즘 현실 세상이랑도 비슷한 풍경인 거 같고 댓글 하나로 사람을 죽일 수도 살릴 수도 있구나 싶어서 무섭네요 ㅠㅠ 배우들 연기도캐릭터들이 다 본인 옷처럼 잘 맞았고 잘 봤습니다!,1,actor
43,전형적인 용두사미형 영화.,0,story
44,지루하지 않고 꽤나 재밌게 봤다,1,story
45,배우들의 연기는 좋앗으나 결말이 조금 미흡한것같습니다,0,actor
46,신선한 전개랄까 재밌게 봤어요,1,story
47,속도감 있는 연출이 좋고 배우 연기도 훌륭합니다. 웰메이드 수작임,1,actor
48,흥미진진하고 스토리 따라가며 열심히 추리(?)하느라 집중하며 관람했습니다. 배우들 전부 연기도 훌륭하고 추천합니다^^ 영화 다 보고나서 감독님 인터뷰 내용 확인하니 궁금했던 부분도 해소되고 감독님이 의도한 부분도 알게되고 좋았습니다. 영화본 후 감독님 인터뷰 보시는것도 추천!,1,story
49,내용 구성이 부실하고 배우의 연기력에 너무 의존한다는 느낌을 받았어요.,0,actor
50,엥? 싶음 진심 뭐... 어찌됐든 재밌게 봤습니다,1,story
51,생각했던것 보다 그렇게 재미있지는 않았습니다 스토리가 들쑥날쑥 어지러웠습니다. 최민식 우정출연인지 특별출연 인지 짧게 나왔내요 ㅋㅋ,0,story
52,bshsjshshsvdhdbf,1,story
53,용두사미 하고싶은 이야기가 뭔데,0,story
54,몰입도있고 좋았습니다,1,story
55,확실한 건 재밌습니다 ….,1,story
56,즐겁게 봤어요 그냥 딱 킬링타임용,1,story
57,너무너무너무 재미있게 잘 봤습니다,1,story
58,손석구님 나와서 봤어요,1,story
59,재미없습니다. 그냥 다큐보는게 낫습니다.,0,story
60,"이랬는데요, 요래 됐습니당. 거짓말이고 이렇게 됐습니당. 히히 속았죠? 사실은 이거였습니당.",0,story
61,불친절한 전개 실컷 설명해주며 막판엔 어설픈 오픈결말? 추천하긴 힘든영화,0,story
62,배우들의 연기력이 돋보이는 영화였습니다,1,actor
63,너무너무너무 재미있게 잘 봤습니다,1,story
64,재밌었는데 중간중간에 눈부신 장면이 많아서 힘들었음... 눈 아퍼,0,directing
65,"안좋은평이 많아서 걱정이 많았는데 걱정할필요없이 영화애 몰입했어요 호불호는 갈릴지언정 영화속 메시지가 주는 울림이 있기에 재밌는 관람이였습니다 앞으로도 이런영화가 계속 나오면 좋겠네용 감독님도 출연배우분들 모두 연출,연기 다 빠지는구석없이 좋았습니다!",1,actor
66,재미있었는데 중간에 살짝 지루하고 마지막에 뭔가 완벽히 끝난느낌이 없었어요,1,story
67,배우들의 연기가 좋아요.,1,actor
68,재미있게 보았습니다!!,1,story
69,볼만합니다볼만합니다,1,story
70,영화 재미나게 잘 봤습니다,1,story
71,재미있게 보았습니다~~~,1,story
72,살짝지루하긴했지만 잘봤어요 쏘쏘~,1,story
73,엄지로 누를 수 있는 건 키보드뿐만이 아니다,1,story
74,배우들 연기가 볼 만 했어요.,1,actor
75,미완성작 느낌.. 판다에 밀릴만 하다…?,0,story
76,재밌게 잘 봤습니다 ^^,1,story
77,재밌게 잘봤습니다...,1,story
78,"결말에서 힘이 빠지는게 다소 아쉬웠지만, 전개가 굉장히 치밀하고 재밌게 잘 봤어요! 어린배우들 연기가 진짜 좋았던 것 같아요",1,actor
79,아 이건 실존인가.. 현실인가.. 진짜 현실같은 픽션,1,story
80,재미나게 잘 봤습니다~~!!,1,story
81,영화가 뒤죽박죽인 느낌,0,story
82,거침없이 도착지를 향해 고속도로를 달리다가 출발지로 다시 유턴한 듯한 마무리. 그래도 시도는 좋았다,0,story
83,재밉게 본 영화 입니다 ^^,1,story
84,"와우,몰입도는 최고이면서 조석구님 연기도 돋보이고 느끼는게 많았다.거기 나온 조연들도 연기를 잘하고 또 보고싶은영화이다.",1,actor
85,진짜로 일어나는 일인가 의심되면서도 진짜 일어날 수 있는 일이다 생각되고 마무리가 다소 아쉬움,1,story
86,평점이 낮아서 기대 안 했는데 볼만한 거 같아요~,1,story
87,결론이 허무해서 더 좋음.,1,story
88,어디까지 사실인지 알수가 없다,0,story
89,댓글부대 결말이 애매해요,0,story
90,사실과 허구의 경계속에서 한번쯤 생각하게되는 영화네요,1,story
91,아주 재미있고 솔깃하네요,1,story
92,난해한 영화 이해하기 힘듬,0,story
93,현실에서 있을법한 이야기를 영화로 잘 그려내긴 한듯...,1,story
94,그냥저냥 그래요..흐지부지합니다 제값주고 봤으면 아까운 영화입니다,0,story
95,손석구는 기자가 맞긴 할까?,0,story
96,보고팠던 영화라 늦은감있지만. 잘보고왔어요~~~,1,story
97,지금도 어디선가 일어나고 있을 이야기,1,story
98,우리나라에서 이런 소재로 풀어내는 영화라니!! 재밌게봤습니다,1,story
99,쇼킹하면서 볼만 하네여.,1,story
100,생각보다 내용이 어수선하고 집중이 안됌 아쉽네요~~,0,story
101,"소재가 신선해서 좋았어요. 끝이 이상하다고 생각했는데, 지나고나서 앞의 내용들과 연관지어 생각해보니 이유가 있었다는걸 조금은 알 것 같아요.",1,story
102,나름 재밌음.사실인지 아닌지?,1,story
103,킬링타임용으로 재밌었어요:),1,story
104,후반부에 반전이 있네요 역시 인터넷도 사람도 믿을 게 못되네요.,1,story
105,무서운 스토리입니다. 앞으로 조심조심해야하겠습니다.,0,story
106,글쎄요 그냥 뭐 열린결말,0,story
107,영화가 많이 지루하네ㅠㅠ,1,story
108,나는 좋았는데 흥행 망한거보니 다들 별로였는듯,0,story
109,댓글부대가 대기업에 정규직이라니 진실일까?,0,story
110,미쳤어요 미쳤어요 배우님들 연기가 진짜 대박이에요 진짜 연기맛집이에요,1,actor
111,"아리송할 수도 있지만, 진한 여운과 생각하게 만드는 영화.",1,story
112,일단.. 호불호 갈리는 것 같은데 저는 재밌었어요! 진실보다 거짓이 섞인 진실이 더 진짜 같다는 말처럼 다양한 생각을 할 수 있었고 다양한 시도들을 보면서 재밌었어요. 영상도 예쁘고 연기도 너무 좋고 예고편부터 느꼈지만 소리도 너무 마음에 들어요. 재관람했는데 더 이해돼서 재밌네요.,1,actor
113,마지막이 조금 아쉬웠지만 재미있게 봤어요~,1,story
114,잘봤습니다 좋아요 감사합니다,1,story
115,뭔 얘기를 하고싶은 거야,0,story
116,약간 지루한 느낌이 드네요,0,story
117,흥미진진했고 연기가 좋았다,1,actor
118,"인터넷에 올라오는 글이 전부 거짓일 수도 있고, 사실일 수도 있다고 알려주는 영화",1,story
119,나는 별로요...12,0,story
120,설정이랑 나쁘지 않고 흥미로웠는데 결말이 아쉽....,0,story
121,2편 나오나요~~? 너무 열린결말..ㅎ 댓글 안믿은지 오래지만 영화보고 더더더 못 믿겠어요..ㄷㄷ,0,story
122,"이거 은근 재밌네 ~ 독특한 전개 , 멋진 손석구 ! ㅋㅋ",1,story
123,재밌어용!!!♥?♥?♥?,1,story
124,공감하면서 영화 관람했습니다.,1,story
125,생각 참 많이 하게 되는 영화라 좋았어용,1,story
126,엔딩 부분이 결론없이 끝나 약간의 아쉬움이 있었지만 나름 잼있게 긴장하며 봤네요,1,story
127,손석구의 연기는 정말 리얼하고 몰입되네요,1,actor
128,요즘 sns 많이하는 사람이라서 그런지 영화보는데 흥미있었고 현실 반영이 많이 된 영화라 재밌게 봤습니더,1,story
129,새롭고 현실고증 제대로인 영화,1,story
130,그냥저냥 쏘쏘~ 볼만했음. 마무리가 아쉬운 영화,0,story
131,손석구 때문에 봤는데 마칠때까지 먼가가 나올거같아서 기다렷는데 그게 마지막이 되버렷음,0,story
132,현실적인 영화네요 재밌게 잘 봤어요,1,story
133,내용자체는 신박한대 2기나올려고 하는곤지 끝맺음이 애매함 2기나오면 좋겠음,0,story
134,손석구 연기가 너무 잘했어요!!,1,actor
135,좋았어요 잘봤습니다 추천,1,story
136,화장실에서 볼일 보구 안 닦은 기분...,0,story
137,재밌어요 추천합니다 현시대를 잘 반영한 영화네요,1,story
138,새롭긴한데 끝이 난해하네요,0,story
139,스릴있고 빈틈없는 치밀한전개가 좋은영화,1,story
140,재미가 있는데.. 영화가 발단 단계에 서 끝,1,story
141,감독님의 의도처럼 관객들의 상상력을 자극하는 영화였습니다 !,1,story
142,완전 재밌게 잘 보고왔다. 흥미진진해서 영화 볼 때 잘 자는 프로 숙면러인데도 한번도 안 졸고 봤다.,1,story
143,반전이 있는 영화!!!,1,story
144,손석구님 연기가 좋았어요!!,1,actor
145,영화 댓글부대 좋았어요,1,story
146,잘 보았습니다~ 신선한 영화네요,1,story
147,정말 재밌습니다요 상상력울 자극하는 책과 같은 작품,1,story
148,"댓글부대, ,여론형성과 가짜뉴스의 폐해를 알리기 시작한 영화, ,",0,story
149,새로운 사실을 알게하고 내가 가끔 다는 댓글에도 신중을~내댓글이 남에게 엄청난 피해를 줄 수 있다. 댓글은~ 진실만 있는 진실일 수 없고 진실과 거짓이 조금 합쳐진 진실일수 있다는 사실에 댓글을 믿어서는 큰일난다,0,story
150,진실과 거짓의 경계는 과연..,1,story
151,이것이 사실이다 참 안타까운현실,1,story
152,손석구만 좋늠ㅇㅇㅇㄹㄹㄹ,1,story
153,재밌었어요ㅎㅎㅎㅎㅋㅋㅋ,1,story
154,꽤나 몰입력 있는 영화! 바지막 반전이 최고,1,story
155,적극추천한다.요즘 시대에 딱 어울리는 .긴 여운을 남기는 영화다.,1,story
156,그냥저냥 볼만했어요 킬링타임,1,story
157,거짓과 진실..헷갈려서 찜찜해요,0,story
158,내가 너무오락영화에 길들여져있었구나. 미안타. 그냥그랬어,0,story
159,손석구의 눈빛은 항상 진실.. 그리고 모든 사건은 현재진행형,1,story
160,연기 굿굿 손석구님의 톤이 넘 좋아요,1,actor
161,재미있네요ㅎㅎ편안하게 보기 좋아유,1,story
162,딸이 잼나다고 하네요 끝이~~,1,story
163,나쁘지않았었는데 마지막이 뭔가 정리도 안하고 급히 끝내려는 느낌이 강한 영화였어요.,1,story
164,언젠가 이 소재로 영화가 만들어질 것 같다는 생각은 했는데 드디어 만들어졌네요! 글이 여러가지를 움직일 수도 있다는 내용과 독특한 결말이 흥미로웠습니다^^,1,story
165,펜대하나가 세상을 움직일수있다는것이 속담예기인줄알았는데 댓글부대를 통해 현실적으로 와닿는다 뉴스에서 댓글로 세상이 떠들썩 했쓸때도 반신반의 했는데 지금에와서 생각해보니 공감이 간다,1,story
166,결말이 많은 생각을 하게 만드네요 ㅋ 뭔가 속시원하지 않고 더 답답한 결말이었어요. 뭔가 하나 해결되고 그 뒤를 캐는 과정에서 끝났음 그래도 좀 덜 답답했을텐데.,0,story
167,거대한 시스템에 도전하는 기자의 현실감 있는 내용과 배우의 연기가 실감 난다. 세상의 구조를 정확히 파악하고 있는 기자의 무모한 도전을 응원하는 심리가 발동하여 안타까운 마음과 애타는 마음이 내 자신을 감동 시킨다. 결말을 보여주지 않는 것도 내 자신을 영화에 참여하게 만든다.,1,story
168,퇴근하고 본다는 게 내 실수인 거 같은데…,0,story
169,킬링 타임용 영화였어요...,0,story
170,중간에 나가고 싶었음... 손석구라도 이 영화는 못살리네요 ㅠㅠ,0,story
171,긴장감 넘치고 시간 가는줄 모르고 잘 봤어요,1,story
172,기대했는데 노잼입니다,0,story
173,너무너무 쟈밌습니다ㅠㅠㅠ강추요,1,story
174,실제로 일어날수도 있을법한이야기라서 더 무서웠어요 배우들연기도 최고 였어요,1,actor
175,시작부터 끝까지 계속 긴장감을 놓지 않게끔 계속 생각하게 만드는 영화였어요! 사람에 따라 결론을 바라보는 게 달라서 더 흥미로웠네요,1,story
176,캐스팅에서 이미 끝난 영화. 완벽한 배우들. 결말이 허무하다는 평이 많았지만 나는 오히려 결말을 보고 소름 돋았음 열린 결말로 호불호는 갈릴 듯,1,actor
177,"음.. 공감도 안되고, 왜 이렇게 만들었을까 하는 생각이 드네요.",0,story
178,에그지수도 혹시 만전?,0,story
179,독특하고 빠른 전개가 매우 좋았고 반전이 많아 보는 재미가 있었습니다! 배우 연기도 너무 좋았구요.,1,actor
180,재밌어요~ 재밌어요~~,1,story
181,너 말투가 왜 그래? 인터넷 많이 하는 사람같아... 에서 인터넷 많이 하는 사람이면 재밌게 볼 영화,1,story
182,굉장히 몰입되고 현사회의 문제점을 담은 영화인 것 같아 너무 흥미로웠습니다! 원래 평 절대 안남기는데 좋은 영화인것에 비해 잘 알려지지 않은 것 같아 남깁니다.. 결말이 좀 아쉽긴 하지만 2가 나온다면 모든게 다 용서될 것 같네요!ㅋㅋ,1,story
183,등줄기를 서늘하게만드는 현실고발영화 강추,1,story
184,재미있었습니다~ 짱~~,1,story
185,너무 재미있었어요 ㅎㅎ,1,story
186,계속 생각하게 만드는 영화..!,1,story
187,재밌게 봤어요 연기좋았어요,1,actor
188,어느정도 예상되게 흘러가네요,0,story
189,굿 재밌게 잘 봤어요 연기자 수고하셨습니다,1,actor
190,영화 잘만들었다 사회고발 영화는 언제나 환영,1,story
191,배우들이 연기를 잘해서 나름 재미있게 봤어요,1,story
192,쏘오써오… 별로얌.. 하지만 손석구 짱짱,1,story
193,결말이 아쉬웠어요~ 마지막장면에서 이제 드디어~통쾌함을 기대하려는순간 엔딩... 배우들의 연기는 좋았습니다~,1,actor
194,이건 결말도 없고 진짜 잠이오네여,0,story
195,실화를 모티브로 하여 뭔가 와닿고 영화 자체로는 재미가 있진 않았어요,0,story
196,손석구 연기는 리얼입니다~~~,0,actor
197,소재는 좋은데 지루했어요,0,story
198,현실감이 참 무서운 영화였음,1,story
199,현실성 높은 소재는 좋았으나 결말에 다다르는 씬은 아쉽다,0,directing
200,재미없고지루했습니다,0,story
201,다들 연기를 잘해서 재밋었다,1,actor
202,저는 진짜 재밌게 봤어요! 결말도 감독님께서 일부러 그렇게 하신거라고 하셨구 짱 잘만드신것 같스비다 강추 !,1,story
203,요즘 시기에 공감할 수 있는 소재의 영화입니다,1,story
204,세상은 결국 현실과 사실만 인정한다.,0,story
205,뒷 마무리가 허전했지만 그래도 볼만 했어요,1,story
206,그럭저럭 볼만한 듯요 ㅎ,1,story
207,나름 재미있게 봤어요. 연기도 괜찮습니다.,1,actor
208,왜 상영관이 줄었지. 좋은영화 잼있는 영화,1,story
209,볼만합니다 볼만합니다,1,story
210,시대에 걸맞는 세련된 사회고발,1,story
211,그래서... 본론은 언제 시작임?,0,story
212,반전의 반전을 거듭. 뒷이야기가 궁금해지는 영화,1,story
213,잘 봤어요^^ 배우분들이 좋네요,1,actor
214,재밌는데 왜 에그가 낮은지 이해가안됨,1,story
215,"결론이 뭐고, 어디까지 사실인지 너무 애매하네요. 혼란스러워요.",0,story
216,마지막이 좀 아쉽기는 하지만 내용이 재미있어요,1,story
217,댓글부대 재밋는 영화엿어요,1,story
218,오우 핵노잼이었습니다,0,story
219,그냥 손석구니까 본 영화..,0,story
220,만전그룹 진짜 대단! 권력과 맞서 진실의 편에 서서 투쟁한 모든분들을 응원합니다.,1,story
221,초반은 좋았는데….. 초반은….. 후반으로 갈수록 아쉬움이 많아짐. 더 좋은 영화가 될수 있었는데 아쉽네요.,0,story
222,개인적으로 올해 최고의영호ㅏ.,1,story
223,영화 관람했습니다 영화 관람했습니다,1,story
224,완전한 진실보다 거짓이 섞인 진실이 더 진짜 같다,0,story
225,지루하고 별로네요. 손석구 안 나왔으면 안봤을듯,0,story
226,영화에서 아재냄새 나요…,1,story
227,스릴있고 재밌게 봤어요,1,story
228,반전은 좋았는데 결말을 그렇게 놔두고 끝내면 뭐죠,0,story
229,수면제~잘잤음~개꿀잠,0,story
230,볼안해어요 손ㅅ서국이굿이,0,story
231,하놔참 낙인거같네 이야기끝맷음을하지않고끝나니까어이가없네....이게거진백만이나온다는게의문이네,0,story
232,가나다라마바사아차자자자자,0,story
233,무슨말을 하고자 하는지 의도는 알겠으나 영화중간에 보다 나온 기분은 뭘까...,0,story
234,"기대이상. 인터넷 세상의 무서움에 또한번 경악하게 됨. 거짓이 거짓같지 않은, 진실은 더 진실같은, 말한마디에 뒤바뀌는 판도. 당하고만 있지않는 손석구의 활약도 멋짐. 흥행도 쾌거 이루길!",1,story
235,몰입감은 있는데 좀 복잡하게 느껴졌어요,1,story
236,그래서 결말이 이영준을 찾았다는거야 머야 결말이 먼 지 모르겠네 손석구 아니였으면 개 폭 망 아 이미 폭망이지? 영화에 망한 영화 나와있는데 지 내용인가? 댓글로 올릴련가 손석구 이름좀 먹여서?,0,story
237,"영화 내용이 매우 난해하고 복잡한 듯(???)해서, 댓글 쓰는것도 조금 머리가 아픈것 같아요.",0,story
238,사실과 거짓 그 사이 어디쯤...,0,story
239,이게 뭐지~~ 손석구님 얼굴보는 걸로 만족합니다 ㆍ,0,story
240,미로같은 현실. 누군가는 큰 이득을 보고 누군가는 죄없이 스러져갔을.. 이야기 같은 현실~,1,story
241,보고싶어서 이제서야 봤는데 재밌었어요.,1,story
242,그럭 저럭 시긴 보내기 좋네요,0,story
243,적절한 사실에? 기반한 연출로 흥미진진하게 보았습니다. 여론에 대해 생각해볼 여지가 충분했습니다. 다만 결말에 대해 조금 어려운부분이 있었던 점은 아쉬웠습니다. 결론적으로 런닝타임 내내 즐겁게 보았습니다!^^,1,directing
244,음.. 애매 연기자들 연기력이 다함,0,actor
245,킬링타임용으로 재밌게 보았습니다 ^^,1,story
246,흥미진진하게 보았지만 결말이 조금...,1,story
247,이게 대체 무슨 영화인지...,0,story
248,"약간 무슨내용인지 모르갰긴한데,, 소재는 되게 자연스럽고 좋아요!! 열린결말이 약간 아쉬워요ㅜㅠ",1,story
249,실화바탕이라면서 엔드크레딧에는 허구래요!!! 뭐지!??? 너무 재밌었어요 ㅎㅎㅎ,1,story
250,배우들 연기가 볼만한 정도였고,1,actor
251,영화 재밌게 잘 봤습니다,1,story
252,재미가 있으려다가 말았네,0,story
253,재밌어요 강추합니다.,1,story
254,"재미없지는 않다. 그러나 관객들은 이런 연출과 스토리 진행을 좋아하지 않는다. 사실로 시작한다고 하고, 끝이 없으면 영화기 보여주려고 하는 내용을 너무 관객에게 예의없이 던져버렸다.",0,story
255,너무재미있게봤어요 한국영화화이팅,1,story
256,난 몰입도 최고였는데 왜 주변에선 재미없다하지..ㅠ,1,story
257,결말빼고는 흥미진진했어요,1,story
258,재밌게봤습니다 댓글부대,1,story
259,베우님들 연기는 원래 모두들 잘한다고 들었지만 막상 보니까 더 잘하십니다ㅠㅠㅠㅠ 강추강추 맛깔나게 잘하시는지…!.!.!.! 계속 보고싶은 영화입니다~!,1,actor
260,내용이 흥미진진하고 재미있었어요 기자에 대한 관심이생겼어요,1,story
261,ㅑ3ㅑ27🫠🎋냐28우38듕73ㅠ려윶ㄷ,1,story
262,하.... 홍경 나만 가질 거야 진짜 팹택 아... 홍경 아... 오빠 ㅠ... ㅠ... ㅠㅠㅠ....,1,story
263,나쁘지 않았음 ~~~~,1,story
264,그냥 몰입감이 있어요 약간 내용이 좀 어려운 면도 있는거 같아요 약간 지루하면서 재밌는 영화? 현실이 무섭다는 생각을 들게 해주는 영화 인거 같아요 ㅋㅋㅋ,1,story
265,드라마로 만들었으면 괜찮았을 소재,0,story
266,영화 관람 했습니다 영화 관람 했습니다,1,story
267,현실감 있게 해주는 영화. 몰입하게 한다.,1,story
268,볼 만 합니다. SNS 정보를 바르게 판단 할 수 있는 능력도 있어야겠다.,1,story
269,좋아요~!~!~!~!,1,story
270,소름끼쳤습니다. 배우들 연기도 좋았구요~,1,actor
271,아 그냥 이런 결말을 원한게 아닌데,0,story
272,별로 기대하진 않았는데 생각보다 재미있었어요! 한국영화는 저랑 안 맞나봐요😅,1,story
273,나름 신선해서 좋았습니다.,1,story
274,생각할 거리를 툭툭 던져줘서 재밌게 봤어요,1,story
275,초반부 스토리를 잘 끌어가다가 마지막 부분에 심하레열린결말이다 이런부분을 싫어하는 사람이라면 재미없게 느껴질거 같다,0,story
276,몰입도가 있는 영화 근데 엔딩은 급하게 끊는 느낌?,1,story
277,시간 가는줄 모르고 봤는데 먼가 찜찜^^,0,story
278,손석구가 아까워~~~~,0,story
279,볼때는 흥미진진.. 끝나고는 읭?,1,story
