index,Review,sentiment_predicted,category
1864,댓글의 영향력에 대해 새삼 무서움을 느꼈다..ㅠㅠ 그나저나 그래서 어디까지가 진실이고 거짓인지..?!!!!,1,story
1865,지루했어요. 사이다 결말을 원했지만,0,story
1866,심심할 때 보기 좋은 영화 재밌는 오락 영화엿어요,1,story
1867,Goodgoodgood,1,story
1868,재밌었다. 영화는 어디까지가 사실이고 거짓인가?,1,story
1869,숙면 취하다 왔네요~~~,0,story
1870,"반전의 반전. 거짓말이 교차하지만, 확실한 건 ""모든 것을 의심하라""라는 데카르트의 격언이 생각나는 영화입니다.",1,story
1871,너무너무 재미있고 감동적입니다.,1,story
1872,하 진짜... 밙도있고 너무 좋는데 똥덜닦은느낌.... 개인적으로는 조아하진않은스타일이라 막 추천은 못하겟어요 연기도 좋고 다조은데 열린결말조아하는 분들께는 강추,0,actor
1873,내용 전개 연출 신선했고 열린 결말이라 시원하진 않으나 오랫동안 생각해보게 만드는 영화였습니다. 그리고 팀알렙의 김성철 김동휘 홍경의 연기가 인상깊었어요.,1,actor
1874,너무너무 재미있고 감동적입니다.,1,story
1875,넘 재밌어요~ 배우들 한분한분이 다 잘하네요~^^,1,actor
1876,진짜 마지막 마무리 아쉽네여,1,story
1877,"한숨 잘까했는데, 못/잤/음. 졸잼. 몰입이 그냥됨",1,story
1878,중간쯤부터 스토리 전개가 전혀 예상이 안되기 시작함 .. 반전의 반전 또 반전 반전 기대 안하고 본 영화인데 기대 이상으로 흥미롭던 영화,1,story
1879,생각을 하게해주는 영화였습니다👍,1,story
1880,생각했던것보다 재밌었고 현실반영 굿,1,story
1881,반전에 반전이 있는 영화!,1,story
1882,너무 밋밋한 한국영화네 ㅋㅋ,0,story
1883,파묘만큼하는구만.. 유투브에서리뷰를머같이해서 괜히저평가됐네.,1,story
1884,스토리가 재미 있습니다.,1,story
1885,속고 속이는세상 힘없는. 사람만. X 고생....,0,story
1886,모호한 결말이 조금 아쉽다,0,story
1887,잘봤습니다~~~!!,1,story
1888,"모든 걸 의심하게 되는 영화. 지금 현실에서 일어나고 있는 일들은 과연 진짜일까? 배우들의 연기 덕분에 몰입도가 높아져서 좋았고, 새로운 연출을 볼 수 있어서 신선했어요 어두웠다가(과거) 밝아지는(현재) 부분, 화면비율을 다르게 한 부분 등.. n차관람 강추!!",1,directing
1889,기승전까지 좋았는데 결이 살짝 아쉽..,1,story
1890,나름 괜찮았어요 조금 아쉽긴함,1,story
1891,혼한하다 혼란해 그러니까 N차 고고,0,story
1892,돈 주고 볼 영화는 딱히.. 😭,0,story
1893,좋았어요 배우들 연기가,1,actor
1894,"많이 지루하네요,,, 생각보다 재미 없어요",0,story
1895,재밋게봄요 ㅎㅎ 추천추천,1,story
1896,신중하게 예매해야 하는 계기를 준 영화였네요,0,story
1897,평이 별로여서 기대가 낮았는데 생각보다 괜찮았어요,1,story
1898,재밌게 잘 관람했습니다,1,story
1899,약간 후회함... 돈주고 보기에 좀 그렇다.. 명절에 TV에서나 보세요,0,story
1900,지루하네요. 속 시원한 결말도 없고.,0,story
1901,댓글부대. 재밌게 봤어요~~,1,story
1902,좀 애매한..내용을 다루네요.,0,story
1903,친구사이에 미묘하게 틀어지는 감정 연기에 감탄했는데 결말이 쫌 아쉬움,1,actor
1904,2012년 대선쯤 국정원 여론 조작 사건의 모티브가 된 기자출신 장강명 작가의 동명 소설이 원작인 작품이다.원작을 아직 못봤는데 작품을 보고 한번 읽어보고 싶을 정도로 배우들의 열연에 심취하며 봤다.작품을 연출한 안국진 감독의 신작으로 열린 결말도 좋고 적절한 캐스팅과 연기도 인상적이다.,1,actor
1905,좋았어요 생각보다 ㅎㅎ 마무리가조금아쉽,1,story
1906,재밌게 잘봤습니다. 각종 커뮤 고증 진짜 잘함 ㅋㅋㅋ,1,story
1907,너무 모호한 그런 영화라서 너무 아쉬운 느낌.. 그냥 손석구 배우 보기 위해 있는 영화임,0,actor
1908,진실이 무엇이고 거짓이 무엇인지 혼란스럽게 하는데 이게 현실이라 더 무섭다.,1,story
1909,"""좀 애매한데 시간은 잘가네요"" 라는 평을 보았는데 완전공감~~",1,story
1910,영화가 다 끝났는데도끝난건가? 사실을 바탕으로 했다고 해서 뭔가 속 시원하게 마무리 될 줄 알았는데 아직도 진행형이라 그런지 좀 아쉽게 생각됩니다.,0,story
1911,평점이 높지 않아서 기대없이 봤는데 너무 재밌게 봤어요 몰입감도 좋고 연기는 뭐 말 할 것도 없고요 이 영화 관람평도 다 조작된 거 아닌지... ㅋㅋㅋ 영화에 나오는 짤들이 너무 날것?이라 이렇게 나와도 괜찮은건가 하면서 봤네요 ㅋㅋㅋㅋ 암튼 전 이 영화 추천합니다!!ㅎㅎ,1,actor
1912,초반의 몰입과 밀도를 끌고가는 힘이 턱없이 부족,0,story
1913,영화 재미있네요. 좋아요.,1,story
1914,지루해요 지루해요 지루해요,0,story
1915,우와~~ 기대 1도 안하고 불금을 놓칠 수 없어서 봤는데 현실감*몰입감이 아주 끝내줬어요!!^^ 댓글부대의 언론조작은 여전히 계속되고 있다는 마지막의 마지막 의 메세지까지... 답답했지만 그래도 희망의 끝을 놓지는 않았어요~,1,story
1916,다큐같은 영상이라 현실감을 더했고 혼란스러움,0,directing
1917,요즘 현대사회에 꼭 필요한 영화,1,story
1918,연기력 하나는 최고👍,1,actor
1919,인터넷 커뮤니티 주제라서 흥미로웠어요!! 배우님들이 연기를 다 너무 잘하셔여🔥,1,actor
1920,여기 관람평도 의심스럽게 보게 만드는 영화,0,story
1921,이렇게 끝나는 이유는 현재 진행형이기 때문일까,0,story
1922,모든 캐릭턱 연기 찰떡!!!,1,actor
1923,오늘 처음 봤는데 기대 이상으로 재밌었어요 몰입감이 엄청 났고 오랜만에 재밌는 영화 찾은 거 같아요 제 인생 영화👍🏻 다시 한 번 차분히 감상하러 오겠슴다,1,story
1924,볼만합니다 킬링타임용,1,story
1925,배우님들의 연기력이 영화를 잘 살려주신거 같아요!! 시사회때 배우님들 착장은 진짜 말모였어요!!ㅠㅠ,1,actor
1926,흡인력이 있는 이야기와 연기~ 마무리는 조금 아쉬움.,1,actor
1927,"흥미진진하고 끝까지 집중하면서 볼수있는 반전영화입니다. 많은 분들이 보셨는지 모르겠지만 최고의 반전은 영화 끝나고 제일 마지막 글입니다. 쿠키영상은 없지만 제일 마지막 ""자막"" 꼭~읽어보세요!!!!",1,directing
1928,이게 정말 최선인가.... 연출실패 연기연출도 펀집도.. 방향이 잘못되보임,0,directing
1929,좋아하는 배우 손석구씨나오기도하고 예고편봤을때 재밌어보여서 본영화인데 시간 맞아서 보게 되었어요! 실화바탕에 유명한 대기업을 언급하면서 시작해서 첨에 흥미진진했어요 근데 저는 차에서 본다고 맥주한잔했는데 그래서 그런지 뒷부분에선 계속 깜깜하고 어두운 장면나올때 쪼금 잠이왔네요,1,directing
1930,여기 댓글들은 진짜라고 생각하는건가,0,story
1931,굿굿 하고싶은 마음이 있습니다,1,story
1932,몰입해서 보다가 마지막에 엥? 했지만 새로웠던,1,story
1933,1번째 관람보다 2번째 관람이 더 몰입도 있었습니다 꼭 재관람 추천.,1,story
1934,"중,요한 건 임상진 기자의 꺾.이지 않는 마.음?! 진실과 조작 구분이 애매하다.",0,story
1935,ㅋㅋㅋㅋ 프라이드박스에서 잘잤어요^^ 이렇게 재미없는건 처음이에요.. 갠히 손석구님 나와서 봤는데 ㅋㅋㅋㅎ,0,story
1936,영화보고 왜 댓글에 엔딩 이야기가 많은지 알앗네요 한국사람들이 좋아하는 사이다는 아니고 열린결말인가? 싶은데 무언가 결론적이고 후속은 절대 안나올거 같은 그런 답답한 엔딩 근데 생각해보면 제일 현실적인 엔딩같긴하다 내용은 진짜 재밌었어요 굳,1,story
1937,생각보다 재밌고 생각보다 뻔함,0,story
1938,반전에 빈전~! 시나리오 하나는 인정!!,0,story
1939,영화 한 줄 요약 : 기자가 나락간 썰 푼다⭐? 열린결말이 아니라 결말이 없음...,0,story
1940,출발비디오 여행에서 본내용이 거의 전부인거 같아서 좀더 다양한 에피소드가 없어서 생각보다 별로 였습니다. 내용도 두리뭉실하고 스토리가좀 보강 되면 좋았을텐데 아쉽네요.,0,story
1941,쫌 애매한 영화 입니다 시간은 잘 가네요,0,story
1942,어렵지만 흥미롭고 암울하지만 답답하지 않은 영화. 진짜 실화라면 여기 글도....,1,story
1943,안 좋은 평이 많아 걱정도 됐지만 의외로 괜찮았음. 어디선가 실제로 벌어지는 일일지도.,1,story
1944,내가 지금까지 본게 뭐가 되니.,0,story
1945,몰입감있고 좋았어요~,1,story
1946,생각하게 만드는 영화이자 현실을 바라보는 눈을 가질 수 있게 하는 영화이다. 완전한 진실보다 거짓이 섞인 진실을 더 믿는 현실을 풍자하며 신선한 반전까지 포함하고 있다. 추천합니다!!!,1,story
1947,평타입니다. 그냥 킬링타임용,0,story
1948,나는 매년 4월 28일에 중경삼림을 본다. 이제 매년 만우절에는 댓글부대를 보겠다.,0,story
1949,"평소 안국진 감독님의 팬인 학생입니다.. 출연진의 연기력도 탄탄하고 감독님의 연출,각본은 역시 너무 완벽했습니다. 영화관에서 나온 후 계속해서 고민하고 생각해 볼 수 있는 영화는 흔하지 않은데, 여운이 남는 영화라 좋았습니다.",1,story
1950,있을법한 이야기라 흥미로웠습니다,1,story
1951,"선호하지 않는 장르임에도 배우 팬이여서 본 영화인데 웬걸 재밌었다. 호불호 있는 결말이지만, 결말 덕분에 여운도 남고 생각을 하는 시간을 가질 수 있었다. N회차 관람했는데, 처음 볼 때 못 본 부분이 재관람 시 보이고 작품 해석을 할수록 진가가 들어나는 영화! 배우들 조합도 굿굿",1,actor
1952,댓글부대는 존재하는거 같습니다ㅋㅋ,1,story
1953,내용이 흥미롭고 연출이 멋있었습니다!,1,directing
1954,큰 기대 안했는데 생각보다 재밌었다,1,story
1955,댓글부대 댓글부대 댓글부대 좋았어요,1,story
1956,"감독님 연출, 배우들의 배역에 찰떡인 연기, 장면 전환에 따른 스토리 전개, 마지막까지 놓치지 않은 반전. . . . 열린결말이 좋은 분은 극호! 완벽한 닫힌 결말을 좋아하는 분은 불호 하지만 전 극호였습니다. 댓글부대 최고🫶",1,story
1957,또 봐도 재밌었어요! 배우들의 연기가 좋았고 내용도 신선했습니다 ♡♡,1,story
1958,군더더기 없이 깔끔하고 재미있게 잘 만든 영화입니다. 배우들 연기도 좋았고요. 열린결말은 호불호가 갈릴 것 같습니다.,1,actor
1959,"계속 집중하게 만드는 스토리와 연출, 장면하나하나 놓칠 수가 없었어요.",1,directing
1960,"내가 믿는 것이 진실, 아니면 말고 식의 혼탁한 사회를 꿰뚫는다.",0,story
1961,와 너무 잼있게 잘본듯 괜찮네요!,1,story
1962,기자를 속여라 ㅋㅋㅋ 손석구 배우의 연기 덕에 꿈뻑 같이 속았네요.,0,actor
1963,"생각의 여지가 충분히 열려있고 연출, 연기력, 흡입력 모두 좋았던 영화였다고 생각합니다👍 요즘 제가 세상을 살아가면서 느끼는 부분에 대해서 다루고 있어서 더 집중해서 보게된 것 같고 정말 어디서부터 어디까지가 진실인지 다시 한번 보면서 생각하고싶게되는 작품이었어용💙",1,story
1964,그 어떤것도 진실이 아닐 수 있다,1,story
1965,조금 난이도가 보이는 영화입니다.,0,story
1966,"불명확함으로 완성한, 완벽한 원을 보았다. 넘치지 않아서 좋다",1,story
1967,이 모든게 사실일까? 댓글부대 이 영화도 못 믿겠다~~ㅎㅎ,0,story
1968,실화였군요~ 너무재미있어요,1,story
1969,어디엔간 있을법한 사람들,1,story
1970,어지럽다 어지러워..,0,story
1971,무슨 내용인지.. 후기가 별로라서 고민하다가 봤는데 팝콘이 젤 맛있네요,1,story
1972,넷플릭스 단독 영화 같은 걸 영화관에서 본 느낌이었다 초반엔 재밌는데 좀 끄는 느낌이 있고 실화를 바탕으로 했다고 하니 만전이 뭔지 알고 보면 더 재밌을듯하다 그리고 중간에 불필요한 욕들이 너무 많아서 한 달치 욕 다 듣고 온 기분이었다,0,story
1973,내용이 좀 어려워요..제 스타일은 아닌듯,0,story
1974,사실 아직까진 영화의 내용이 뭐가 맞는건지 오묘한데요. 그래서 더 이 영화의 의미가 완성되는게 아닐까라는 생각이 들어요!-! 너무 흥미진진하게 봤습니당 굿굿~,1,story
1975,와 진짜 이런 일이 이 국가에서 백퍼 일어날 것 같아서 놀라지는 않았는데 그 작업치는 과정이 지렸다. 진정한 공포영화였다.,1,story
1976,"할말이 없다 할말이, 신발",0,story
1977,완전 재미있습니다. 추천합니다.,1,story
1978,후기 처음 써봅니다! 좋아하는 배우님들 나와서 기대는 했지만 후기가 좋은 것 같진 않아 걱정반 기대반이었는데 기대 이상으로 너무 재밌게 봤어요! 연기 구멍 하나 없이 너무 탄탄하고 몰입해서 시간 가는 줄 몰랐네요~ 요즘 사회를 담아낸 것 같아서 생각이 많아지는 영화였어요!,1,actor
1979,왠만하면 댓글안쓰는데 여기부터가 여론조작하고있네ㅋㅋㅋ 결말이 이게 끝날 타이밍이냐ㅋㅋ,0,story
1980,그냥그냥 무난무난 하게봤습니다,0,story
1981,그냥저냥 요새 영화가 다 별로네,0,story
1982,재밌는데 왜 사람들이 안 보지??,1,story
1983,손석구님의 이끌어가는 연기가 일품이네요,1,actor
1984,영화 잘 만들었고 배우 연기가 좋네요,1,actor
1985,서사부터 스토리 탄탄하고 몰입감 미쳤어요 ㅠㅠ,0,story
1986,배우들 연기 덕분에 잘 봤어요,1,actor
1987,연출이나 스토리가 참신해서 보는 내내 흥미진진햇어요. 계속 되는 반전에 긴장하면서 봤구요. 많은 생각을 하게 되는 영화였던 것 같아요. 사실 결말 보고 조금 아쉬움? 제대로 마무리가 되지 않은 느낌이 있었는데 그것도 감독님의 의도가 있었겟죠. 그래도 여러 해석을 하게되어 재밌었어요,1,story
1988,의심하고 의심하고 의심하는 사이 진실도 그 속 어딘가에 휩쓸려 바람과 함께 사라진다 / 마무리는 아쉽다,0,story
1989,"많이 헸갈려요, 조금 답답해요",0,story
1990,열린결말이라고 해야할까 어쨌든 재미있게 봤고 많은 여론에 휩쓸리고 있는 우리의 모습을 볼 수 있었다..,1,story
1991,감독의 의욕이 과한 느낌. 실화라고 못박지 않았으면 더 몰입이 됐을 것 같다.,0,story
1992,홍보는 완전 재밌게 해서 기대했는데 생각보다 재미없었어요..😔,0,story
1993,조금 어렵네요 무엇이 진실인지 헷갈리네요 결말이 많이 아쉽습니다~,0,story
1994,진짜... 이렇게 재미없는 영화 오랜만에 봐서 졸려 죽는줄 알았어요,0,story
1995,내용은 재미있게 봤으나 결론이.. 똥싸고 그냥 나온 기분이에요,0,story
1996,손석구 최고~~!!!! 넘흐 잘생겼다리,1,story
1997,어디서부터 진실이고 어디까지가 거짓인지 계속 생각하게 하는.. 다시 보러 갑니다,1,story
1998,소재 신선하고 괜찮긴한데 중간에 조금 지루한 부분이 있네요..,0,story
1999,손석구 보러 가면 재밌는 영화,0,story
2000,"강렬한 화제, 그에 미치지못하는 평범한 결말",0,story
2001,나름 젛앗어요 무엇이진실인지 해갈리는 배우 영화 연기좋아요,1,actor
2002,거짓과 진실의 그 중간 어딘가,0,story
2003,"마치 내가 기자가 된 것 같은 몰입감, 진실을 파해치는 사람들의 이야기로 깔끔, 명확한 전개가 완벽했던 영화",1,story
2004,볼만했어요 열린결말은 조금 아쉽,1,story
2005,결말 호불호 갈릴 것 같아요 저는 좋았습니다 스릴 있고 진박감 있었어요 스토리 끌고 가는 힘도 좋았고 주조연 다 연기를 너무 잘해서 더 몰입 됐던 것 같아요 한국영화에 기대 잘 안 하는데 넘 만족했음 추천이요,1,actor
2006,원작 보고 보니까 훨 재밌네요!! ㅋㅋㅋ 열린 결말이어서 전 오히려 거 좋았던 것 같아요 ㅎ 상상력 풍부해지는 느낌!!! 여러분 원작 꼭 보세요 재밌읍니답ㅎㅎ,1,story
2007,영화를 보며 새롭다라는 생각이 든 것은 처음으로 어디까지가 진실이고 어디까지가 거짓일까 계속해서 생각하게 됩니다 한번만 보고 끝내는 것이 아닌 두번 세번 보며 숨겨진 요소들과 영화의 메시지를 다시 생각해보는 것을 추천합니다👍,1,story
2008,이 영화의 리뷰마저 여론 조작이라면..?,0,story
2009,뜻깊게 보았습니다 세상이 무섭네요ㅠㅠ,1,story
2010,손서구 나온다해서 봤는데 그냥 그랬다. 뭔 내용인지도 모르겠고 복잡하다.,0,story
2011,도대체 진짜는 무엇인가?,0,story
2012,"영화 스토리가 생각보더 신박했어요,, 요즘 영화와 다른 느낌이에요",1,story
2013,손석구 나온다해서 봤는데...,0,story
2014,반전의 반전의 반전의. 재밌었습니다,1,story
2015,보는내내 되게 재미있게 봤어요,1,story
2016,성처리 짱… 다른 배우분들 연기도 그냥 짱… 성철이는 매력이 철철철…이라서 이름도 김성철…인건가??,1,actor
2017,나쁘지 않게 봤습니다 재밌었어요!,1,story
2018,김성철 연기 정말정말 잘하구요.. 배우님은 그냥 사랑이고요 얼굴도 잘생겼고 연기도 잘하고 멋있고 표현도 잘하고 이하 생략.. 보면 볼수록 숨겨진게 보여서 재밌습니다,1,actor
2019,"처음에 볼때 결말부분에서 띠용하긴했는데 나중에 이해할 수 있었고 좋아하는 배우분들도 나오고 재밌었어요,,👍",1,actor
2020,"결말의 대한 호불호는 어쩔 수 없다 보지만 이런 결말이기에 난 더 큰 여운이 남는, 찝찝한거라기 보단 그냥 진짜로 여운이 남는 딱 그 정도다. 그래서 몇 번 더 보고 싶단 생각이 들고 말그대로 '영화' 그 자체를 정말 잘 만들었단 느낌을 받았다. 앞으로 이 영화를 애정하겠다. 매력적이다.",1,story
2021,스토리가 연결이 잘 안되는 느낌.... 끝부분도 별루...,0,story
2022,음 끝이 약간 흐지부지되서 살짝 아쉬웠네여,0,story
2023,눈앞에 보이는 모든 걸 믿지 마시오,0,story
2024,재미있어요 결론을 잘 모르겠어요 ..,1,story
2025,우린 무얼 위해 사나요?,0,story
2026,반전에 반전 몰입감 최고입니다. 재밌고 은근 이야기가 소오름 돋고 결말도 신박해서 다시한번 생각해보게 되서 좋았어요,1,story
2027,조금 지루했지만 재미있게 봤습니다:),1,story
2028,기대하고봤는데 별로네요,0,story
2029,다회 관람했는데 다시 보면 더 재미있어요! 혼자 봐도 미치고 가족 친구와 함께 감상하고 입이 마르게 대화할 수 있어요. 주변에 어그로꾼을 먹여 살리는 이들이 있다면 주의 주기에 딱이에요. 자세를 바꿔 주는 영화예요. 보고 나서 감독님께 더 큰 관심이 생겼고 배우님들께 완전히 매료돼 버렸어요.,1,actor
2030,재밌게 잘봤어요 연기 너무 좋아요,1,actor
2031,익명의 사칭과 사기ㆍ조작의 공간ㆍ가상의 공간ㆍ누구든 당할수 있는 공간. 거짓으로 상대를 이용하는. 한번 당하면. 또다른 이의 표적으로 이용될 수 있는. 여론도 거짓 댓글로 조작될 수 있는 세상. 결론의. 버킹검..??? 댓글은. 그냥 각 개인의 생각ㆍ의견일뿐. 그 이상도 그 이하도 아니다라고..,0,story
2032,나쁘지 않게 봤어요 ㅎㅎ,1,story
2033,지루할 영화는 분명 아니었는데 저도 모르게 중간에 졸았습니다 좋은건 아닌데 그렇다고 나쁘지도 않은,0,story
2034,입안에는 씁쓸함만 남겼네.,0,story
2035,2프로 부족한 느낌 하지만 감독의 의도가 아니었을까 하는 의구심도 드는 결말 댓글을 가능한 안 보는 게 건강에 좋겠다는 생각을 하게 만든 영화,1,story
2036,"배우들 얼굴이 전부 재미있네요 앵글을 돌릴 때마다 너무 기분이 좋있습니다 ㅎㅎ, 재밌었어요~^^",1,directing
2037,흥미롭게 나름 잼나게 봤어요 배우들의 연기가 반은 먹구 드감요~~!!,1,actor
2038,영화 재밌게 잘봤습니다,1,story
2039,"보는 내내 많은 생각을 하게 되는 영화였어요. 어디까지가 진실이고 거짓인지, 불편함을 주는 결말까지 좋았습니다. 그리고 배우들의 열연에 몰입해서 흥미진진하게 본 것 같아요!",1,actor
2040,예상은 했지만 반전이 스며든..묘한,1,story
2041,재미있게 보고 갑니다 좋았어요,1,story
2042,배우분들 연기 최고예요! 몰입도 좋아요,1,actor
2043,그냥 그럭저럭 볼만하다 반전이 있음.. 근데 맘에 안드는 반전 내용임..,0,story
2044,뭔가 집중이 안되네요.,0,story
2045,진짜 재밌었음.. 결말이 아리까리 하지만 재밌게 봣어용,1,story
2046,진짜.. 어디서부터 진실이고 어디서부터 거짓인지 알지를 못하겠어요..,1,story
2047,정말 영화보는내내 긴장감을 가지고서 보고 인테넷댓글에 또한번 놀랬습니다^^,1,story
2048,재밌었습니당ㅎㅎ 썰풀어주는 느낌,1,story
2049,현실성있는 소재의 영화입니다,1,story
2050,손석구씨 기자 연기 너무 최고였어요 다른 배우분들도 연기를 너무 잘해서 몰입감 최고,1,actor
2051,깊은내막의 무서움을 보여주네요,1,story
2052,이야기 꺼리가 많은 영화네요~ 생각도 많이 하게되서 관람 후 각자의 생각과 해석을공유 하며 많은 이야기를 나눌수있어서 너무 좋았습니다 배우님들 연기도 너무 좋았고 각본도 좋았습니다 가족과 함께 보면 시대별 다른 느낌이 있어 굿일듯 합니다~ 열린결말이 더 좋은것 같아요,1,story
2053,대한민국의 현실이다 이런 류의 영화가 많이 나왔으면,1,story
2054,기대 안하고 봤는데 너무 잼있었어요 몰입 되더라구요 앤딩크레딧 끝까지 보고 나오세요 ㅋ,1,story
2055,긴장감이 있는 현실같은 영화,1,story
2056,댓글 너무 섬뜩하고 무서운듯 ㅎ,1,story
2057,다들 결말이 별로라던데 나는 오히려 이런 결말으로 끝내서 더 좋았음,1,story
2058,가볍게 보려고 했는데 생각보다 몰입감 엄청 나서 시간 가는 줄 모르고 봤었네요 파묘 보다 훨씬 재밌게 봤네요 재밌습니다 댓글알바 아닙니다 ㅋㅋ,1,story
2059,가벼운 영화일줄 알았는데 끝나고 여운이 남는 영화,1,story
2060,역시손석구배우님좋아요댓글부대들이소설쓰는거하며그것이돈이된다니신기하네요^^,1,actor
2061,그래서 진실은? 영상이랑 음악도 몰입도 높이는데 한 몫함,0,directing
2062,완전히 거짓은 아닌 이야기 많은 생각을 하게 되네요 두번봐야되겠음.,1,story
2063,재밌었어요~ 실화라는게 더 놀랍네요👍,1,story
2064,잼있게 봤어요 또 볼거에요,1,story
2065,볼만해요 재밌어요 생각하지 못한 결말,1,story
2066,좋았어요영화추천합니다,1,story
2067,네 명의 배우를 보는 것으로 만족,1,actor
2068,원작 대비해서 좀 심심한 느낌도 있었지만 전반적으로 재밌었어요 팀알렙 배우들 연기 좋았어요,1,actor
2069,조금은 생소한 소재긴 하지만 이게 실화라는 게 더 놀랍다,1,story
2070,글이란게 사람을 죽일수두 있는거구나 싶었어오,0,story
2071,음 쫌더 파봣으면 하는 아쉬움이 있었습니다.,0,story
2072,댓글로 사람을 죽음으로 몰고 가는건 쉬운것 같습니다~~씁쓸...,1,story
2073,솔직히 예고편이고 시사회평 다 안보고 그냥 갔는데 생각 이상으로 괜찮았어요!! 보고 나오니깐 지나가는 사람들을 보는 시선이 바뀌게 되더라구요~ 그리고 세상에 많은 정보중에 정말 정확히 판단하기어렵지만 내 주관을 가져야겠다는 생각도 들었어요.,1,story
2074,이 영화 보고 계속 생각과 생각을 하게 만드는 작품 같애요 좋았어요,1,story
2075,지루하지않고 재밌어요,1,story
2076,"영화의 이야기마저 의심하게 만드는 결말,,그래서 더 재밌었습니다~",1,story
2077,이 관람평이 안좋은 댓글도 댓글부대로 보인다,0,story
2078,생각보다 재밌고 흥미진진했다,1,story
2079,어 진짜? 후다닥~ 아 진짜?? 후다닥~~,0,story
2080,거짓말의 거짓말의 진실 속의 진실... 재밋네욤,1,story
2081,현대사회에 병폐를 보여주는 영화입니닿누구나 한번쯤 피해자가 될수도 있고 가해자가 될수있다는 생각이 듭니다,0,story
2082,처음에는 기대가 안되었지만 뭔가 곱씹게 되는 영화,1,story
2083,재미 없진 않았는데 댓글조작 하지말자 확실한 뉴스좀 잘내고,1,story
