index,Review,sentiment_predicted,category
548,작년여름 디데이콘때문에 행복했었다. 윤기말대로 공백기 를 꽉꽉 채워주어서 너무 고맙다 ㅠ 또 보러 가야겠다.ㅠㅠ,1,story
549,입 다물지 못하고 시간 가는 줄도 모르고 행복했어요💜,1,story
550,미치겠다 윤기야ㅠ 내내 입틀막ㅠ 넌 정말 최고야 너무 멋져!!!!,1,story
551,윤기야!좋았어여!보래해! ♡,1,story
552,찐 공연 찐하게 잘하는 내 가수. 23년 8월의 감동을 다시 생생히 느낄 수 있어서 정말 행복한 시간여행이었습니다. 2회차 관람하러 갑니닷!,1,story
553,윤기가 콘서트를 사랑해서 그런지 사랑이 가득찬 디데이콘서트는 그 어느 콘서트보다 뜨겁고 벅차다,1,story
554,뛰어난 퍼포머이자 최고의 아티스트의 음악에 대한 신념과 무대를 향한 뜨거운 열정을 살짝이나마 엿볼 수 있는 소중한 콘서트 실황 영화였습니다. 뮤지컬 영화를 사랑하시는 분들에게 추천합니다.,1,directing
555,윤기도 무대도 밴드도 IMAX도 모든게 갓벽! 디파콘 다시 되돌아가고 싶다고 아미들끼리 엄청 얘기하는데 이렇게 다시 즐길 수 있어서 너무 좋아요!!,1,story
556,"공연을 직접 봤던 사람도, 보지 못했던 사람도 감동을 느낄 수 있는 시간이었습니다!!!! 역시 방탄 소년단!! 역시 민윤기!!!!",1,story
557,정말 최고의 공연입니다!!,1,story
558,이번에도 n회사 관람 볼 수 있게 여러가지 이벤트 해준 cgv 운영도 조금 더 신경써주시길 바랍니다 콜드컵 개봉 첫 날 1회차 매진이 실회냐고요 ㅠㅠ,0,story
559,디데이 파이널 막콘은 내 인생 최고의 공연,0,story
560,너무너무 재미있었습니다 콘서트 못 간게 후회될 정도로 영상 속 슈가가 행복해보이고 즐기는 모습이 멋있어보였어요 무대 연출도 멋있고 멤버들이 함께한 무대도 이번 영화에 있어서 너무 반갑고 행복했고 음향도 진짜 콘서트에 온 거처럼 좋아서 영화 상영 끝나기 전에 몇 번 더 보려구요!,1,directing
561,첫 솔로 콘서트였던 디데이 투어를 다시 볼 수 있어서 좋았고 중간중간 윤기 인터뷰랑 나레이션도 나와서 좋았어요! 그리고 무엇보다 민윤기가 잘생김^_^,1,story
562,다들... 무조건 싱어롱으로....ㅠㅠ 시간 안돼서 집 근처에서 봤는데 소리 못 내고 고통스러웠어요ㅠㅠㅠ,0,story
563,행복하고 사랑 가득한 윤기 표정과 몸짓과 귓가에 때려박는 노래들💜💜💜 그때 추억과 감정들이 생각나서 너무 좋았습니다🥰,1,directing
564,그냥 정말 너무 좋았어요..,1,story
565,"슈가..스테비아, 제로슈가",0,story
566,콘서트 못 가서 아쉬웠는데 이렇게 영화관에서라도 볼 수 있어서 너무 좋았습니다! 공연을 사랑하는 윤기의 모습을 보니 빨리 다시 보고 싶네요:),1,story
567,잘생긴 얼굴과 멋있는 목소리를 약 90분 동안 보고 즐길 수 있어서 너무 행복했어요 내일 또 보러 갈 거예요..,1,story
568,IMAX관이 아니라 좀 작긴했지만 쾌적하게 잘 봤어요.,1,story
569,"뜨거웠던 지난 2023년 8월 때로 다시 돌아간 기분이었어요. 커다란 스크린, 온 몸을 휘감는 듯한 웅장한 사운드는 몰입감을 더 높여주었고요. 아티스트 본인, 게스트(정국, 지민, RM), 밴드, 댄서들, 그리고 그의 팬인 아미들과의 교감도 잘 느낄 수 있었던 영화였습니다. 강추합니다!!",1,story
570,너무 멋진 콘서트의 감동 다시 느낄수있어서 좋았어요 아포방포💜,1,story
571,공연장에서 직관 하는것처럼 느껴질만큼 사운드도 영상도 최고였어요! 다음주에도 또 예매해서 다녀올 계획입니다,1,directing
572,"화질, 사운드, 나레이션 등등 모든게 다 좋았어요. 영원히 잊을 수 없을 것만 같던 그 때를 다시 회상할 수 있어서 행복했어요!",1,story
573,SUGA×BTS 최고의 시간 💕,1,story
574,빨리 2025년이 되어 투어를 다시 보고 싶네요 너무 좋왔어요 다만 대구에도 싱어롱해주세요,1,story
575,민슈가천재짱짱뿡뿡맨은 역시 최고였습니다. 눈으로는 화면가득 윤기를 보고 귀엔 오직 윤기의 목소리로 가득찬 아이맥스 미쳤어요. 작년 8월 이후 디데이콘서트로 지금까지 버텼다고 생각했는데 윤기의 큰 그림인걸 알고 난 후 감동먹은 사람 여기이써효.. 아무튼 디데이 더 무비 7번 봐도 좋음,1,story
576,"역시 아이맥스👍 음향이 너무 좋아서 더 몰입할 수 있었다. 화면은 말모. 다만,, 무음처리된 부분들이 가장 기대했던 부분이라서 허전함때문에 아쉬웠다..",1,directing
577,그날 그때의 감동이 다시 느껴지면서 또 한번 나에게 살아갈 힘을 주는 내 평생의 아티스트💜👍,1,story
578,모든 영상이 좋았어요 CGV에 아쉬운건 사운드가 작아서 그게 조금 아쉬었어요 다른곳도 똑같은지 모르겠지만 오늘 첫날이어서 그런건지 사운드를 좀 더 크게 틀어주셨으면 해요,1,directing
579,가수는 콘서트를 해야한다고 말하는 아티스트입니다. 음악을 진심으로 사랑하고 즐기는 사람임을 느낄수 있었어요...진솔한 자신의 이야기 부터 팬들을 사랑하는 마음까지 느껴지는 영화였습니다. 일반인인 저희 어머니도 즐겁게 관람하셨어요!,1,story
580,작년 8월로 돌아간듯한 기분 스크린 속의 공간이 미친듯이 그립다 시간을 되돌리고 싶을만큼ㅠ,0,story
581,"무대, 영상미, 라이브 그리고 민윤기.... 사운드 너무 좋았고 무엇보다 너무 보고싶었던 윤기오빠 다시만난거같아 너무 좋았어요💜 무대가 힘들고 지친공간이 될 수 없게 만들어드리지요🫶🏻 선물 고마워요🥹💜",1,story
582,역시 민윤기... 너무잘해....😭 작년 여름 콘서트때의 기억이 새록새록...,1,story
583,너무 재밌었고 우리 윤기와 멤버들의 콜라보무대도 너무 좋았습니다!,1,story
584,고맙고 또 고맙다 다시한번 큰 위로를 받음,1,story
585,다시금 불어오는 그때의 기억,1,story
586,"슈가, 어거스트 디, 민윤기. 공연을 정말 사랑하는 이 사람이 디데이 투어를 어떤 마음으로 준비하고 또 얼마나 많은 노력을 들여 완성했는지 새삼 느낄 수 있는 소중한 영화였어요. 파이널 무대를 봐서 행복했고, 행복해 보여서 행복했고, 앞으로가 기대되어 또 행복했습니다. 잘 봤습니다. 감사해요!",1,story
587,윤기오빠콘서트영화 너무너무 잘봤어요😍😍😍😍😍😍 윤기오빠 콘서트영화 대박나셨으면 좋겠어요😍😍😍😍 방탄소년단 BTS 윤기오빠 뽀에버😍😍😍😍😍😍😍😍,1,story
588,역시 아이맥스..ㅎ 슈가 특유의 스타일이 정말 고스란히 담겨있어요. 역시 공연을 많이 한 게 티가 납니다. 정말 너무 잘해요. 그리고 스크린 너머로 느껴지는 포스가 진짜... 압도적이에요. 관중을 아우를 줄 아는 가수예요. 영화 중간마다 나오는 코멘트도 있는데 덕분에 완성도가 더 높아진 듯해요.,1,story
589,내 인생 가장 뜨거웠던 여름으로 남을 작년 8월 디데이투어. 현장에서 느껴졌던 열기가 고스란히 담긴 영상과 음향이에요. 그리고 현장에서는 고조된 감정에 살짝은 놓칠 수밖에 없었던 디테일한 부분들을 제대로 느낄 수 있었구요. 중간중간 아티스트의 멘트들이 있어서 더욱 몰입되는 영화였습니다.,1,directing
590,오랜만에 도파민이 싹 돌았습니다,1,story
591,작년 여름 체조로 다시 돌아간 기분이었어요 윤기와 정국이 지민이 남준이 무대도 너무 좋았고 공연에 대한 윤기의 진심을 보여주는 영화입니다 너무 행복한 영화였어요,1,story
592,윤기야 서울콘 이후로 아직도 헤어나오지를 못하고 있는데 그때의 감동을 다시한번 느꼈어 지금은 훈련 열심히 받고 있겠지? 아미밤 상영회가서 목이 터져라 불러줄게 네가 자랑스러워,1,story
593,12세 관람가라 묵음 처리가 많아 아쉬웠지만 공연은 다 좋았습니다!,1,story
594,처음부터 끝까지 윤기의 진심을 느낄 수 있어서 좋았습니다. 음악과 공연 그리고 팬들에 대한 진심이요. 그리고 무엇보다 콘서트의 열기를 일년이 지나 다시 느낄 수있었다는게 눈이 시리도록 좋았어요. 우리가 다시 만날 2025년을 기대합니다.,1,directing
595,영화를 보면서 그때 그 느낌 희열까지 느껴졌어요 콘서트장에서의 추억이 생생한데 다시 한번 몸소 느끼게된...🥹 내 눈으로 보지 못했던 디테일한 무대모습까지 한번 더 볼 수 있었고 무엇보다 중간중간 윤기 멘트에서 큰 감동도 받았고 영화 잘 즐길 수 있게 흐름도 잘 이어져서 좋았어요!,1,story
596,그때의 감동이 다시 살아나서 정말 좋았습니다 윤기 최고야 싱어롱만 기다려요💜,1,story
597,슈가라는 사람이 무대에 어떤 마음인지 알기 좋은 영화입니다 늘 응원할게요 방탄이들💜🙏,1,story
598,탄이들 다 군대간 이후 일상이 뭔가 울적하고 힘빠졌는데 슈가 콘서트 영화관에서 빵빵한 사운드로 보고 오니 활력이 솟는다.아미들의 군백기 극복을 위해 우리 윤기가 어디까지 계획한건지 참..고맙다.,1,story
599,보는 내내 행복했어요 실제 그날로 돌아간것마냥 설레고 짠하고 뭔가 의욕이 타오르고 하염없이 올리미는 감정들에 모든걸 맡긴채 그시간을 오롯이 즐겨봤어요 행복했던 그감정들을 고스란히 느끼게 해준 슈가와 방탄소년단멤버들에 무한 감사해요💜,1,story
600,윤기가 남겨준 이 선물을 온전히 즐길 수 있어서 정말 영화 내내 너무 행복했다...💜,1,story
601,음악으로 꽉 찬 내용이 맘에 들었어요~노래를 잘하는 사람도 있고 춤을 잘추는 사람도 있지만 그 모든걸 잘하는 사람이 공연을 잘하는 사람이라..지금 생각해보면 그게 맞네요. 내가 잊고있었던 노래와 그 시절에 위로 받았던 그 순간순간 노래가사들이 다시 음악을 찾아듣게됩니다. 영원히 공연해주길,1,directing
602,작년에 콘서트 다녀오고 나서 여운이 너무 커서 한참동안 앓았는데 ㅠㅠㅠ 다시 1년전 그날의 콘서트장으로 돌아간 것 같이 몰입해서 보고 왔어요. IMAX 큰 화면으로 슈가 얼굴을 보니까 너무 행복하네요 ㅠㅠ 역시 너무너무 멋있고 귀엽고 깔끼하고 다 해요!🥹,1,story
603,12세이상 인데 중간 shibar이 묵음이라 아쉬였어요 나머진 다 좋았어요😆,1,story
604,"윤기야, 영화가 개봉한다는 소식을듣고 새벽같이 달려와본 8시상영영화 잠이 덜깬상태로 보고있는데 파이널콘 막날 그…..시소가 박제될줄은 꿈에도 몰랐다🙄 이제 전세계아미들이 다알아버리게되었구나^^ 싱어롱땐 안틀리고 불러볼께🥲ㅋㅋㅋㅋ",0,story
605,슈가를 만날 수 없는 지금 슈가를 마지막으로 만났던 그때로 돌아간 기분이었고 윤기의 노래와 랩 몸짓 그 모든게 멋졌어요 꼭 보러오세요 💜,1,directing
606,진짜 진짜 겁나 멋있다 울트라 캡숑 짱짱😻,1,story
607,무대 위에서 행복한 윤기를 볼 수 있어서 그저 행복했다,1,story
608,너무너무 생생한 사운드와 이쁘고 멋있는 어거스트디의 퍼포먼스를 큰 화면으로 보고오니 가슴이 웅장하네요..오랜시간 이 감동과 여운이 지속될거 같아요ㅠ,1,story
609,영화는 더할나위없이 좋았는데 특전과 이벤트 MD상품 운영에 문제가 있는것 같아요. 예매수를 보면 준비수량을 알수있을 텐데 첫날부터 너무 수량이 적고 영화관람여부에 상관없이 한명에게 30-40개를 판매하는건 문제가 있어 개선요청드립니다.,0,story
610,윤기야... 너의ㅜ콘서트로 공백기가 채워질 거라고 생각하다니 크나큰 경기도 오산시다... 날 작년으로 돌려놔줘...,0,story
611,즐거운 시간이었어요~아이가 즐거워 했습니다~,1,story
612,공연 실황만 있는게 아니고 중간 중간 아티스트의 인터뷰가 있어서 더욱 좋았습니다. 특히 입장시 정면이 아닌 뒤에서 찍은 장면이 신선했습니다. IMAX라 역시나 영상 퀄리티 뛰어나고 스크린이 커서 온전히 나만을 위한 공연 같은 느낌이 들기도 했습니다.,1,directing
613,처음 시작 순간부터 엔딩크레딧까지 눈을 뗄 수 없고 웃다 울며 즐기다 보니 꼭 그 현장속에 들어기 있는거 같았다 그간의 보고픔에 허기졌던 나에게 한동안은 버틸 수 있게하는 멋진 영화이자 멋진콘서트 윤기냐 너무 고맙다~!!,1,story
614,콘서트실황을 생생하게 볼수 있어 너무 좋았고 사운드 영상 다 만족 합니다 그리고 역시 민윤기!!! 👍🏻,1,directing
615,지난 디파콘에 갈 수 있었는데 사정이 생겨서 결국 취소하고 이후로 계속 맺혀있던 한을 드디어 풀 수 있게 되어서 너무 행복하고 다행인 것 같아요~ IMAX관이 없는 곳이라 일반 상영으로 보게 되었는데 한 번 더 보러갈 땐 꼭 IMAX에서도 보고 싶어요!! 윤기 덕분에 행복한 하루 잘 보냈습니다 :),1,story
616,"아이맥스로 보니 음향,화면 모두 좋고 윤기 크게 봐서 좋았어요♡",1,directing
617,😍 아주 좋아용~~,1,story
618,최고의 가수 최고의 콘서트였습니다💜,1,story
619,방탄소년단을 너무 좋아하는 아미로써 그냥 너무 좋았어요 혼자하는 콘서트인데도 너무 즐기는 슈가의 모습이 너무 귀엽고 멋있었어요 굳굳,1,story
620,콘서트의 생생함이 있어요 너무 좋았고 다시 보고 싶어요,1,story
621,슈가아아아 넘 보고싶었어 게스트로 나온 세명 모두 볼수있어서 더 즐겁고 행복했어 얼른 7명 공연 다시보자 나 여기서 잘기다리고 있을게,1,story
622,다시금 1년전 체조로 돌아갈수있어 좋았다. 방탄 더 보고 싶다ㅠ,1,story
623,"전체적으로 즐기기에는 좋았지만 짤린 노래도 있고 욕을 듣지 못해 많이 아쉬웠는데, 중간중간 얼빡샷에 진ㅁ자 정신 못차리겠습니다",0,directing
624,콘서트 실황이라 아이맥스에서 보길 잘 했어요 슈가 팬이라면 필 관람!!,1,story
625,공연을 관람하는 듯한 생생함💜👍,1,story
626,너무 좋았어요? ?? ? ? ?,1,story
627,역시 최고입니다💜,1,story
628,현장에 있었던 한 사람이였는데 더 무비를 통해서 suga 그리고 agust d라는 사람이 얼마나 무대를 사랑하는지에 대해 엿볼 수 있었다 친절하지 않다고 말하는게 무색하게도 음악과 음악 속에 담긴 가사들로 어쩌면 그가 하고 싶었던 생각과 메세지들을 간결하고 강렬히 전달 받은 느낌이다,1,story
629,윤기 멋있다 BTS 보라해,1,story
630,진정한 월드클래스가 무엇인지 보여주는 영화. BTS의 슈가이면서 AgustD인 민윤기 님이 D-day 공연을 통해 드러내는 가수로의 정체성이 무대 위에서 얼마나 빛이 나는지 볼 수 있었던 영화. 강추합니다.,1,story
631,그날의 추억을 다시 안겨줘서 고마워 다시 공연장에서 만나자🖤,1,story
632,너무 행복했고 즐거웠고 재편집도 잘 되었습니다,1,directing
633,D-day 실관람 했는데도 작년 여름 그때의 감정이 되살아나 좋았습니다. 멤버들 게스트로 나왔을때도 너무 좋았어요. 울컥하고 기쁜 감정이 복합된 순간이요. 잘 관람했어요,1,story
634,"23년 8월 6일 그 시간이 떠올라 영화를 보는 내내 너무 행복했습니다! 윤기야, 네가 옳았어. 그때의 기억으로 그리고 이 영화로 인해 나는 네가 다시 우리 곁으로 돌아올때까지 이 추억을 곱씹으며 조금은 즐겁게 기다릴 수 있을거 같아.",1,story
635,그리운 그때 그 시간속으로 다시 온거 같아 벅차고 행복해서 눈물이 났다,1,story
636,콘서트도 보고 왔었는데 영화관에서 봐도 재밌는 디데이 콘이었습니다~*,1,story
637,콘서트 직관한것보다 훨씬 더 몰입도있고 모든게 다 최고였어요 먼저 개봉했던 콘서트실황과도 또 다르게 진짜 생생하니까 안본 아미들 꼭 보러가세요♡,1,story
638,"“아, 작년 콘서트 때 이런 기분이었지!” 콘서트 실황영화란 콘서트의 생생함을 불러일으킬 수 있어야 한다. 이 영화는 디데이 콘서트 특유의 불친절한 시작과 끝, 그리고 공연 내내 아티스트와 객석 간의 긴밀함을 잘 표현했다. 영화 잘 봤으니 이제 다음으로 콘서트를 가자.",1,story
639,"윤기와 방탄이 보고싶어진ㅠ 중간중간 인터뷰도 있어서 좋았고, 무엇보다 아맥 큰화면으로 윤기봐서 좋았음",1,story
640,작년 8월의 그 날은 아직도 제 기억 속에 선명히 남아있는데 이렇게 영화관에서 큰 화면으로 다시 보니까 그때 그 감정과 분위기가 떠오르고 그날의 추억들도 하나 둘 생각나는게 너무 좋았습니다🫶 이거 보니까 더 보고싶어요🫠,1,directing
641,시간이 좀 짧았지만 너무너무 행복한 시간이였습니다,1,story
642,너무나 그리운 작년 8월로 돌아간 느낌이었어요. 큰 화면 가득한 윤기와 아미밤 물결을 보니 다시 공연장으로 가고 싶네요. 아이맥스 처음이었는데 너무 선명한 화질에 놀랐습니다👍🏻,1,story
643,보는 내내 작년 8월을 추억할 수 있어 행복했습니다💜,1,story
644,잘 몰랐는데 노래가 좋았어요~!!,1,directing
645,23년 8월로 돌아가게 만들어줌 그날의 온도와 습도 완벽했던 너의 무대 오늘 영상 보는 내내 행복했다💜,1,directing
646,다시 저때로 돌아간것만 같았다🥹 우리 윤기가 더 그리워졌다.. 얼른 내년이 왔으면... 콘서트 때는 못봤던 새로운 각도의 앵글도 있어서 좋았고 윤기와 눈이 맞추는치는것 같았고 중간 중간 윤기 인터뷰도 있어서 진심을 더 알게되었고 윤기를 사랑하지만 더 사랑하게 되고 행복했으면 좋겠다,1,directing
647,다시 작년 8월로 돌아간 기분을 주는 생생한 영상! 그리고 시원하고 빵빵한 사운드! 또 보러 갈려구요! 다시 그때로 데리고 가줘서 고마워!!,1,directing
648,나의 사랑하는 아티스트가 했던 말처럼 이 공연으로 공백기를 잘 버티고 있었던 것 같다 극장 개봉으로 또 한 번 힘을 줬으니 다시 잘 버텨보자 나는 슈가이면서 어거스트디 이고 민윤기인 사람이 참 좋다,1,story
649,공연을 다시 본듯한 감동..,1,story
650,아이맥스로 보니깐 생생하게 콘서트 다녀온 기억도 나서 기분이 좋더라고요 그리고 싱어롱으로 한 번 더 볼 예정이에요 :),1,story
651,또 다시 2023년 8월로 돌아간 것 같아서 행복했네요. 묵음처리가 조금 아쉬웠지만 영상이나 사운드가 정말 좋았어요. 싱어롱을 더 많은 곳에서 해주세요ㅠㅠ,1,directing
652,"아이맥스 큰 화면에서 최애를 만날 수 있어 행복했습니다! 윤기공연에서 가장 핵심 중 하나인 사운드를 잘 느낄 수 있었고, 콘서트에선 보지 못했던 순간도 볼 수 있어 귀중한 시간 이였습니다.",1,story
653,나는 언제 2023년 8월에서 벗어날 수 있을까,1,story
654,실제로 콘서트장에서 즐기는 기분이 들어 너무 재밌고 좋았어요~,1,story
655,"파이널 첫콘 막콘 갔었는데 영화보니까 그때로 돌아가는 기분,, 다 보고 또 보고싶어서 예매해서 또 보고옴ㅎ.ㅎ 민윤기 보고싶다.. 투어해줘서 고맙구 진짜 개멋있어 내가수",1,story
656,다시 작년 8월이 된 느낌이였어요 ㅠ 최고의 가수 윤기오빠 그리워요… 투어로 아미들에게 재미를 주고가줘서 버티고있습니다아ㅜㅜ,1,story
657,작년 파이널콘의 감동이 고스란히 전해지는 무비였어요 중간에 멤버들과 함께한 듀엣곡도 뭉클했구요 마지막 콘서트의 여운을 다시 한번 느낄 수 있어서 좋은 시간이었습니다,1,story
658,작년 첫 콘서트가 슈가(윤기) 콘서트라 더 애착이 가서 좋았다 묵음처리 삐처리가 핵심인데 전체관람가라서 아쉬운건 어쩔수 없었다 그래도 사운드 빵빵한 아이맥스에서 본게 신의한수,1,story
659,"보는 내내 윤기가 그리웠고, 나를 작년 8월 체조경기장으로 다시 데려간 영화",1,story
660,공연을 갔다 왔지만 또 다른 기분을 느끼해 해준 '디-데이' 더 무비!! 감동이었고 벅찼고 행복했다. 디데이콘이 공백기를 버텨낼 수 있는 힘이었는데 '디-데이' 더 무비도 앞으로의 나의 매일을 버텨 낼 수 있는 또 하나의 원동력이 되었다. 내 기억속에 영원히 함께할 D-DAY,1,story
661,최고의 가수 최고의 공연 다시 8개월전으로 돌아간 기분으로 너무 행복한 시간이였어요💜,1,story
662,잠시나마 그때의 콘서트 열기를 다시한번 느낄수있어서 좋았어여💜,1,story
663,콘서트 때의 감동을 다시 실현시켜줬어요,1,story
664,같이 따라부르고 싶은 마음이 간절했던 영화입니다🥹 콘서트 또 가고싶네요😭,1,story
665,작년 8월 디데이 더 파이널 콘서트 생각이 많이 나는 하루였습니다! 그때에 함성이랑 윤기에 모습이 아직도 생생한데 윤기 말대로 25년까지 잘 버틸 수 있을거 같아요. 항상 우리에게 모든걸 해주기 위해 많은걸 해주는 우리 7명💜 너무너무 고맙고 내년에 만나자🥰❤?,1,story
666,시간이 순식간에 지나가는듯 재밌었어요~~,1,story
667,다시 그날로 덜아간듯한 시간이었습니다,1,story
668,소름돋는 공연이었어요 ㅠㅠ 시간 가는줄 모르게 즐겼네요👍윤기 짱짱짱!!!! 아쉬운 점이 있다면 노래하는 마이크 트랙을 만진것 같아서 현장감이 좀 떨어졌어요... 리얼하지 못했다 할까요. 예전에 부산콘서트 무비는 안 이랬는데 🥲🥲,1,directing
669,싱어롱이였음 더 좋았을거같아 넘 아쉽네요~ 막콘 직접 관람했는데 그때 생각도나고 못봤던 장면도 보고 슈가의 중간중간 멘트들도 넘 좋았네요~~~,1,directing
670,아맥에서 보니 8월의 그날로 다시 돌아간 기분,1,story
671,콘서트에서 느끼지 못했던 윤기의 노래가 더 뚜렷하게 들려서 좋았어요. 아미밤 상영회에서는 아미님들과 아미밤 흔들 생각하니 벌써부터 13일이 너무 기대됩니다:),1,directing
672,다시 8월로 돌아간 기분,1,story
673,직관을 했던 콘있었습니다. 작년 그곳 그 시간이 생생하여서 너무 행복한 시간이였네요,1,story
674,민윤기 잘 하는거 세상 사람들이 다 알았으면 좋겠다.,1,story
675,"콘서트 현장, 라이브 송출과는 또다른 재미! 최고였습니다!",1,story
676,진짜 여운이 많이 남습니다 그런데 아쉬운점은 사람이 많이 올껄 대비를 해야 하지 않나요 ?-? 저 티켓도 못받았어요.. 저 포함 몇몇분들다 못받고 심지어 컵홀더도 품절돼서 이게 맞나 싶었습니다. 그렇지만 영화는 대체적으러 좋았고 미쳤고 꼭 보세여 🫶🏻,1,story
677,"싱어롱이 아니어서 속으로만 삼켜야 했던 팬첸트! 엉덩이 들썩거리고 난리, 윤기 나레이션 멘트 하나하나가 가슴을 울리고🥹 공연 시작하는 순간 그 해 여름 팔월로 타임슬립, 공연 잘하는 가수를 좋아해서 너무 행복하다",1,story
678,짤린곡도 있고 관람가에 맞춰 편집된 부분도 있었지만 그래도 영상 자체는 좋았습니다♡,1,directing
679,"디데이 더무비는 시작과 동시에 관객을 그 날로 데려다 놓는다 디데이콘서트는 한 아티스트의 의지가 만들어낸 필연이자, 그를 아끼는 사람들이 만들어낸 사랑의 집약체이다 마르지 않는 샘물과 같은 영감이 함께 하길 바라며, 음악과 공연으로 자신의 존재를 증명하는 그에게 존경과 사랑을 보낸다",1,directing
680,Future's gonna be okay 👍,1,story
681,너무 좋았는데 욕을 안 넣어주면 앙꼬 없는 찐빵이지ㅠㅠ,0,story
682,"작년 기억이 새록새록 떠올라서 너무 좋았던 거 같고, 현장에서 놓친 윤기의 표정을 크고 자세하게 볼 수 있어서 윤기의 감정이 더 와닿는 거 같아 좋았습니다!! (삐처리는 진짜로 아쉽,,)",1,story
683,너무 좋았어요!! 묵음처리 되는게 정말 아쉬웠지만… 같이 부르고 싶어지고 중간에 울컥해지고…ㅠㅠㅜ 작년에 고3이었어서 콘서트를 못갔는데 이렇게라도 콘서트에 간 것 같은 기분을 낼 수 있어서 좋았어요ㅠㅠㅠ,1,story
