index,Review,sentiment_predicted,category
684,말해 무엇하리 봐도봐도 좋은 콘서트를 커다란 IMAX화면과 압도적인 사운드로 들으니 콘서트장을 방불케하는 느낌. 후반부로 갈수록 가만히 앉아있기 넘 힘들었다. 편집도 깔끔하고 짧지만 쉰 목소리로 인터뷰하는 슈가의 한마디 한마디에서 감동과 진정성이 느껴졌다. 아미밤 상영회가 기대된다,1,story
685,퍼포먼스와 밴드사운드 역시 최고였고 멀리서 봤던 모습을 아이맥스로 보니 또 좋더라구요ㅎㅎ 싱어롱이 아니여서 아쉬웠지만 보자마자 작년 여름으로 돌아간듯 엄청 설렜답니당!!!,1,story
686,"너무 잼 있음 삐~처리가 아쉽 ㅜ ㅜ 그것이 포인트인데,,,",1,story
687,최고! 영상도 사운드도 정말 좋았어요. 콘셋리에 있었지만 안나온 곡들도 다 나왔으면ㅠㅠ 아쉬웠어요.,1,directing
688,지난 여름 흥분과 설렘이 다시 살아나서 울컥울컥 했네요 콘서트장에서는 잘 보이지 않던 윤기의 행복한 표정과 땀방울을 보게 되어 정말 행복했어요 고맙고 보고싶다 윤기야~💜💜💜💜💜💜💜,1,story
689,작년 갔던 디데이 콘이 엊그제 같이 생생한데... 다시 이렇게 극장에서 다시보니 감회가 새로워요... 영상미도 너무 좋고 윤기 무대는 역시 최고예요!! 다음 2주차도 볼 예정입니다ㅎㅎ 그립네요~ 보고싶은 민윤기💕,1,directing
690,윤기야 네 말대로 디데이 콘서트로 인해 버틸 힘을 얻었고 여전히 체조에 살고있어 버틸 수 있는 힘을 줘서 너무 고마워 아미를 하면서 단 한시도 놓지 않고 하는 생각은 아미하길 잘 했다 야 나는 오늘도 아미라 행복했고 앞으로도 그럴거야 우리 앞으로도 같이 가자 그 길이 꽃길이든 가시밭길이든지,1,story
691,비티에스 팬들 너무 좋아할 것 같네요. 특히 슈가 좋아하는 사람들은! 노래도 잘 들었고 완전 잘 부릅니다.,1,directing
692,전체관람가라 비속어는 묵음처리되어 웃펐지만 간만에 여름에 갔던 콘서트가 새록새록 기억이났던 윤기솔콘 1년이 지났지만 그때 그 기억 돌아가 너무 몽글몽글 했던 영화였네요 아미밤 및 싱어롱 회차가 기대됩니다 콜드컵이 첫회차때 품절인것과 특전도 빠르게 소진된게 너무 아쉬울 따름입니다,1,story
693,말해뭐해 진짜 너무너무 좋았습니당 그리고 아이맥스로보니 확실히 달라서 더 좋았습니당!,1,story
694,역시 어거스트 디💜방탄소년단 슈가로서도 최고지만 솔로 어거스트 디로도 공연을 꽉 채울 수 있는 멋진 사람🫶🏻 덕분에 23년 여름은 뜨거웠고 24년 봄에도 여름의 열기를 느낄 수 있는 시간이었습니다. 인간 민윤기도 행복하기를 늘 응원하고 있어요.너무 그립고 선물 고마워요,1,story
695,아미는 아니지만 잘보고옴.,1,story
696,아이맥스로 보니까 음악이 몸으로 쏟아지는 느낌이 드네요 잘 봤어요,1,directing
697,슈가 본인이 정말 무대를 좋아하고 관객들도 그 모습을 사랑하는 게 느껴지는 영화입니다.,1,story
698,무대구성 참신하고 노래부터 랩 악기까지 혼자서 다 해버리니 무대가 꽉 차서 러닝타임 내내 재밌었음 역시 무대 메너는 짬에서 나온 바이브가 남다름 거기에 중간중간 인터뷰 짧게씩만 들어가서 몰입 안 깨고 좋았음 사운드가 좋으니 공연장보단 좀 덜해도 굉장히 신나고 재밌었음,1,directing
699,말이 필요없는 공연 최고입니다,1,story
700,굿굿굿굿쏘쏘쏘쏘굿굿,1,story
701,"디데이더무비 후기 무슨 말이 필요할까 오직 민윤기에 집중하고, 듣고, 바라봤는데 그냥 나는 모든 게 민윤기 너였어. 어쩌면 이 사랑의 끝도 민윤기 너야 서로가 서로를 기다린다는게 너무 마음이 편안해졌어 윤기야, 선물 잘 받았어, 너의 마음도 잘 간직할게 건강히만 돌아와.",1,story
702,다시 뜨거웠던 그 여름으로 돌아간듯한 기분,1,story
703,아미밤이든 싱어롱이든 가야겠어,0,story
704,최고다. 그날의 그 열기 그대로 나를 그곳에 데려다 준 기분이다.,1,story
705,아 진짜 콘서트 갈 수있었는데.. 못 가거 너무 슬펐는데 이렇게라도 봐서 좋았어요.. 하 윤기 너무 보고싶고 우리 소년단도 보고싶구 콘서트가 너무 가고싶어졌어요,1,story
706,민윤기 보고 싶어서 오열을 하며 봤음 ㅠㅠ 무대장인답게 신나게 놀고 즐기는 모습이 행복해보였음 25년도에 또 같이 놀자!!!!,0,story
707,콘서트 재밌게 잘 봤습니다,1,story
708,싱어롱이 아니라 아쉬웠지만 열심히 머리 흔들면서 즐기다 왔습니다 전체관람가라 노래 가사에 있는 비속어들이 묵음 또는 삐처리가 되어서 오잉또잉하며 아쉬웠습니다 하지만 일단 윤기가 잘생겼다는 점 작년 디데이 콘서트에서의 설렘을 다시 느낄 수 있다는 점이 너무 좋았습니당 또 보러 가야지,1,directing
709,큰화면으로 보는 콘서트 너무 좋음,1,story
710,방탄소년단 보고싶다ㅠㅠㅠ 다시 어거스트디 콘서트 가고 싶어ㅜㅜ 좋은건 크~게 봐야지ㅋ,1,story
711,노래들만 압축해둔 영상이라고 보시면 될 것 같아요! 콘서트 전체를 보여주는 느낌은 아니에요 그럼에도 너무너무 좋았습니다ㅠㅠ 슈가씨 덕분에 또 즐거운 추억 하나 만들었네요 예전 콘서트들도 상영만 해준다면! 무조건 찾아가서 볼 것 같아요,1,directing
712,저희지역에선 왜 상영을 안하는지...가장 가까운 청주로 와서 보고갑니다. 작년 콘서트에서 목이 터져라 같이 응원하던 아미님들 다들 잘 보셨는지...싱어롱 아닌게 너무 아쉬웠어요,1,story
713,나를 또 한 번 작년 8월로 데려다준 영화💜,1,story
714,윤기가 더 좋아졌어요 내 최고의 아티스트… 이런 선물 줘서 정말 너무 고마워 사랑해,1,story
715,윤기야 최고다 선물 해 준 것들로 남은 시간들 버텨볼게 고마워 너무 보고싶다 사랑해,1,story
716,역시 공연은 말해뭐해.... 보는내내 함성지르고 싶었지만 참느라 고생했네요ㅋㅋ 이번 아미밤 상영회때 신나게 놀고 오겠습니다💜,0,story
717,민윤기 사랑해ㅠㅠㅠ 디데이콘 등장부터 셋리 마지막 퇴장까지 완벽 그 자체였다,1,story
718,다시 그날로 소환 당했습니다! 공연에 진심인 윤기의 멋있는 무대연출과 무대매너까지 완벽했던 콘서트를 영화 IMAX로 볼 수 있어서 더 좋았던 공연이였습니다! 아티스트 인터뷰가 매우 감동적이였어요! 아미에게 큰 선물을 준비해준 윤기에게 감사합니다💜,1,story
719,지난 여름의 뜨거웠던 열기와 함성을 다시 느낄 수 있어서 가슴 뜨거운 시간이었어요. 민윤기.SUGA. AgustD의 행복한 모습을 더 가까이 느낄 수 있어서 저도 행복한 시간이었어요. “우리 인사하자 Bye 아닌 Hello 다시 만날 날을 너는 절대 잊지마” 고맙고 사랑합니다. 우리 꼭 다시 만나요!!!,1,story
720,콘서트 다시 간 느낌으로 너무 좋았고 멤버들 나온 게스트 무대도 나와서 정말 좋았어요,1,story
721,디파콘 갔던 기억이 더 생생해지고.. 눈물나고 그러고..,1,story
722,보고싶은 윤기 .... 너 정말 고양이가 된고닝,1,story
723,천아맥 사운드 매우 서운함 ㅠㅠ,1,story
724,그 날의 감정들이 다시 한 번 떠오라서 처음부터 끝까지 그냥 행복했어요 ㅎㅎㅎ 진짜 내일은 없다는 듯이 응원하고 노래부르고 소리지르고 ㅎㅎㅎ 그 날 같이 있던 모든 아미분들 같은 느낌이실 것 같네요 ㅎㅎㅎ 지방이라서 일끝나고 후딱 넘어와서 보고 다시 집가는데 아련아련하네요..,1,directing
725,"진짜 아이맥스 짱짱! 표정과 흐르는땀, 제대로 구현된 밴드사운드까지 너무 좋습니다.",1,story
726,넘 짧았음!!!! 풀공연 3일 다 풀어주세여,1,story
727,말이 필요없는 영화입니다ㅎㅎㅎㅎ,1,story
728,콘서트 직관 때 생각도 나고 많은 아미들과 함께 자리할 수 있었던 것도 좋았어요.,1,story
729,민윤기 무대 천재.. 아니 그냥 천재..ㅠ,1,story
730,역시 최고입니다..민윤기 사랑해!!,1,story
731,역시!!!♥♥♥♥짱,1,story
732,진짜진짜 민윤기 최고!!! 그날 감동을 다시!!!,1,story
733,윤기야 투어한다고 너무 고생 많았어 민슈가짱짱뿡뿡맨 이걸로 다시 버틸 수 있는 힘을 줘서 고마워 🫶🫶,1,story
734,우리의 디데이는 아직 끝나지 않았다 - !! ✌🏻 8월의 여름을 다시 기억하게 해준 윤기 너무 고마워 ! 🤍,1,story
735,너무나도 행복한 시간이였습니다...,1,story
736,"너무 멋있고 열정 가득한 무대 최고였어요 RM, 지민, 정국이도 같이 보니 너무 행복했어요 역시 큰 화면이 좋아~~ 슈가의 시원한 욕에 뿌엥까지 다시 봤더라면 더할나위 없었겠지만 그래도 최고였어요",1,story
737,"힘든 시간 속에 언제나 나에게 위로가 되어주던 존재와 그의 음악 내가 슈가, 어거스트디, 민윤기를 사랑하는 수많은 이유들이 오롯이 담겨있는 공연 영상이었다 현장에 있던 우리만 알 수 있는 감정들까지 전부 담아낼 수는 없었지만 그래도 또 한 번 너의 존재와 노래에 위로를 받고 돌아가 고마워",1,directing
738,작년 여름의 그 뜨거움이 느껴지는듯 합니다 :-),1,story
739,작년 여름의 뜨거움이 봄꺼지 이어진다 은혜롭다 ㅠㅠㅠ,1,story
740,공연으로써 자신의 가치를 제대로 보여주는 슈가~반하고 갑니다!!! 엄지 척!!,1,story
741,뜨거웠던 8월 체조경기장 그때의 두근거림을 다시 느낄 수 있었다. 콘서트 현장에서 미처 눈치채지 못했던 작은 표정과 제스춰들을 볼수 있었고 다양한 앵글이 만족스러웠다. 두고두고 보고싶은 장면들이 많아 추후에 나올 dvd를 기대해본다.,1,directing
742,아맥은 처음인데 화면도 크고 콘서트 실황을 짱짱한 사운드로 들으니 너무 좋았어요 작년 여름 뜨거웠던 디데이 콘서트 아직도 그때 기억속에 살고있는데 디데이 앨범 1주년에 맞추어 개봉된거 너무 좋네요 어거스트디의 첫 콘서트 무대 연출 공연 모든게 대단했던 디데이투어 이제 싱어롱 기다립니다,1,directing
743,말해뭐해 최고.. 다시볼래ㅠ,1,story
744,작년 8월 콘서트 끝나고 영혼의 절반을 체조에 두고왔는데 영화로 다시보니 그때로 다시 돌아간 것 같은 아련한 느낌에 눈물이 쏟아졌네요 공연을 대하는 윤기의 진정성이 느껴져서 또 반했고 음향도 좋고 IMAX라 시야도 넓어서 좋았어요 또 볼 예정입니다 마지막으로 윤기야 영화 고마워💜,1,directing
745,공연에 진심인 슈가 어거스트디 민윤기 이런 경험할 수 있게 해줘서 고마워!,1,story
746,영화를 보면서 좋은 노래를 많이 듣고가요,1,directing
747,"디데이 파이널 절대 못 잃어! 작년 미주, 아시아, 서울까지 너무 행복했었는데.. 25년까지 버틸수 있는 힘을 다시 주셔서 너무 감사해요! 민윤기 진짜 고맙구 사랑해💜",1,story
748,디데이콘을 영화로 볼 수 있어서 너무 좋았습니다.,1,story
749,"파이널 첫날을 갔다 왔는데 다시 보니 소름도 돋고 추억이 새록새록 나고 좋았어요 한가지 아쉬운건 슈가의 노래는 욕도 매력인데 12세이상인 영화라 삐쳐리,묵음 처리 된게 아쉬어요 차라리 19세이상과 전체 관람인걸로 나눠 상영이 됬으면 하는게 어떨까 싶어요 25년이 기다려져요 빨리 와라 보라해",1,directing
750,역시~~^^ 방탄은 사랑입니다.,1,story
751,굿!!! 최고입니다,1,story
752,다른 말 필요없이 그냥 찟었다💜,0,story
753,이미 윤기를 최대치로 사랑하는 중이라 생각했는데 착각이었네요.. 빵빵한 사운드와 큰 스크린으로 그리운 23년의 여름을 다시 만날 수 있어서 행복했어요 아이맥스에서 영화보는 건 처음인데 왜 아이맥스하는지 알 것 같아요 최고입니다 슈가야 사랑해💙,1,story
754,짧아서 아쉽네요 슈가짱멋,1,story
755,삐~!처리만 없으면 더더더더 행복했을 콘서트무비 그래도 오랜만에 어거스트디 다시 보니 행벅했습니다♡,1,story
756,좋았어요~^^좋았어요~^^,1,story
757,윤기 봐서 너무 좋았구용 윤기 정국 지민 남준 너무좋고 소름이고 뿌엥 윤기없지만 울컥하고 또 보고시퍼...,1,story
758,"생생한 실황 현장을 그대로 느끼듯 너무 좋았어요. 멋진 공연과 음향, 아이맥스의 만남이라 더 생동감이 넘쳤어요. 또, 공연에 대한 아티스트의 설명과 각오를 함께 공유할 수 있어서 행복한 시간이었습니다. 재관람이 시급하네요^^ 담에는 싱어롱으로 함께 즐기고싶네요~",1,directing
759,"IMAX , 사운드랑 화질이 확실히 다르네요! 콘서트는 못갔지만,, 간접으로 그날의 느낌을 ㅎㅎ 영화로 봐도 너무 즐겁고 신나는데, 콘서트!! 다음에는 꼭 가고싶다!!",1,story
760,작년 콘서트의 분위기를 다시 느낄 수 있어서 너무 좋았습니다!! 2025년만 기다려집니다 보고싶다 방탄💜,1,directing
761,심장이 벌렁벌렁 슈가가 슈가했다 말이 나올정도로 몰입감 대박.. 영화 개봉 해주셔서 감사하옵니다ㅜㅜ,1,story
762,역시 민윤기... 💜💜💜💜💜💜💜,1,story
763,보면서 콘서트 갔던 기억도 나고 엄청 신났습니다. 집에서 봤으면 뛰진 못해도 소리 지르며 놀았을 것 같아요. 12세 관람이라 욕이 음소거 된 게 조금 아까웠습니다.,0,story
764,울아티스트를 영화관에서 다시 크게 볼수있어서 좋았습니다 근데 중간 묵음처리는 너무하셨네요 ㅠㅠ 한번으론 부족하니 n차 관람 하겠습니다,1,story
765,극장의 빵빵한 사운드로 디데이콘을 다시 보니 그때 콘서트장에서의 느낌도 되살아나고 너무 좋았아요,1,story
766,현장에 있는 듯 제대로 즐겼네요~역시나 윤기는 빛나는^.~,1,story
767,콘서트 다시 봐서 너무너무 행복했고 특히 사운드가 너무 좋았어요! 아미분들 얼른 고고 콘서트 갔다왔어도 후회안해요,1,story
768,역시 최고! 재미와 감동! 재관람 해야겠어요,1,story
769,아이맥스관에서 D-DAY THE MOVIE 관람 정말 최고였어요🥹 아미들을 위해 멋진 공연과 콘텐츠들을 준비해 준 윤기에게 감사합니다🖤,1,story
770,무비지만 콘서트 현장감 느낄수 있어서 좋았습니다 실제 콘서트 못간 아쉬운 마음을 이렇게 풀어 보내요,1,story
771,너무 신나게 봤어요 음향 좋고 재밌어요!!,1,directing
772,너무 좋았어요 더 많은 아미들과 즐기고 싶어요,1,story
773,"오랜만에 슈가 공연을 다시 보니, 콘서트장에 있는듯 피가 끓어오르는 기분이었어요. 정국, 지민, 남준이 게스트 무대까지 다 볼 수 있어서 너무 좋았어요. 군대간 탄이들이 너무 그립고 보고 싶은데, D-Day보고 아쉬움 달래봅니다. 6월만 기다립니다.",1,story
774,욕어디 갔어? 이 공연 욕이 하이라이트인데?ㅋ,0,story
775,밍융기♡ 세상 제일 멋있다~~♡♡♡,1,story
776,8개월만에 다시 본 콘서트는 다시봐도 감동이었습니다. 음질도 좋고 콘서트에선 제가 있는 방향으로만 볼 수 있었는데 여러방향으로 볼 수도 있고 윤기의 진심이 담겨있어서 더 감동이 몰려왔어요. 윤기 말대로 25년을 기다릴수 있는 큰 힘이 되는 정말 소중한 공연이었습니다. 윤기의 선물같은영화,1,story
777,온라인으로는 많이 봤던 컨텐츠라 극장으로 현장감을 조금이나마 느껴보니 역시나 콘서트 못가본게 너무나 아쉽더라구요.. 그래도 다시 보게되서 감격스러운 공연이었어요...,1,story
778,2023년 여름 최고의 콘서트. 순식간에 그날 한복판으로 데려다 주는 감동적인 콘서트 실황이었습니다. 사운드는 최고였고 스트리밍에서 보지 못한 여러 비하인드와 새로운 구도를 볼 수 있어 너무 좋았습니다. 역시나 콘서트 맛집 방탄소년단 답게 솔로 콘서트도 최고입니다!!!,1,story
779,민윤기 그자체를나타내는 디데이콘....보면서 엄청울었다....근데 삐처리는 빼주지...,1,story
780,슈가 오랜만에 보니까 너무좋고 또 보고싶네요.,1,story
781,팬이 아니어도 실황 무비를 좋아한다 하면 꼭 봐도 좋을 무비! 팬이라면 당연히 봐야하는 무비! 다 끝나고 나니까 심박수가 미치게 올라있어서 깜짝 놀랐을 정도..❤??🔥,1,story
782,콘서트의 열기가 스크린 가득,1,story
783,너무 멋짐~~ 더더 큰 화면에서 보고 싶음!!!,1,story
784,시작부터 전율이ㅠㅠ우리 애웅이 랩 노래 ㄷㄷ 못하는 게 뭔가요? 1번 안되고 3번 이상 보세요 민윤기를 고소합니다,0,directing
785,보고싶고 너어무 그리워💜💜💜💜💜💜💜,1,story
786,공백기가 있다고 생각이 안 들도록 많은 준비를 한게 너무 보였고 무대 연출부터 가지고 있는 생각 하나하나가 전부 감동적이였어요 항상 응원할거에요,1,story
787,내가 저 파이널의 파이널.진짜 마지막날 공연에 함께 했었다는 게 얼마나 행복한 시간이었는지 지금 다시 또 새록새록 느낀다.늉기야.고맙다.덕분에 다시 또 그날의 행복을 느낄 수 있어서 정말 즐거웠어.군복무 잘하고..우리 타니들 완전체로 어여 다시 만나자.고마워.건강해💜,1,story
788,"실제 공연때는 뛰고노느라 자세히 보지못했던 곡마다의 슈가윤기어겉디의 표정,감정들이 잘 보여서 좋았고, 중간중간 진심이 담긴 윤기의말들을 새길수 있어서 좋았다. 윤기말대로 이 기억으로 내년까지 잘 버티고 있을께💜 지방에도 싱어롱 빨리 주세요~ sibal을 외쳐야겠으니.",1,story
789,감동적인 공연이었어요 2025년도까지 기다릴 수 있는 힘을 주네요,1,story
790,디데이 투어는 왜 몇 번을 봐도 처음 보는 것처럼 설레고 재밌는걸까요? 마치 실시간으로 콘서트 하는걸 라이브뷰잉으로 보는 기분이었어요. IMAX로 보니 몰입감도 더 좋았어요~,1,story
791,정말 잘봤어요 콘서트 실황을 그대로~~,1,story
792,윤기야 보고싶다ㅠㅠㅠ,1,story
793,진짜 너무 좋았어요 콘서트 온 느낌 들고 최고였어요 민슈가 최고 어거스트디 짱 묵음 처리된 부분이 아쉬웠다만 그래도 좋았어요 진짜 너무 짱,1,story
794,여전히 디데이속에 살게하는 깊은 여운 최고다 우리 어것디,1,story
795,감동에감동에 감동에감동에 존나 젛아여 ♥,1,story
796,좋았어요 어더스트디 슈가 최고♡,1,story
797,너무 좋았어요 진짜!!!,1,story
798,코로나로 공연에 목말랐던 방탄소년단과 아미의 간절함에 단비가 되었었던 슈가의 콘서트.. 그 감동을 다시한번!!,1,story
799,"작년에 다녀온 콘서트 인데도, 새로운 느낌이 드는 부분들도 있었고 정말 시간이 순삭 되었습니다😆 콘서트 영화인만큼 아미밤상영회 처럼 함께 즐길 수 있는 타임이 더 많아지면 좋을거 같아요~ 아이맥스관 명불허전 몰입도 쵝오입니다 n차관람 필수!😍",1,story
800,우리윤기 너무나 멋진 아티스트에요 💜👍 음악에 진심인 그대가 너무 사랑스럽답니다 앞으로도 좋은음악 많이 만들고 들려주면 좋겠어요 💜😊 영화로 콘서트 다시보니 감동이었습니다 😊👏👍💜💕,1,story
801,윤기야 음악해줘서 고마워🩵,1,directing
802,역시 좋았습니다만 라이브 뷰잉 재팬편이 더 좋았어요,1,story
803,그리웠던 내 아티스트ㅠㅠ 행복한시간이었어요~!! 참!! 중요한.. 부분을 삐~처리 넘 아쉬웠음ㅋㅋ,1,story
804,울윤기 작년서울콘 파이널 콘서트 막내랑 우리천사.울쭈니 합동무대보니 우리방탄 보고싶네 콘서트준비과정 윤기인터뷰 보니 😭😭😭😭😭😭😭 💜💜💜💜💜 더욱더 그리운7방탄 아포방포 방무행알,1,story
805,너무 몰입되고 재밌었어요!,1,story
806,민윤기 개멋있다 !!!!그리고 보고싶다ㅠㅠ,1,story
807,무대 하나는 멋지고 꽤 즐길 만하다,1,story
808,IMAX 상영관이라 음향상태 좋았어요 콘서트 공연 봤을때 감동이 더 느껴졌어요,1,story
809,역시 어거스트디 공연에 진심인 사람. 잠시동안 벌써 작년이 되어버린 8월 그 여름으로 짧게나마 다녀 온 기분이 들었다. 덥지만 열정 넘쳤던 디데이였다. 윤기야 건강히 지내다가 내년에 보자!♡,1,story
810,"관람평 보려말구 영화 한번더 보세요.기억나십니까 작년 8월.벌써 반년이 지났는데도 아직 작년8월에 멈춰있는데,영화보면서 이제 좀 나아갈수 있겠네요.투어 없었어도 2,3년 공백기 기다리는거야 당연한거였을텐데, 투어까지해주니 뼛속까지 방뽕이라 그저 2,3년 따위...가 되고있는지도...",0,story
811,재미있게 관람했습니다.,1,story
812,그 총각 공연 잘하네..,0,story
813,윤기덕에 생명연장♡,1,story
814,행복한 하루였다.. 윤기 메리미~~,1,story
815,좋은 건 크게 봐야한다는 말이 맞는 것 같습니다. 그런데 목소리가 좀 많이 이상하게 들렸어요. 음향에 문제가 있었던 건지 원래 그랬던 건지 모르겠네요. 특전 수량을 좀 더 많이 준비해 뒀다면 훨씬 즐거웠을 듯 합니다. 다음부터는 특전 남을 걱정 집어치우고 무조건 많이 들여주세요.,0,directing
816,시간이 순삭! 콘서트의 여운이 그대로! 슈가가 어거스트디 했다!! 감동 그자체!,1,story
817,실황영화이기도 한데다 팬의 입장에서 관람하는 것이기 때문에 어떻게 편집될지 예상되는 편인데 이번 영화는 편집이 의외인 부분들이 있어서 신선했어요. 공연의 몰입감은 역시 방탄이다하는 말이 절로 나옵니다.,1,directing
818,실제 콘서트장 안에 있는 기분이었어요. 슈가 멋짐,1,story
819,파이널 콘을 3일 다 다녀온 사람으로써 그때 기억을 다시금 떠오를 수 있어서 좋았고 윤기가 행복해 하는 모습을 보니 덩달아 행복했다😭,1,story
820,우리 윤기 진심이 느껴져서 좋았어요 그날의 추억이 새록새록 떠오르는ㅜㅜ 이렇게 난 방탄없는 하루를 버틴다.. 윤기야 너무 고생하고 수고했어ㅜㅜㅜ,1,story
821,음악에 진심인 아티스트 슈가가 관객들에게 본인의 음악들을 공연을 통해 어떤식으로 최선을 다해서 보여주고 싶었는지 알 수 있었습니다. 처음부터 끝까지 완벽했고 슈가의 나래이션 한마디 한마디가 감동적이었습니다. (To. 슈가) 콘서트와 또 다른 감동을 줘서 정말 고맙습니다ㅠㅠ,1,story
822,작년 8월로 돌아간 기분이여서 너무 신났다!!,1,story
823,콘서트 또 가고 싶다!! 한번으로는 부족해 또 봐야지,1,story
824,개봉당일 보고왔는데 너무 재밌고 울컥울컥하고 imax 큰 화면으로 보니 저때로 돌아간 느낌이 더욱 더 크게 느껴졌어요. 월드투어 돌아줘서 너무 고마워,1,story
825,xx타이밍만 기다렸는데 묵음처리되서 아쉬웠어요… 그래도 행복했습니다.. 윤기야~~ 고마워…,1,story
826,아미들 손수건 챙겨가염. 휴지라도 챙겨가염. 난 말했음.,0,story
827,D-DAY콘서트의 감동이 다시 살아남! 벌써 끝나나 싶을 정도로 몰입감이 좋아요. 또 보러 가겠음!,1,story
828,어거스트디 공연 예매 못했는데 영화관에서라도 봐서 좋아요 근데 촬영하는 사람들은 근절되지 못하나요?,1,story
829,무대에 온 에너지를 다 쏟는 윤기의 모습에 울컥ㅠ 감동ㅠ 고맙고 사랑하고 보고 싶다 보고 싶어 ㅠ 훈련소 잘 마치고 부디 건강하게 복무 잘하길,1,story
830,땀방울까지 생생하게 느껴지는 공연 영상,1,directing
831,삐 - 처리된 욕설 아깝지만 즐겁게 봄,1,story
832,"윤기야 넌 항상 최고야 덕분에 또 버티고 살아가 우리에게 응원과 위로, 희망을 줘서 고마워 내 가수여서 고맙고, 너의 팬이라서 자랑스러워 우리 사이 아직, 여태, 계속 변하지 말자",1,story
833,대화면으로 감상하는 어거스트디 무대는 최고.. 영화버전 편집 좋음✨,1,directing
834,쩔어! 다같이 소리 질러~,1,story
835,다시 23년 8월로 돌아간거 같네요. 신남과 감동 다 있어요. 꼭 보세요. 마음 같아서는 보면서 일어나서 몸 흔들고 싶었습니다 ㅎㅎㅎ,1,story
836,그날의 감동이 다시 되살아나서 너무 감동이었다. 포스터와 TTT도 너무 예쁨. 매일 보고싶은 슈가 어거스트 디 투어 디데이 더 무비 파이팅! 민윤기 사랑해 고마워😍,1,story
