index,Review,sentiment_predicted,category
392,방탄의 슈가로만 대중들에게 알려졌던 래퍼 민윤기의 또다른 모습을 볼수있는 멋진 다큐멘터리! 특히 무대연출과 구성이 독특하고 한편의 인생극을 본것같은 느낌이다 극장에서도 볼수있게 되어서 넘 행복하고 오래도록 기억될 공연임👍👍💜,1,directing
393,콘서트 못갔는데 이렇게라도 볼 수 있어 너무 좋네요,1,story
394,콘서트 장에 온것처럼 실감나게해주셔서 넘 감사합니다 슈가 인터뷰 장면도 같이 보여주셔서 넘 감사하고 화면이 커서 나 혼자서 윤기함께 놀것같아서 넘 좋았어요 아이맥스 짱짱,1,directing
395,우리 딸래미가 울고 웃고 난리가 났었다네요.. ^^,0,story
396,좋았다.. 그리고 너무 그립다..😭,1,story
397,다시 현장에 있던 감동을. 또 보고 싶어요.,1,story
398,"콘서트는 가지못했지만, 콘서트현장을 느낄 수 있었어요. 노래 따라부르고 싶은거 꾹꾹참으며 봤네요. 싱어롱상영회로 재관람할 예정입니다.",1,directing
399,슈가의 음악에 대한 열정과 진심을 느낄 수 있었어요. 피땀눈물이 가득한 그의 노력에 박수를 보냅니다👍,1,directing
400,gooood gooood gooood,1,story
401,큰화면으로 큰사운드로 듣고 보니 더 좋았다💜,1,story
402,누가 이만큼 해. 어거스트 디. 진정한 이 시대의 아티스트.,1,story
403,디데이 투어의 추억을 다시 꺼내볼 수 있는 소중한 시간이었고 마치 현장에 있는 것 같아 보는 내내 너무 행복했습니다 :),1,story
404,"묵음처리, 어땠을까 없어서 아쉬웠지만 윤기콘 다시 볼수있어서 좋았어요💜",1,story
405,VCR이 없다는게 아쉽네요 다시는 못 볼 공연이라 아쉽.. ㅜㅜ,1,story
406,"보면서 어느새 따라부르고 있고, 자연스럽게 머리도 같이 흔들고 있고, 나도 모르게 같이 놀고 있는 나를 볼 수 있고 끝까지 다 보고 난 뒤엔 홀린 듯이 슈가에게 푹 빠져있을 것이다. 확신한다.",1,story
407,환한 아미밤 속 윤기를 한시간 반동안 볼수 있어서 너무 행복했어,1,story
408,gooood gooood gooood,1,story
409,콘서트 못 가서 너무 아쉬웠는데 이렇게라도 보니까 좋았어요 민윤기 보고십다..@,1,story
410,아미라면 반드시 봐야할 콘서트 무비,1,story
411,너무 최고입니다~ 보고 싶었던 공연 CGV에서 보게되어 좋았어요,1,story
412,역시 영화로 즐기는 맛은 또 다른 것 같다!! 화질과 앵글 그리고 아맥다운 스케일!! 또 보러 가야징💜,1,directing
413,"빗소리부터 너무 떨려서 다시 23년 8월로 돌아간 기분 욕설 무음처리는 아쉽지만 그래도 그때의 감정이 떠올라서 너무나 좋았다 중간중간 인터뷰에 힝구리했다가도 미친듯이 리듬 타는 날 볼 수있음ㅋㅋㅋㅋ 이 공연으로 2,3년은 버틸 수 있지않을까란 말이 너무나 고맙고 진짜 너무너무 보고싶다",1,story
414,"디데이 파이널 올콘했지만 볼 수 없었던 입퇴장모습을 볼 수 있는 거 하나만으로도 개큰감동 개큰매입부르는 영화,,🥹💜",1,story
415,콘서트때 기억이 나면서 좋앗어요ㅎㅎ,1,story
416,전체관람가라서 욕 묵음처리 된 게 제일 아쉬웠지만 너무너무 재밌고 즐겁고 행복하게 봤어요 아이맥스에서 봤더니 콘서트 갔을 때 그 분위기가 확 나더라고요 워치로 심박수 봤는데 148까지 올라갔더라고요 ㅋㅋㅋㅋ 진짜 꼭 보세요,1,directing
417,디파콘 갔을 때의 추억을 되살려주는 영화ㅠㅠ 작년으로 돌아가고 싶어요. 영화로 제작해줘서 고마워 윤기야💜💜💜 콜라보 무대도 너무 좋았고 내년에 만나 :),1,story
418,재미있게 보고 나왔어요,1,story
419,너무 좋았다ㅏㅏㅏㅏ 콘서트가 너무 가고싶은 영화😆😆 민윤기 귀여우ㅝㅓㅓ,1,story
420,넘넘 즐거웟어요 슈가 컵이 었어져서 좀 아쉬었어요,1,story
421,윤기만이 할수 있는 무대 넌 역시 무대에서 살아야할사람 그렇게 사랑하자 무대를 너 자신을 윤기야 힘내!!!,1,story
422,민윤기 보고 싶다 7방탄 보고 싶다,0,story
423,지난 여름 콘서트의 기억이 떠올라서 울컥울컥 했지만~ 큰화면과 빵빵한 사운드로 윤기를 다시 볼수있어서~ 너무 좋았어요~ TTT 못받은거는 서운하지만요 ㅠ3ㅠ,1,story
424,온라인콘서트는 확실히 화면 큰 극장에서 봐야 더 감동이네요 아미밤상영회 기대됩니다 싱어롱도 하게 해주세요,1,story
425,슈가 디데이 역시 음악은 힙합!,1,directing
426,막공은 죽어도 못잊을듯. 그 공간에 함께해서 너무 행복했다 윤기야,1,story
427,앙콘 라스트의 감동을 그대로 느낄수있어서 좋았어요.,1,story
428,보고싶다... 그렇게 말하니까 더 보고싶다,1,story
429,콘서트 때의 감동을 다시 한번 느낄 수 있었다 아니 내 사랑을 확인할 수 있는 거 같기도... 정말 벅차오른다..,1,story
430,행복했던 지난 여름날을 생각하며 정말 행복한 시간이었어요 영화관에서 상영해 주셔서 너무 김사해요 공연 장면 뿐만 아니라 윤기의 인터뷰 내용들이 같이 있어서 너무 알차고 좋네요 중간에 나오는 묵음이 살짝 아쉽지만 너무 즐거운 시간이었습니다. 재관람 예정이예요,1,story
431,"너무 기다렸던 영화. 내가 기다렸던 스토리 진행은 아니었지만 슈가가 담아내고자 했던 내용들에 집중하게 되었다. 무대를 위한 열정, 무대에서 행복한 모습 그리고 그 눈에 행복한 아미들과 함께한 멤버, 함께 완성해준 팀슈가 모두 감사해요. 사랑해 민윤기",1,story
432,슈가(민윤기)의 인생철학이 느껴지는 콘서트 뮤비,1,story
433,포스터나 다른 특전을 내주세요. 넘버링 특전으로 이런 건 안 나왔으면... :(,0,story
434,콘서트에 온거같은 분위기. 편집.음향 모두 너무 좋았음ㅠ 민윤기 ㅠ보고싶어ㅠ,0,directing
435,콘서트 다시 보고 싶네요 ㅠ 슈가 다시 보고 싶네요 ㅠ,1,story
436,콘서트다녀온 기억이 새록새록... 콘서트가고픈 마음에 들썩들썩... 돌아올콘서트 내자리 제발 간절ㅠㅠ,1,story
437,"무대위의 슈가, AgustD가 콘서트 현장에 있었던 그날처럼 생생하게 느껴졌습니다👍",1,story
438,영화 시작되면서 작년 여름으로 돌아간 느낌 중간중간 윤기 목소리로 나오는 멘트들도 너무 좋고 묵음 처리된 부분들 아쉽긴했지만 충분히 신났다 슈가 덕분에 올해도 작년 여름 기억으로 버텨보겠다고 마음을 다잡게 되는 영화 좀 더 즐기면서 기다리고 있을게 💜,1,story
439,"방탄소년단의 랩퍼이자 둘째인 슈가의 디데이더뮤비 파이널 둘째날 공연을 직접 보고 와서 더욱더 보고싶었던 디데이 더 뮤비 그때 그 감동이 다시 살아나면서 너무 좋았어요 멤버들 전원 입대전에 정국,남준,지민이가 함께해서 더욱 행복한 공연이었고 좋은 추억 만들어줘서 고마워요💜",1,story
440,슈가군 너무 멋있읍니다… 짱짱…,1,story
441,"제가 작년에 입덕을 해서 콘서트는 꿈도 못 꿔보고 끝났는데, 슈가가 콘서트 했었던 거를 볼 수 있다는 게 너무 좋았어요♡♡ 정말 스릴넘치고 또 눈물도 나고, 진짜 보고 싶었던 게 슈가 콘서트였는데 이렇게라도 봐서 너무 행복했습니다!!",1,story
442,"음량 화질 굿! 콘서트 순간으로 돌아간거 같고 좋았습니다. 단 CGV 특전을 개봉 첫날임에도 소진으로 못받은건 ㅡ.,ㅡ굿즈컵도 품절...CGV 대실망",0,story
443,슈가소녀는 너무 행복하다 \(* ' U ` *)/ 콘서트 당일 두근거림을 아이맥스로 다시 느끼다니,1,story
444,"아무리 좋았던 기억이라도 시간이 지나면서 희미해지고 감정만 남아서 아쉬운데 내 인생 중 가장행복했던 날들의 기억을 다시 상기시켜준 윤기야, 고마워",1,story
445,잊지못할 추억을 만들어준 윤기와 멤버들의 소중한 기억을 소환하며 아낌없이 그리워했다. 늘 그렇듯이 공연은 진리다.,1,story
446,다시 콘서트 본 기분이 들어서 너무 좋았어요~~ 특히 윤기 보니 너무 좋고~ 콘서트 감동을 다시 느껴서 너무 행복했습니다💕 감사합니다~~💜,1,story
447,콘서트의 감동이 배가 되는 영화! 음악과 무대는 슈가의 모든 것임을 새삼 확인했습니다. 무대에서 모든걸 쏟아내는 그의 에너지는 어마어마 하구요 오놀아놈 아미들의 모습도 너무 좋구요💜꼭 보세요 당신이 아미라면,1,directing
448,가슴이 벅차며 감동과 여운이 아직도 너무 좋아요,1,story
449,무대위에 있는 윤기는 세상 너무 멋있구..,1,story
450,민윤기 최고야 보고싶어 사랑해🥹💜,1,story
451,콘서트때 느낌 생생 ㅠㅠㅠㅠ너무 조타요,1,story
452,"민윤기로 꽉 찬 시간이었다! 2025년이 기대되네ㅔㅔㅔ 근데 삐- 처리는 별로였다,,",1,story
453,음향도 좋고 편집도 좋고 화질도 좋음,1,directing
454,들어가기전부터 8월 그날의 기분과 분위기가 느껴지면서 진짜 행복했어요 아미가 아닌 사람들이 본다고 해도 충분히 감동받을만한 무대와 중간중간 나오는 인터뷰랑 인터뷰의 내용도 너무 좋았어요 아티스트는 공연을 하는 사람이고 공연을 할 때 행복해보인다던 널 볼 수 있게해줘서 정말 고마워,1,story
455,무대 위에서 가장 빛나는 윤기 무대를 얼마나 사랑하는지 얼마나 준비하고 노력했는지가 고스란히 목소리로도 담겨 있어서 좋았어요.. 더 큰 무대가 아니여도.. 더 좋은 무대가 아니여도 다시 무대에서 볼수 있는 날까지 버티는데 위로가 되어주네요..,1,story
456,"슈가, Agust D, 그리고 민윤기. 음악을 사랑하고 무대를 사랑하는 이 아티스트의 첫 솔로 투어의 일부분을 담은 '디-데이' 더 무비는 이 아티스트가 어떻게 수만 명의 아미들을 미치게 했는지, 미치게 하는지, 미치게 할 건지, 확인 할 수 있는 지표가 되지 않을까 생각한다.",1,directing
457,"아티스트 슈가, agustD 최고입니다",1,story
458,윤기 보고싶어요ㅠㅠㅠ,1,story
459,슈가 최고~ 정말 몰입도최고의 콘서트,1,story
460,아이가 좋았다고 합니다,1,story
461,군백기인데 이렇게 영화 나와서 좋았음!!,1,story
462,슈가 사랑해... 덕분에 군백기 버틴다.... 보라해,0,story
463,시소 들으러 3번 갔네요또다른 뜻을 알고 다시 들으니 눈물부터 나 미치겠드라구요8ㅡ8콘서트 현장에서도 영화관에서도 우린 연결되어있다는 걸 느꼈어요짜릿하고도 깔끔하게 여운 없이 행복하게 탁 끝나는 느낌을 또 어디서 느낄 수 있나 싶어요윤기야 고마워덕분에 행복했어,1,story
464,작년 콘서트를 또 다시 추억을 되살릴수 있어서 너무 좋았습니다.,1,story
465,"작년 너무너무 행복했던 콘서트를 다시 한번 생생하게 볼 수 있어 좋았어요! 이 기억 다시 안고, 2025년 기다립니다! 아포방포💜",1,story
466,"두번에 걸쳐 영화를 보면서 콘에 대한 연출력, 장악력, 아미들의 함성 유도 넘 멋진 무대를 해준 슈가에게 정말 고맙다는 말 밖에 못하겠네요 앞으로 이런 콘서트를 또 갈 수 있을지~~~~ 슈가의 미래 콘서트를 기대하며 기다리겠습니다 사랑해요 민윤기",1,directing
467,공연장 못간 아쉬움을 조금은 달래주었던 공연위주의 화면에 감동받음,1,story
468,방탄 팬 아니면 즐기기 어려움,0,story
469,작년 뜨거웠던 8월로 되돌아 간 느낌 중간 중간 나오는 에피소드와 진심이 가득 담긴 인터뷰에 감동받았습니다 큰 화면 가득 예쁜 슈가가 가득했고 현장감 느껴지는 사운드도 좋았습니다 슈가랑 아미가 함께 만들어 완성한 한편의 각본 없는 드라마 한번 보시면 왜 BTS인지 슈가인지 알수있어요,1,story
470,환상적이였습니다!!,1,story
471,역시 민윤기!!?\ ’? - ? -マ/? (씨이발) 묵음 처리한건 아쉬웠음/? - ? -マ ?,0,story
472,콘서트를 다녀왔는데도 미쳐 보지 못한 순간들을 큰 화면으로 볼 수 있어서 좋았어요!빗소리가 시작될 때 콘서트 시간으로 돌아간것 같아서 설레였어고 각 곡마다의 감동이 전해져서 넘 좋았습니다 #AgustD #Suga #BTS #SUGA _AgustD_TOUR D_DAY_THE_FINAL,1,story
473,이렇게라도 다시 볼수 있어 너무 행복했고 소신발언 하자면~아미 떼창 볼륨 좀 키워주지~ 아미 노래 잘 하는데~ ㅋㄹㄴ끝나고 공백을 채워주려했던 슈가의 마음이 얼마나 크고 넓은지 다시 한번마음에 되새기며~ 기분 안좋을때마다 파이널 첫날기억을 계속 상기 시킬께~ 다~ 고맙다 그냥. 다 고마워,1,directing
474,너무좋았어요 감동그자체!! 한가지아쉬운건 굿즈판매를 제한없이다해버려 그게좀...,1,story
475,내가 유ㅐ 콘서트를 안갔지 ㅠㅠㅠㅠ😢🫢😢🫢😢🫢😢😢😭😭😭❤??🔥❤??🔥❤??🔥❤??🔥,1,story
476,짧은듯하였으나 실감나고 재밌었어요,1,story
477,"사운드 너무 깨끗했고.. 4DX로 아미밤 흔들면서 봤슴 더 미칠뻔 ㅋ 전체관람가라 콘서트의 실제보다는 살짝 아쉬운 부분도 있었지만, 혼자여도 꽉찬 에너지 느꼈어요. 아미밤 상영회를 왜 하루만 하는지 극장에서 하는 BTS 영상은 무조껀 아미밤 상영회로 해야돼요. 그게 진리입니다.",1,directing
478,역쉬~~~민윤기가 민윤기했다.,1,story
479,재밌어요! 소리가 좋았다,1,story
480,"좋은 것은 크게크게 봐야해요! 영화 속 디데이 파이널콘 마지막날에 가서 봤던 팬으로서, IMAX로 다시 보니 너무 좋았어요. 감동이 몽글몽글. 그런데 IMAX 특전이 개봉 2일차인데 다 품절인 건 너무 수량을 생각 안 하고 준비하신 거 아니에요?? 이 부분 개선이 필요하다고 봐요.",1,story
481,간만에 심장두근거리는 경험함..아직도 멈추지 않아.. 삶에대해 생각하게 하는 공연이었음,1,story
482,실제 관람하지 못한 한을 조금이나마 해소했네요,1,story
483,"윤기야💜 너 진짜 잘한다 최고다 정말 영상미와 사운드 최고!! 실제 공연보다 짧아서 아쉽긴 하지만, 멤버들이랑 함께한 무대도 다 볼 수 있고, 무엇보다 라이브를 그대로 느낄 수 있어서 좋았어요. 오랜만에 보라피 수혈완료 2025년에 있을(?!!) 콘서트 벌써부터 기대됩니다",1,story
484,"콘서트 컨셉, 무대 구성 등은 준비를 많이 하셔서 괜찮았지만 라이브가 많이 부족하신 것 같네요. 제대하신 후에 더 좋은 라이브를 보여주셨으면 합니다.",0,story
485,매번 볼때마다 새로운 공연보는거 같은데 색다른 촬영기법과 음향으로 또다른 공연 보는거 같아서 너무 즐겁고 새로웠습니다. 게다가 아이맥스 화면으로 보니깐 더 생생하더라구요!,1,directing
486,콘서트를 실제로 관람한 입장에서 보면 실제 공연을 실감나고 감동있게 다 담을순 없겠지만 많이 부족한 흐름의 편집으로 감동이 느껴지지 않은 영화였어요!조금 믾이 실망스럽습니다ㅠ,1,story
487,궁금해서 봤는데 간혹아는 노래도 꽤있었고 콘서트 내용이 참 알차더라 팬들과 뜨거운 교감도 멋졌음 중간에 멤버들도 나오던데 보기좋았고 서로 어울렸을때 아우라가 있더라 rm 간지,1,story
488,하루 중 제일 행복했던 시간이었어요 울었다 웃었다 반복하고 역시 내 가수 최고다 너무 멋있다 속으로 계속 외치고 영화 끝나고 너의 영원한 관객이될 게라는 약속을 다시 한 번 더 하고 나왔어요 윤기 오빠 우리 25년에 만나요~ 보라해💜,1,story
489,다른 말 뭐가 필요 있을까요? 누가 민윤기만큼 해? 재밌게 잘 봤습니다 근데 18금 걸고 원래대로 보여주셨음 더 좋았을거 같아요 모두가 함께 즐기기에는 나쁘지 않았습니다!,1,story
490,콘서트의 현장감이 느껴져서 작년의 추억이 새록새록♡ 전체관람가 등급에 맞춰 일부 비속어들 묵음처리가 아쉬웠음 ㅜㅜ,1,story
491,그때의 기억을 생생하게 다시 느낄수 있는... 12세관람이라 묵음과 삐~로 처리된건 어쩔수 없지만 너무 좋은 관람이었다,1,story
492,믿고 보는 슈가 영원한 공연쟁이가 되어줘~!!!,1,story
493,민 윤 기 사 랑 해 보 라 해 💜,0,story
494,기대보단 좀 아쉬운 느낌,0,story
495,큰화면으로 다시 볼수 있어서 너무너무 좋았어요 우리윤기 완전 섹시하고 멋짐 뿜뿜뿜!!!! 건강하게 다시만나요 ㅠ 같은자리에서 언제나 응원하고 기다릴게요 🤗💜보라합니다 💜,1,story
496,"윤기 서울첫콘 갔을때가 엊그제 같은데 뿌엥🥹 다시한번 그때 감동과 설렘을 안겨죠서 고마워 포스터,TTT,스탬프도 퀄리티 짱좋구, 근데 콜드컵은 재고 이렇게 부족해도되는검니까 씨지븨!싱어롱도 해금상영회도 갈건데 너무 기대됩니다💜 아포방포 아미분들 즐거운 관람하세요",1,story
497,보고싶었어 윤기야 콘서트때 기억을 되살려줘서 고마워 행복하게 해줘서 고마워ㅜ,1,story
498,작년 8월로 돌아간 느낌이에요! 음악적으로도 시각적으로도 공연때 놓친 부분들을 더 잘 느끼고 볼 수 있어서 행복한 시간들이었습니다💜,1,directing
499,공연을 좋은 음향과 큰 화면으로 볼수 있어서 좋았습니다.,1,directing
500,아이맥스 화면만큼 큰 감동,1,story
501,공연 실황을 생동감 있게 즐길 수 있었어요,1,story
502,"라이브,무대연출을 고스란히 생동감 있게 느낄 수 있었습니다.아티스트의 나레이션에서 느껴지는 공연,무대에 대한 진심이 인상적이었어요. IMAX 스크린으로 보니 마치 현장에 와있는듯한 느낌이 들어서 좋았습니다!",1,directing
503,콘서트장에서 느꼈던 기분을 다시 느낄 수 있었다,1,story
504,직관때는 못봤던 포인트들을 볼 수 있어서 좋았어요,1,story
505,너무 좋았어요 아이맥스관에서 보니 음향이 실제로 콘서트에온느낌을받았어요,1,directing
506,슈가의 팬사랑 표현 방식과 팬들의 니즈가 뭔지 잘 안다는 것이 잘 담아낸 영화였다.,1,story
507,콘서트 실황은 역시 아이맥스네요!! 아티스트 표정 하나하나 세밀하게 볼수있어서 너무 좋았어요 한번으로는 부족하니 또 보러갈꺼에요,1,story
508,최고... 말해뭐하나요... 너무 짧아서 아쉬울 정도 ㅠㅠㅠ,1,story
509,작년 더웠던 여름으로 돌아간 느낌ㅠㅠ,1,story
510,실제 공연에 가지 못한 아쉬움을 달래기에 충분했던 공연이었습니다 실제 공연에서 불렀던 몇 곡이 생략 되었다고는 하는데 그건 공연을 못 본 제 업보려니 하구요 나아는 행복합니다아,1,story
511,저희 집 바깥양반이 군대가기 전에 한솥 끓여둔 곰탕이예요. 진한 맛이 일품이구요 진미구요 환상의 맛입니다. 원래 욕도 찰지게 잘하는 양반인데 전체관람가를 위해서 입만 벙긋하더군요 괜찮아요 다른 처들이랑 한번에 모일때엔 대신 우리가 외치면 되니까요,1,story
512,욕 삐처리 빼고 다 좋았음 사운드도 현장이랑 비슷했던 느낌,1,story
513,누구인지도 모르고 그냥 들어가봤다. 졸리다,0,story
514,"실제 콘서트도 다녀왔고, 영화도 관람한 사람인데 편집 잘 해주셨다고 생각해요 다만.. 실제 공연에 있던 몇 가지 곡이 사라져서 기대하던 곡 수가 줄어서 아쉬웠어요. 그래도 현장의 생생함을 최대한 반영하신 듯하여 만족합니다",1,directing
515,"영상, 사운드 너무 만족스럽고 아티스트 민윤기를 가까이에서 느낄 수 있어서 너무 행복했어요~",1,directing
516,현장이나 라이브스트리밍과는 다른 앵글과 차원이 다른 선명함으로 즐길 수 있어서 최고! 생생한 현장감 덕분에 순식간에 2023년 8월로 돌아간듯한 느낌...! 보고싶다 윤기야...!,1,directing
517,천재 민윤기 너무 멋있어요!,1,story
518,이렇게라도 콘서트 관람할 수 있다니 너무 좋았어요~ㅠㅠ 같이 뛰고 손 흔들고 싶었네요^^,1,story
519,2023년으로 되돌아간 기분 🥲 오랜만에 다시보게되니까 너무 반갑고 모든 무대가 소름돋게좋았어요 원래 멘트와 가사들 묵음처리없었다면 더 좋았을텐데 😭😭😭😭싱어롱 가만안두겠어...,1,story
520,현장과는 또다른 느낌이었어요! 다르지만 역시나 좋은 가수의 공연에 더 집중할 수 있었고 무엇보다 음향이 너무 좋아서 눈과 귀가 모두 즐거웠습니다💜,1,directing
521,슈가의 투어 최고시다,1,story
522,짱 재미있었어요.슈가는 역시 ?,1,story
523,공연을 갔던 사람들은 추억을 회상하면서 좋았을거고 공연을 못갔던 사람들은 그때의 아쉬움을 달랠수 있었을거고 윤기를 모르는 사람들은 이들이 얼마나 공연에 진심이고 잘하는지 알게됐을 영화,1,story
524,23년 여름을 절대 잊을수 없죠 어거스트디 슈가 민윤기 디데이투어 다시한번 그 열기를 느꼈습니다. 아티스트의 열정과 수고를 고스란히 느낄수 있었어요,1,story
525,콘서트라이브도보고 다 했지만 색달랐어요! 다른각도로 찍은영상도 멤버들끼리무대한것도 크게보니 더 좋네요!! 윤기야너무 고마워!,1,directing
526,실제 공연에서와는 다른 느낌의 각도로 볼 수 있어서 좋았어요. 내가 다녀왔던 그 추억을 다시 한번 상기시켜주는 느낌도 들었습니다. 아미를 생각하는 윤기 비하인드 느낌으로 공연뿐만 아니라 가수의 생각을 알 수 있어서 좋았습니다. 2025년의 완전체 7방탄을 기다릴게 평생 아미다짐!,1,story
527,슈가 재밌었어요 ^^...,1,story
528,대화면으로 보는 콘서트는 직관과 다른 즐거움이 있네요!,1,story
529,아미라면 꼭 봐야되는 영화...👍 진짜 찢었다,1,story
530,제가 BTS를 너무많이좋아하는데요 슈가님 민윤기님 너무 열정적으로 노래도 너무잘부르시고 너무잘생기고 기타랑 피아노 너무 잘치시더라고 보면서 너무기분이 좋아서 봤어요 그런데 멤버들 군필돌이 되서 빨리 2025년 다같이 뭉쳤으면 좋겠네 아미 너무사랑합니다♡,1,directing
531,콘서트서 또 보자 윤기야~,1,story
532,덕메들과 오랜만에 모여 행복한 시간이였어요!! 아미밤상영회차 더 기대됩니다 :),1,story
533,실제 콘서트 현장에서 3일동안 즐겼지만 영화로 보는 디데이 더 무비는 몸으로 느끼느라 제대로 보지못한 새로운 장면들을 볼수있어서 더 여운에 남아요 시간이 나면 매일 1번씩은 또 보고싶네요. 공연을 좋아하시는 분이라면 우리 슈가의 매력에 한번 빠져보시는것도 추천드립니다.,1,directing
534,열정적인 콘서트 무대 좋았어요🔥 다만 콘서트 현장의 사운드가 모두 녹음이 안된건지 입체적인 사운드(테일러 스위프트나 아이유 콘서트에 비해서)가 아니어서 아쉬었어요😭,1,story
535,재미있게 봤습니다..,1,story
536,역시 크고 음향이 더 좋은 시설에서 봐야 되는 영화였습니당 실제 콘서트를 보고왔던터라 그때 그 추억이 그대로 되살아나고 카메라시선 편집관점이 시작부터 현장에 가서봤던 시선과 달라서 신선하고 좋았어요~ 꼭 보세요~,1,directing
537,2024. 04. 10. 관람평,0,story
538,2024. 04. 10. 관람평,0,story
539,2024. 04. 10. 관람평,0,story
540,2024. 04. 10. 관람평,0,story
541,2024. 04. 10. 관람평,0,story
542,"중간중간 인터뷰 영상이 포함돼있어서 좋았어요! 디데이콘의 묘미는 시원한 욕인데 전부 묵음처리가 되었고, 세트리스트도 너무 짦게 편집돼서 그 부분이 조금 아쉽네요ㅠㅠ 실제 콘서트장에 갔었던 그 때 그 분위기와 공기가 떠올라서 추억하기 좋았습니다. 이 기억으로 평생 곁에 남을게요🩷",1,directing
543,Future's gonna be okay,1,story
544,나도 윤기도 작년에 많이 행복했구나를 느낀 영화 하드코어로 랩신랩왕을 만들어 줘서 고마워 퓨쳐스고나비오케 오케옼케,1,story
545,여름하면 디데이 콘서트가 생각날 정도로 진한 여운이 남는 공연이랄까요♥ 또 보러갈래요!!!,1,story
546,편집이 좀 아쉬웠지만 윤기 무대는 너무 좋았다,1,directing
547,그날의 날씨.온도.습도.공기를 다시느끼게해줘서 고마워요.공백기를앞두고 그걸 못느끼게 아니 견딜수있게 해주고싶었단말이 너무너무 먹먹했고 공연을사랑하고 즐기는 진짜아티스트의모습 누가너만큼해!!!!,1,story
