index,Review,category,sentiment_predicted
2035,😀 👍스토리가 있고 일본의 악행이 소름끼칩니다,story,1
2036,모든 배우들의 연기에 감탄하지 않을수 없었어요 한국영화의 발전에 감탄했어요.최고,actor,1
2037,기대감때문인가. 좁은 스토리폭에 실망감.,story,0
2038,아빠랑 재미나게 잘 보았어요.실화와 픽션..이장군님이 뭐 할 줄 알았는데..아쉽..막판..어벤져스가 동시에 처리했으면.하여튼..파묘2.갑시다.일본 음양사 처부수러~~고고싱,story,1
2039,환타지와 감동과 조선인의 뭉클함이 함께해서 오래 기억될것 같아요,story,1
2040,아빠랑 재미나게 잘 보았어요..실화와 픽션..이장군님이 뭐 할 줄 알았는데..아쉽.막판..어벤져스가 동시에 처리했으면..하여튼.파묘2.갑시다.일본 음양사 처부수러~~고고싱,story,1
2041,소름끼치는 연기력 좋았습니다. 스토리가 조금 이해가 안갑니다 ㅠㅠ,story,1
2042,정말정말 너무 재미있게 봤네요...오랜만에 긴장김 늦추지않고 몰입해서 봤네요...천만돌파가 머지않은듯해요,story,1
2043,잼있게봤어요 김고은 연기짱,actor,1
2044,스토리는 기대했던것보다 별로였지만... 주인공 4명의 연기가 너무 좋았어요!,actor,1
2045,소재도 독특하고 연기도 좋았어요!!,actor,1
2046,중간중간 깜짝놀랏지만 재밋엇어요,story,1
2047,넘무서워 죽는줄~ 감독님짱임니다요,story,1
2048,생각보다 무서운 영화는 아니지만 결말이 좀 아쉬워요,story,1
2049,계속긴장하면서재밌게봤어요,story,1
2050,공포덕후인지라 타노스 나오고선 약간 실망 했어영,story,0
2051,와우~~~!!!진짜 잼났어요. 역사를 다루고 내용도 꽉~! 채운 알찬 영화였습니다. 출연진도 진짜 미쳤네요. 잘 봤습니다.,story,1
2052,음양오행설이라니 신박하다!!!,story,1
2053,흥미진진하고 스릴 넘쳤음,story,1
2054,천만영화 될줄이야?ㅎㅎ,story,1
2055,오컬트적인 요소가 매력적이고 생각보다 깔끔하게 마무리 되어서 재밌다,story,1
2056,음향도 좋고 스토리도 좋았어요 만족한 영화관람 즐겼습니다,story,1
2057,시간가는줄 몰랐네요~~,story,1
2058,장으로 제목나오면서 풀어가는게 흥미진진했어요!!,story,1
2059,천만 영화라니? ㅎㅎㅋㅋㅎㅎ,story,1
2060,쫀쫀하게 잘 만들었네요. 배우들 연기력 정말 짱입니다,actor,1
2061,생각보다 무섭진않고 재밌게 볼만했어요,story,1
2062,요즘 나오는 영화들 중에서는 가장 괜찮아요.중간에 갑자기 장르변경 느낌이 있지만..,story,1
2063,보는내내 긴장감을 늦출수가 없었네요. 연기력 역시 일품입니다~,actor,1
2064,복선회수 탄탄 배우들 연기 최고 엔딩까지 자연스럽고 납득가능 재밌고 흥미롭게 봤습니다 +엔딩크레딧 노래가 좋았어요,directing,1
2065,글쎄 뜬금 천만? 왜 김고은 정도,story,0
2066,리뷰보고 걱정했지만 볼만 했어요,story,1
2067,배우들 연기 정말 미쳤네요 잘 봤습니다,actor,1
2068,무서운 영화 못보는데 보길 잘한듯 천만 미리 추카,story,1
2069,막판에 좀 지루했는데 볼만했어요 배우 연기가 최고네요,actor,1
2070,영화 그 자체로도 재미있고 메시지도 좋았다,story,1
2071,좋아요.일제강정기를 다시생각할수있었어요,story,1
2072,모든 부분이 최고 찬사를 받을만 하네요 최민식배우와 김고은배우님의 연기력 최고입니다,actor,1
2073,연기들이 다들 너무 좋으셔서 몰입이 잘되었어요,actor,1
2074,모르고봤으면 더 재밌었을듯..,story,0
2075,정말 이십년 래 처음으로 극장 재관람까지 하고 간만에 정말 재미있게 봤습니다 ㅎㅎ,story,1
2076,N차 관람하고 싶을 정도로 저는 재미있었습니다! 후반부 별로라고 하는 분들 많은데 지루할 정도는 아니고 관심있는 분들에게는 설득력 있었을 듯~,story,1
2077,재미있게 잘 보고 갑니다 즐거운 주말 보낼 수 있어서 좋았어요 후속편 만들면 좋겠는데 좀 더 오컬트다우면 좋겠엉?,story,1
2078,만족합니다 수고하세요,story,1
2079,"매력터지는 한국 오컬트 영화! 집중해서 봤다면 전반 떡밥들 충분히 나왔어서 후반부에서 전혀 어색한 느낌 못받을듯? 서사, 비쥬얼, 배경음악까지 오랜만에 너무 재밌게 본 한국 오컬트영화였어요~ 김고은님 동시대 여배우중진짜 탑 인정 ㅠㅠ",story,1
2080,재밌게 봤어요 인상적이긴한데 교회장로 설정은 쫌,story,1
2081,인기 많아서 궁금했는데 재밌었어요,story,1
2082,인기 많아서 궁금했는데 재밌었어요,story,1
2083,풍수지리 음양 오행에 대하여 공부를 하고 싶어요. 재미있어요.,story,1
2084,긴장감 넘치네요 순간 순간 놀랐구요 재미있었어요,story,1
2085,갑툭튀 많아서 친구 팔을 방패삼아 눈을 잠시나마 저의 심신의 안정을 위해서 가렸습니다. 근데 요괴는 귀엽게 생긴듯,story,1
2086,"좋았어요. 흔한 귀신 영화인줄 알았는데, 땅에 대한 영화 였어요.",story,1
2087,연기파배우들 연기는 명불허전,actor,1
2088,완전히 몰입해서 봤어요! 배우들이 연기를 너무 잘 해서ㅎㅎㅎ 또 관람하고 싶은 영화입니다!,actor,1
2089,시작부터 김고은의 연기력. 너무 멋있어요...,actor,1
2090,쫄보도 볼 수 았는 미스터리 영화,story,0
2091,사운드가 크긴하지만 재밌게봤어요,story,1
2092,재미있게 잘 봤어요 배우들 연기가 좋아요,actor,1
2093,흥미로운 영화네요.재밌게 잘 감상 했어요.,story,1
2094,재밌었는데 중간 중간 무서워 제대로 못보고 눈 감았네요 ~,story,1
2095,믿고보는 장재현. 전달하고자 하는 메세지가 너무 좋았음,story,1
2096,천만관객의 이유를알겠어요. 너무재미있었어요,story,1
2097,나름 재미있고 의미 있었습니다.,story,1
2098,"너무 재미있게봤어요. 정말 어디하나 흠잡을때가 없네요. 다만 CGV 불광점 카카오톡 선물 받은 티켓으로 예매했는데, 팝콘세트는 불가라고 쌩돈주고 사먹었네요. 팝콘세트를 판매안하는것도 아니고, 동일제품을 판매중인데, 팝콘세트만 다른점에가서 먹으라는건 좀... 고지도 안되어 있고...",story,1
2099,3번 봤어요 계속봐도 너무 재밌었어요,story,1
2100,엄청 재미있었어요!!!,story,1
2101,아쉬운 점을 꼽자면 굿 장면이 적었던 것이다,directing,1
2102,마지막 30분이 조금 어설퍼 ㅠㅠ 배우들 연기는 짱 ~~,actor,1
2103,"너무 재미있어서 두번째 영화를 봤습니다 최민식 배우님, 유해진 배우님은 당연히 연기를 잘하시지만 김고은 배우님, 이도연 배우님의 연기는 정말 깜짝 놀랐습니다 정말 대단한 연기고 스토리도 너무 좋았습니다",story,1
2104,너무 몰입감 있구 재미있게 잘 봤어요,story,1
2105,잘만든 한국형 오컬트 영화 인거 깉다,story,1
2106,역시 기대만큼 좋았어요..^^,story,1
2107,재미있게 잘 봤습니다 :-),story,1
2108,몰입도 최고~~ 배우들 연기력 최고~~ 스토리 최고~~ 이 영화 추천 합니다,story,1
2109,2시간10분 러닝시간동안 초반에는 배울점도 있는것 같았는데 중.후반에는 일본 관련 스토리이다보니 좀 지루하면서 재미가 없었습니다! 배우들 연기에는 Good.,actor,0
2110,새로운 장르를 본것같아서 좋았습니다. 연기력 대단합니다.,actor,1
2111,진짜 오랜만에 몰입하면서 본 영화! 정말 재밌었다 와우..! 역사 갑자기 나와서 싫었다는 사람도 있는데 난 오히려 자연스럽게 받아들이면서 봤음 억지스럽지않고,story,1
2112,굿 재밌네요 내일 또 보러 가요 ㅋㅋ,story,1
2113,복선을 많이 깔고 가서 이해하기 좋았어요. 재미있었습니다!,story,1
2114,시간 잘 가고 잘 봤어요 연기력 좋아요,actor,1
2115,전반전 3대0 후반전 3대3 진 것 같은 비긴 경기.,story,0
2116,와 너무 잼있었어요 눈을떼지못햇어요 연기력 최고~!!,actor,1
2117,"화림이 공포에 질린 표정에서 우리 조상님들이 얼마나 무서웠을지 느껴졌고, 배우님들 연기 그냥 미쳤음. 모든 배우들의 앙상블이 좋았고, 스토리에 몰입하다 보니 나도 모르게 간절해졌음. 마무리까지 깔끔해서 굿~",story,1
2118,영화 스토리가 감독님의 예전 작품들보다 훨씬 탄탄해졌어요. 잘 봤습니다!,story,1
2119,한번더볼까 생각들정도로 재미있었습니다,story,1
2120,연기력들이 다들 좋아서 보는 내내 손에 땀을 쥐었네요 ㅎㅎ 긴 시간 지루하지 않게 잘 봤어요,actor,1
2121,좋아요!! 재밌어요!!! 무조건 극장에서 보는거 추천드려요ㅜㅜㅜ,story,1
2122,와이프릉 둘다 너무재미있게봄 ㅋㅋ 적당히 쫄리면서 너무재미잇엇음 ㅋ배우들 연기 진짜 개쩜,actor,1
2123,한국형 공포영화네요. 긴장감 있게 잘 봤습니다,story,1
2124,감독님 앞 두편 좋아한데다 관람객수 보고 기대했는데 조금 실망했네요. 물론 영화는 볼만은 하지만 이야기 구조나 진행이 엉성하고 가벼웠어요. 클라이막스도 김빠지고... 아쉽습니다. 멋진 장면들도 예고가 다인 느낌입니다 ㅠ,directing,0
2125,기대를 하면 실망하는경우가 있는데 파묘는 기대보다 더더 이상을보여준 영화 출연진들 모두 연기가 짱 연출도 좋고 오랫만에 영화봐서 너무 굿굿,directing,1
2126,진짜 연기력 무엇!!! 내용두 충실하고 좋았어요,story,1
2127,김고은씨 이런식이면 대배우밖에 못됩니다,actor,0
2128,한국형 오컬트 영화 스토리 탄탄하고 몰입도 있는 음향도 좋았습니다,directing,1
2129,스릴러 좀 무섭기는 했지만 김고은 연기가 좋았어요,actor,1
2130,주요골자가 좀 진부하지만 좋아하는 장르라 재밌게 봤어요. 배우들의 연기도 굿,actor,1
2131,"좋았던 전반전, 실망스러운 후반전 배우들의 연기력이 아니었다면 깨진 계란을 줬을…",actor,0
2132,재밌게 잘봤어용 최고~!~!,story,1
2133,끝까지 긴장감을 놓칠수없는,story,1
2134,파묘는 모든지 조심해야겠다,story,0
2135,1부>2부>3부지만 연기들 좋고 매끄러움 김고은 최고,actor,1
2136,뒷부분이 좀 아쉽지만 파묘라는 소재가 참신하고 전반적으로는 재미있게 봤다!,story,1
2137,짜임이 좋고 반일과 친일을 영화로 통해 드러냈고 김고은 연기가 볼ㅁ2ㆍㄴ함,actor,1
2138,너무재밌습니다ㅜ 안무섭고 너무좋던데요,story,1
2139,시간 순삭. 스토리가 새롭진 않았지만 연기가 정말 좋았다. 마지막엔 약간 소름.,actor,1
2140,굿 👍 훌륭합니다 ~~~,story,1
2141,몰입감이 죽이네요 정말 재밌었어요 배우들의 연기 또한 최고입니다,actor,1
2142,굿굿입니다 잼나게잘봤어오!,story,1
2143,파묘라는 제목을 보고 풍수지리에 관한 것과 묘 이장 등 그리고 그것으로 인한 굿 등을 생각하게 되었고 그러기에 미신과 관련된 내용으로 줄거리가 흘러갈 것으로 생각되어 처음 개봉할 때부터 보지 말아야 할 영화로 생각되었는데 보기를 잘했다는 생각이 든다.,story,1
2144,연기도 좋고 내용도 지루하지 않고 끝까지 재밌었어요^^,story,1
2145,"무서운줄 알았는데, 재밌었어요. 2편 나오면 좋겠네요",story,1
2146,재밌게잘봤어요묘는함부로훼손해선안됐게네요조상들을잘모셔야겠네요,story,1
2147,다들 연기 정말 잘하시네요 재미나게 보고 갑니다..,actor,1
2148,K 오컬트를 제대로 보여준 영화! 스토리에 녹아든 모든 요소가 배우들의 연기력과 함께 너무 멋진 합을 이뤘다! 21년도에 랑* 보고 너무 실망해서 아시아 오컬트영화는 다신 안보겠다고 다짐했는데! 십년 묵은 체증이 내려가는 느낌!! 최고의 배우진이었음!!,actor,1
2149,천만을향해 고고고!!!,story,1
2150,너무너무너무 무서움 근데 재미있음 그리고 약간 이해안감 유튜브에 해석봐야 이해함,story,1
2151,엄청난작품잇ㅂ니다 몰입감붓,story,1
2152,플롯도 허리가 끊겨 고개를 들지 못한다,story,0
2153,긴장의 끈을 놓을 수가 없네,story,1
2154,연기자들의. 뛰어난. 연기가. 돋보이고. 사건전개가. 재미있어. 끝나는시간까지. 재미있게. 보았어요,story,1
2155,완전 긴장감 쫄깃!꿀잼 입니다^^,story,1
2156,긴장감 넘치네요 잘봤습니다!,story,1
2157,역사 관련해서 제작된게 좋았어요 연기 죽였어요,actor,1
2158,반전있고 나의 심금을 울렸다...김고은 내꼬.반했다😍 파묘가 파스텔처럼 묘한 영화색상이 인상적임!!! 영화가 멋있고 이도현 맛있었다.,story,1
2159,재미있게 봤습니다. 좀비물로 변해서 좀 황당했지만 ㅎㅎ,story,1
2160,재미진다. 또 보고 싶다,story,1
2161,기대이상이였고 탄탄한 스토리와 연출. 진짜 모든 배우들의 연기에 심취하네요,actor,1
2162,1000만 가까이 가길래 봤는데 재밌습니다,story,1
2163,전혀 예상 못한 전개 잼나게 봤습니다,story,1
2164,재밌게 잘 봤습니다. 그런데 일본어가 나와서 의아했습니다.,story,1
2165,몰입도 죄강 연기최강 장나요,actor,1
2166,두번봐도 또 보고싶은 스릴영화!,story,1
2167,무서운거 엄청 못보는데 살짝 무섭고 재미있게 봤어요,story,1
2168,좋았어요.좋았어요좋았어요,story,1
2169,너무 흥미진진하게 잘 봤습니다!! 배우분들 모두 연기를 잘하셔서 몰입이 잘 된 것 같아요👍,actor,1
2170,긴장감 집중력 스토리 모두 좋았 어요,story,1
2171,쫄깃함..깨알같은 유머. 재미있게 감상했음..,story,1
2172,충격적인 장면이 많았는데 계속 긴장하게 마들어 주네요,directing,1
2173,폭신한 의자에 앉아 재밌게 봤어요,story,1
2174,이제 겨우 3차 관람 했네요.,story,0
2175,영화 보고나서 웅장해지네요ㅠㅠ 대한민국 국민이라면 꼭 봐야하는 영화,story,1
2176,ㅋㅋ 재미 잇엇어요!! 굿굿,story,1
2177,"좋긴 좋았는데, 기대를 너무 많이 했는지 생각했던 것보단 그랬어요. 중간에 갑자기 괴물이 나와야 했는지 .. 그렇지만 배우들의 연기력은 의심할 여지가 없이 너무 좋았습니다. 스토리 전개의 부족함을 연기력이 메운듯 합니다.",actor,0
2178,배우들 연기 좋고 스토리도 괜찮아요,story,1
2179,어우...심장이 이야...,story,1
2180,검은사제 사바하 파묘 모두 관람했습니다 세영화다 한번 보고는 이해가 완벽하게 되질않더라구요 파묘도 두번 봤습니다 이제 완벽하게 이해했습니다,story,1
2181,재밌어요- 배우들 연기 좋아요,actor,1
2182,어쩌다 어이가 어이구 없는 영화,story,0
2183,스토리 및 최민식&김고은 연기 몰입감있게 재미있게 보고 왔네요,story,1
2184,사운드와 연출이 기가 막히게 좋습니다. 다만 후반부에 공포감이 약간 루즈해지는 느낌 ...?,directing,1
2185,연기도 멋지고 너무 재밌게 봤어요,actor,1
2186,"도입부분은 신선하고 좋았으나, 스토리 전개가 억지스럽습니다. 약간 돈을 밝히는 경향을 가진 주인공들이 후반부에 갑자기 어떤 계기도 없이 애국자가 되는것도 웃기고요.자녀결혼을 앞둔 신부 아빠가 말뚝제거에 나서는 것도 말이 안되요. 이것저것 하려다 다 말아먹은 영화.이게 재밌다면 글쎄?ㅋ",story,0
2187,배우들의 명연기가 인상적입니다.한국영화 멋지네요,actor,1
2188,오랫만에 재밌는 영화 봤어요. 국뽕영화라고 해서 보긴했는데~~ 더 일찍 볼걸 그랬어요. 배우들 연기도 스토리도 너무 좋았어요.,story,1
2189,"두 번짜 관람했는데, 역시나 재미있어요. 강추합니다",story,1
2190,소름돋는 씬이 많아서 무서웠는데 유퀴즈 감독님 출연보고 영화 다시봐야겠다싶음. 천만이번주 돌파겠죠?ㅊㅋㅊㅋ,directing,1
2191,솔직히 엄청 재밌지는 않아요.. 기대가 너무 컸음,story,0
2192,정공법으로 승부한 오컬트.,story,0
2193,재미있게 잘봤어요 무섭기도하고 재미있네요,story,1
2194,복잡하지않고 재밌었어요,story,1
2195,기대 보다 재미는 없네요,story,0
2196,겁나 험한 거...여러 의미로 험하다 험해,story,0
2197,이게 천만 관객 영화인가... 배우 연기는 정말 좋았으나... 좀 아쉬운 부분이 많네,actor,0
2198,재미있어요ㅇㄴㄹㄹㅇ,story,1
2199,한국 오컬트물의 그 특유의 재미가 있었습니다.,story,1
2200,이때까지 보지 못한 스릴러 상당히 재밋음,story,1
2201,와이프와 함께 올만에본 영화관! 재밌었습니다!,story,1
2202,배우들의 연기가 아주 좋아요,actor,1
2203,뜬금없이 왜구시체 나오면서 조금 깼지만 나머지는 괜찮았음,story,1
2204,재밌게 잘 봤어요~배우들 연기가 좋네요~,actor,1
2205,"너무 좋았어요 정말 시간 가는 줄 모르고 봤어요 역사적인 의미도 있구요 감독,배우들 정말 멋집니다",actor,1
2206,시간 순삭 보세요 !! 완전 재밌어요,story,1
2207,슬릴러고 몰입감이 좋았다.,story,1
2208,기대 안하고 봤는데 존잼요. 중3딸이랑 시간가는 줄 모르고 집중하고 봤다요,story,1
2209,간만에 재미있는 영화를 봤습니다 어느정도 내용을 알고 봤는데도 재미있네요 보면서 알수없는 가슴벅참이 차오르는건 뭐였을까요??,story,1
2210,천만 갑시다 재미있어요,story,1
2211,직업 장례지도사입니다. 영화는 영화네요,story,1
2212,스릴넘쳐요!!👍👍👍,story,1
2213,재미있어요 또 보고싶어요,story,1
2214,"아주 치밀한 구성은 아니지만, 일반적인 귀신 출현 영화보다는 구성력이 우수하다. 아울러 여우가 호랑이의 허리를 끊은 역사도 잊지 않는 영화네",story,1
2215,민식 배우님..🥹🥹 일본 귀신은 왜이렇게 급발진을 자주하는지 모르겠고요.. 긴장해서 지릴뻔 했어요ㅎㅎ 우리나라 최고!!🐅,actor,1
2216,처음보는 신선한 장르의 영화였다,story,1
2217,처음은 령에 대한 영화였다가 후에는 크리처물로 잘 마무리한 영화였습니다. 진짜 배우들 연기가 볼 만 합니다,actor,1
2218,찢었다....ㄷㄷㄷㄷ,story,0
2219,와... 대박이네요 두번 봐야겠어요,story,1
2220,재미있고 짜릿하고 스릴도 있지만 마음이 아픈건 왜일까요? 역시나 명작입니다.,story,1
2221,동해물과 백두산이 마르고 닳도록.,story,0
2222,몰입감 최고. 재미있게 잘 봤다.~~^^,story,1
2223,주연 배우들 연기력으로 모든 것이 커버되는 영화.,actor,1
2224,혼영 했다가 이번엔 아부지와 재관람입니다. 아부지께선 제가 처음 파묘를 봤을 때와 같은 반응이셨고 ㅎㅎ 전 이런 저런 이야기들을 머릿속에 넣고 다시 보니..꽤 볼만했습니다.,story,1
2225,괜춘요~~♡♡♡ 역사를 잊은 민족에겐 미래가 없다.,story,1
2226,너무 오랜만에 재밌는 영화봤습니다.,story,1
2227,"믿고 보는 배우 최민식과 열연해준 김고은, 각각 그 옆을 지켜주는 짝궁들...최근 영화중 시간 가는줄 모르고 몰입해서 본 영화...Good~!",actor,1
2228,재미있고 좋았어요 그러나 뭔가 조금 아쉽~,story,1
2229,파묘는 여우 역사물 이다,story,0
2230,생각 이상으로 재미나게 봤네요~^^,story,1
2231,"배우들 연기가,, 지렸음",actor,0
2232,김고은 연기 짱 몰입감최고,actor,1
2233,배우들의 연기가 영화를 더욱더 재미있게 했어요,story,1
2234,호불호 갈리는 장르를 호불호 갈리지 않게끔 풀어낸 작품,story,1
2235,재미있어요 긴장감 가득한 영화! 굿!!,story,1
2236,정말 다들 연기가 최고였어요^^ 기대한만큼!!역시 다들 파묘파묘하는지 알듯,actor,1
2237,두번 관람했습니다. 첫번째 관람시 놓친 부분을 다시보는 재미가 더 좋네요.,story,1
2238,재밌고 참신했습니다 추천합니다,story,1
2239,배우들 연기가 진짜.. 와..,actor,1
2240,완전 몰입감 쩔고 배우들 연가가 대박이였어요 와 이거 꼭 보세요,actor,1
2241,음양오행 순리에 맞게 …..,story,1
2242,"좋았어요. 이전 작품들, 검은사제들이나 사바하도 봤었는데 이전작품들과는 스타일이 조금 달라진 듯 하지만 재밌게봤습니다!! 이전에는 무형의 것 들이었으면 이번영화에서는 좀더 유형의 것. 의 느낌이 들어서 다르게 느껴졌던것같아요.",story,1
2243,음양오행의 새로운 접근 영화로 재밌었어요^^,story,1
2244,배우들 연기와 감독의 연출력이 보는내내 좋아서 시간가는줄 몰랐습니다.,directing,1
2245,배우들 연기가 좋아 확실히 몰입감이 좋았어요!,actor,1
2246,오컬트 영화의 한획을 그을 영화임,story,0
2247,공포영화 못보는 나한테 딱. 영화좋네요,story,1
2248,김고은과 이도현의 신선함과 몰입감 좋은 소재로 두시간이 아깝지 않게 재밌게 본 영화,story,1
2249,너무나도 예상 가능하고 분위기도 그저 그러했던 진부한 영화 하지만 배루들의 연기와 연출만큼은 너무나도 훌륭했다,directing,1
2250,두번이나봤어용 김고은최고...🤸?♀?🤸?♀? 근데뒤로갈수록좀...지루하긴햇는데 그럭저럭 사실쇠침이니뭐니잘이해안된부분있엄ㅅ는데 끝나고같이간사람이설명해줘서좋앗어요 잘아시거나잘아시눈분이랑같이가면더재미잇을듯해요,story,0
2251,정말 좋은 k-오컬트 영화였다... 소재 특성 상 몰입이 깨지는 순간 즐길 수 없지만 그렇지 않다면 정말 즐거운 경험이 가능하다.,story,1
2252,생각보다 재밌지는 않았지만 이도현의 연기가 좋았어묘,actor,1
2253,김고은의 신명나는 연기~~,actor,1
2254,재밌어요! 스토리가 불편함 없이 쭉 전개됨,story,1
2255,연기자들의 찰떡연기력 몰입감 넘 좋았어요 그냥 넘기기에 뭔가 걸리는 무속신앙 풍수지리... 용한곳 알아봐야할듯~,actor,1
2256,연기자들의 찰떡연기력 몰입감 넘 좋았어요 그냥 넘기기에 뭔가 걸리는 무속신앙 풍수지리... 용한곳 알아봐야할듯~,actor,1
2257,공포영화는 무서워서 안보는데 늦었지만 이 영화는 꼭 봐야죠,story,1
2258,기대를 넘 많이했나바...,story,0
2259,재밌어요!재밌어요!재밌어요!,story,1
2260,최근 본 영화 중에 가장 재밌었습니다 연출이나 담아 낸 이야기 모두 완벽해요....❤?,story,1
2261,배우들 연기 짱~끝 판스토리는별루. 어쨋든 잘봣어여~^^,story,1
2262,오랜만에 좋은 영화 봤어요~^^,story,1
2263,"다른 무엇보다 왜 토착ㅇㄱ들이 싫어하는지 알만했고, 누구는 망가라고도 하지만 나는 그냥 좋기만 하더라, 배우들 정말 허명이 아니다, 대단들하시다~^^",actor,1
2264,최고입니다!! 말이 필요없네요,story,1
2265,허리가 끊어진 1부는 쌉최고! 2부는 굿굿굿,story,1
2266,잘 봤 습 니 다 잘 봤어요,story,1
2267,리얼 감동실화 리얼묘액션,directing,1
2268,오컬트라해서 갑툭튀일까 하고 겁먹었는데 감독님의 고뇌가 깃든 역사에 대한 진심있는 내용도 있고 한분한분 배우들의 매쏘드 연기에 감동 감동이었습니다,story,1
2269,내용이 살짝 어렵긴했지만 신선헸어요.,story,1
2270,오컬트에 진심인게 보였습니다. 재밌었어요!,story,1
2271,"넘나 잼께 봤어용~ 끝날듯함서 안끝나구, 반전에반전~^^",story,1
2272,"검은사제들은 강동원보러 갔었고, 사바하는 우연히 OTT로 봤는데 시간가는줄 모르고 봤다. 그래서 그 감독의 다음 작품이 개봉한다는 소식을 듣고 영화관을 오랜만에 갔다. 두근거리면서 정말 재미있게 봤다. 다음 작품도 기대된다!",story,1
2273,생각보다 쾌적하게 끝나는 영화,story,1
2274,개인의 퇴마에서 국가의 퇴마로,story,0
2275,영화지림 화림지림 민식귀욤,story,1
2276,정말 배우들의 연기력이 너무 좋아요,actor,1
2277,미쳤어요 김고은 너무 이뻐... 진짜 계속 보고싶은 영화,story,1
2278,무서워도 참을만한 영화 귀신보다 연기자 연기에 소름 돋는건 ㅋㅋ 모두 다 연기 짱~~,actor,1
2279,배우님들 연기력이 다 한 영화 갑분 반일😳,actor,0
2280,두번째 봄. 처음부터 끝까지 탄탄함이 느껴짐,story,1
2281,배우들 연기 좋았구요 과거 역사에 안타까움 마음 한편 아려오네요,actor,1
2282,러닝타임 내내 긴장하며 봤네요 ㅎㅎ 추천합니다~!,story,1
2283,잼나네요 연기력도 넘 좋아요,actor,1
2284,한국 오컬트 좋아하시는 분이라면 꼭 보시길 추천 드립니다..! ㅎㅎ. 배우분들의 연기와 함께 어우러져 정말 재미있네요..! ㅎㅎ,story,1
2285,배우들 연기 좋고 소재도 독특해서 재미있게 봤어요,story,1
2286,시간가는줄모름.. 마지막은 좀,story,1
2287,재미었음 무서웠음 ㅠㅠ,story,1
2288,기대 안하고 봤는데 재밌게 봤네여!,story,1
