index,Review,category,sentiment_predicted
1511,재밌게 잘봤어요 배우들 연기가 예술이에요^^,actor,1
1512,천만가야죠~~^^ 재미있게 잘 보았습니다.,story,1
1513,기대한것만큼 영화잘봤어요,story,1
1514,오컬트 무비의 신개념!,story,0
1515,재밌어요!!!!ㅎㅎ,story,1
1516,시간가는줄 모르고 봤습니다.,story,1
1517,디테일 엄청 살아있어요. 배우들 연기가 정말 좋습니다.,actor,1
1518,너무 요란해서일까 그저그런 감흥 크게 감동적이지도 크게 재밌지도 않었지만 신선헌 내용에 뛰어난 연기력으로 몰입도를 높인 영화다,actor,1
1519,몰입도 개쩔고 배우들 연기가 훌륭합니다,actor,1
1520,배우분들이 연기를 잘 하셔서 저도 영화에 몰입하게 됐어요,actor,1
1521,재미있었습니다~~~~ 굿,story,1
1522,주변에서 많이 봐서 보고 싶었던 영화...,story,1
1523,한번 더 보는 영화인데 처음볼때보다 더더더 좋았습니다!,story,1
1524,고 2딸과 2번 봤습니다 탄탄한 구성과 지루하지않고 볼만합니다 적극 추천합니나,story,1
1525,1000만 관객의 한자리를 차지하고자 관람했습니다. 몰입감이 죽입니다,story,1
1526,정말 무섭고 재미있는 영화,story,1
1527,영화 보는 내내 피비린내가 진동하는 듯한 착각에 빠졌어요.,story,0
1528,역시..배우들 최고입니다~!!,actor,1
1529,역쉬 배우들의 연기가 굿!!,actor,1
1530,모든 배우들의 연기가 대박입니다.,actor,1
1531,김고은 이뻐요 민식이형 카리스마넘쳐요,story,1
1532,넘 재밌게 잘봤어요 배울 연기는 말해뭐해요 암튼 시간 가는줄 모르게 재밌어요,actor,1
1533,이것이 한국식 판타지 스릴러,story,1
1534,배우들의 연기가 좋았어요. 도깨비 등장 부터는 긴장감이 오히려 좀 떨어졌어요.,actor,0
1535,많이 무섭지 않고 집중해서 보기 좋았아요,story,1
1536,굳이 주인공이 4명이어야 하는 이유를 못찾겠다,story,0
1537,좋았어요.영상미가 뛰어났어요,directing,1
1538,김고은 굿씬 장난아님 ㅎ,story,1
1539,초반에는 힘있었는데 후반에 떨어진 느낌...천만관객은 축하해요,story,0
1540,관람 당일 꿈자리가 뒤숭숭할것 같네요... 잘 보았슴니다,story,1
1541,재밌었어요 시간이 어떻게 가는지 몰랐네용,story,1
1542,재미있었지만 천만까지는 아닌듯,story,1
1543,"시나리오,연기력,배경음악등 최고입니다",actor,1
1544,쫄깃쫄깃 했어요 색다른 것도 알게되었고 저주가 저리 무서운거구나 싶네요,story,1
1545,배우들의 연기가 돋보이고 새로운 장르에 호감이 가는 영화였다,actor,1
1546,배우들의 연기가 환상였어요. 특히 김고은 이도현 연기는 딱! 그 무당을 데려온것 같았어요 뒈~~박 재밌는 영화. 감동도 있고 무섭지만 후련~~~했던 1000만 돌파 못하면 한번더 봐야지!!!!,story,1
1547,살짝 긴장감도 있고 배우들 연기력도 좋고 재미있어요~,story,1
1548,검은 사제들이 더 나았다.,story,0
1549,천만 영화 달성! 축하드려요,story,1
1550,1000만 관객 사이에 들려구 보았어요. 애국심이 절로 생기네요.,story,1
1551,넘 비현실적인 영환데 손님미 많은게 이상함,story,0
1552,처음부터 끝까지 긴장을 놓칠수없게하네요 후아~,story,1
1553,무섭다고 해서 쫄았었는데 생각보다 다크하지도 무섭지도 않았슴 김고은 신들린 굿연기 굳이었슴👍,actor,1
1554,연기자들의 연기가 너무 실감나면서 여러감정이 들더라구요. 예전 일본과의 관계까지도 다시한번 생각하게 되구요.,actor,1
1555,재미 있었다고 합니다.,story,1
1556,이렇게 배우들 연기에 몰입되고 스토리 연결이 너무 잘 되었고 진짜 최고인 영화를 봤네요. 왜 다들 보는지 알 것 같습니다.,story,1
1557,역쉬~~최고예요!!!!,story,1
1558,무서웠어요~~~~긴장감도 있고~~,story,1
1559,배우들의 연기와 스토리 좋았습니다.,story,1
1560,배우 연기가 짱 스토리의 긴장감 짱,story,1
1561,김고은 연기 최고!! 영화 잘 봤습니다 ~,actor,1
1562,재밌네요 몰입도 짱 뻔하지않은 스토리 배우 연기 다좋아요,actor,1
1563,재미있게 잘봤습니다.,story,1
1564,파묘 역시 많이보는 이유가 있음 간만에 영화 재밌게 봄 !!,story,1
1565,믿고보는 배우들 연기 몰입감 최고. 친일파 척결!,actor,1
1566,김고은 님 굿장면에 제 영혼이 살짝 가출하는듯한 느낌이 ? 아직도 생생하네요 첨 경험해보는 느낌이였어요,directing,1
1567,재미있어요. 몰입감 좋아요. 안졸고 본게 중요함. 추천합니다.,story,1
1568,하나도 안 무섭다고 한 사람들 다 그짓말..,story,0
1569,배유들 연기도 좋고 재밋네요~,actor,1
1570,배우연기가 좋았어요 .,actor,1
1571,진짜 스토리 인기 많은 이유 알 정도로 재밌었어요 ㄷㄷ,story,1
1572,쫀득쫀득한 긴장감 몰입도최고,story,1
1573,재밌게 잘 봤어요. 뒤로 갈수록 힘이 딸리는 느낌.,story,1
1574,연기력도좋고 긴장감도있고 나름괜찮음,actor,1
1575,기대 이상으로 재밌었어요. 공포영화 무서워서 못보는데.. 어찌어찌 다 보게 되었네요ㅎㅎ,story,1
1576,재밌게 잘 봤습니다. 믿고 보는 배우들이네요~~,actor,1
1577,절대로 지루하거나 졸립지 않음,story,0
1578,대박.대박.연기의 고수들이 모여 신나게 한판 벌이신듯..김고은 이도현은 젊은 기운을 최민식 유해진은 여유로운 분위기로 영화를 압도한것 같네요.거기다 김선영씨까지..주조연 모든 연기자들이 각자의 자기몫을 멋지게 해낸 영화이네요.1000만 갈듯 합니다. 한국 영화 화이팅!,actor,1
1579,다들 연기를 넘 잘 해서 잼있게 잘 봤어요.. 근데 넘 무섭기도 했어요..,actor,1
1580,사주명리를 배운 사람으로써 시나리오가 아주 흥미로운 영화였다. 보이지 않는 음양오행 세계에 대한 존중감이 더 생겼다. 배우들의 열연도 잊지 못한다. 특히 무당들이 사투리로 도깨비놀이하는 장면은 팔도사투리면 더 좋겠다는 바램이 생겼다.,directing,1
1581,역시 파묘 색다른 소쟤 배우들 신들이 연기 잼나요~~,actor,1
1582,믿고보는 배우들이여서 너무 재미있네요,story,1
1583,시간가는줄 모르고 재밌게 봤어요 ^^ 명배우들의 명품연기 짱 멋있었어요!!!,actor,1
1584,너무 재미있습니다 통쾌하네요,story,1
1585,너무 재미있게 봤어요:),story,1
1586,와 오랜만에 재밋는 영화 보고왔네요,story,1
1587,연기력 영상미 모든것이 좋았다,actor,1
1588,그냥 그랬어요. 천만 넘는다고해서 봤네여,story,0
1589,역사에 대한 재 인식과 무속신앙에 대한 관심이...,story,1
1590,구체적인 묘였으면 좋았는데 좀 아쉬웠어요,story,0
1591,참외랑 은어를 먹고 싶다,story,0
1592,간만에 신선한 소재영화 재밋게봤습니다,story,1
1593,재미있게 잘 봤습니다.,story,1
1594,역시 천만 관객의 힘!!,story,1
1595,긴장감이며 배우들의 연기가 너무좋았습니다 집중하게 만드는 영화네요,actor,1
1596,좋았어요. 지루하지않고. 좋았어요,story,1
1597,출연한 배우분들 모두 너무 멋지십니다!! 보는내나 너무 재무있어서..눈을 뗄수가 없었네요..일본의 만행에 다시한번 분노하며. 일본앞잡이들이 지금도 잘살고 있다는것에 다시 분노..,actor,0
1598,연기 정말 잘 하셔서 몰입도 좋네요 스토리도 재미있습니다.,story,1
1599,요즘 한국영화 가벼운 영화뿐이었는데 좋네요,story,1
1600,눈이 즐거웠어요 타투간지간지,story,1
1601,김고은 존예 ㅠ ㅠ 얼굴밖에 안 보여... 유재석의 '민식이형아'와 유해진이 있어서 그런지 무게감 있었음.. 민식이형아 존재감 쩔... 스토리도 탄탄하고... 네이버해석본봐야징 ㅇㅅㅇ,story,1
1602,"다시한번 민족의 정기를 끊어 버리려는 일제의 만행을 생각하게 만드는 좋은 영화입니다. 우리 나라는 일제 잔재를 아직 청산하지 못한 것이 아쉽네요! 잘 봤습니다. 👍 믿고 보는 천만 배우 최민식 연기, 다른 배우 연기도 좋았어요! 🤗",actor,1
1603,연기자의 컬리티가 좋고 내용구성도 좋아서 Good job.,actor,1
1604,긴장감이 계속 되는게 너무 좋았어요 ㆍ,story,1
1605,천만 관객을 동원한 영화여서 보게 됐는데 굉장히 흥미로웠습니다.,story,1
1606,연기력이 다한 영화!!,actor,1
1607,오랜만에 영화봤는데 재밌게 봤습니다,story,1
1608,기대를 하고.봐서 그런지 그런저런. 줄거리의 개연성이 없어보임. 일본귀신영화,story,0
1609,믿고보는 배우님들~그냥 공포영화인줄만 알았는데...역사내용이었네요..김고은 배우님은 진심 무당인줄..재밌게 잘보았습니다~,actor,1
1610,후반에 뭔가 좀 깨긴 했는데 나름 괜찮게 봤어요.,story,1
1611,정말 너무 재밌어요 진짜 추천할만한 영화에요,story,1
1612,아! 생의 미련따위 없...맞다 딸의 결혼식;;,story,1
1613,무서웠어요 눈가리면서 봤어요 근데 김고은이 굿할때는 너무 몰입되서 잘봤어요,story,1
1614,너무너무 재밌었구요 시설이 정말 깨끗해요!! 팝콘도 역시 CGV죠!! 존맛탱구리🫰🫰,story,1
1615,잼내게 잘 봤어요 역시 배우들 연기 소름끼치는듯~ 뭔가 약간 부족한 스토리가 쫌 아쉽긴 하네요..,story,1
1616,끝까지 긴장감이 느껴지는 스토리와 연기가 좋았어요,actor,1
1617,"전반적으로 요즘 한국 영화가 침체기인데, 운 좋게 천만 찍은 영화라는 느낌이 드네요.",story,1
1618,배우들의 연기력은 정말 최고네요 몰입도 짱입니다,actor,1
1619,너무 무섭습니다. 최민식 연기 존멋,actor,1
1620,"할아버지파트는 여기저기서 보는 흔한 오컬트 그뒤 오니 파트는 상상도 못한 혼파망 (6/10) PS. 두가지 이야기가 너무 이질적이라 중간연결이 매끄럽게 잘안되는 느낌... ""여우가 범의 허리를 끊었다""",story,0
1621,무서운 영화 못보는데 혼자가서 시간 가는줄 모르고 봤어요. 모두 연기 장인이시고 영화에 구멍이 없네요 괜히 1000만 영화가 아니네요,actor,1
1622,무섭지만 시간가는줄 모르게 잼 나게 봤어요,story,1
1623,굿~~ 한순간도 안지겨움,story,1
1624,초반에는 긴장감에 몰입을 하다가 갈수록 진부해지는 느낌. 다소 뻔한 스토리를 배우들의 연기력으로 메꾸는~~~~,actor,0
1625,오랜만에 좋은 영화였습니다. 중간에 살짝 스토리가 엉뚱한 데로 가고 있다고 생각도 했지만. 먼저 예전의 10번은 봤던 올드 보이가 생각 나네요. 특히 김고은은 완전 대체 불가입니다.,story,1
1626,무서운데 재밌고 이도현이 잘생겼다☺,story,1
1627,재미있어요. 완전 무서웠던. 역시 연기파 배우들.,actor,1
1628,연기와 스토리 어느것 하나 나쁘지 않은 영화였다,story,1
1629,중간에 나오는 윤서방은 왜놈 또는 친일파인가요? 누군가가 생각나네요...,story,0
1630,장재현 감독 연출 짱짱 연기력도 최고,actor,1
1631,이 멤버 그대로 2편 기대~~!,story,1
1632,흥미롭게 잘 봤어요. 배우님들 너무 연기도 좋았어요.,actor,1
1633,재밌게 잘 보았어요 무섭고 섬뜩했지만 이야기에 빠져들었어요,story,1
1634,김고은 연기가 압권이다 멋지다,actor,1
1635,재미있어서2번봤네요 역시배우들연기력이 남다리네요,actor,1
1636,재밌었슴 배우연기가 좋았슴,actor,1
1637,진짜 무서운거 못보는데 재밌었어요 진짜 연기력때문인듯요 한동안 잠못잘듯,actor,1
1638,초반의 분위기를 좀 더 이어갔으면 좋았을 것 같습니다.,directing,0
1639,"요즘 볼만한 영화없었는데 나름 괜찮은 영화였던거 같습니다. 스릴, 오컬트 나쁘지 않았어요.",story,1
1640,복선도 촘촘하고 진짜 재밌었다,story,1
1641,너무 재밌게 잘봤습니다~,story,1
1642,공포 영화 못보더라도 이건 볼 수 있을 걸요?? 진짜 배우분들 연기력에 압도당하게 됩니다🤓 으스스 하다가 중간에 코믹한 장면들도 조금씩 나오니까 꼭 보세요!!,directing,1
1643,최근 본 영화중에 가장 긴장감 넘치고 재밌었습니다,story,1
1644,한국만 만들 수 있는 오컬트,story,0
1645,결말이 급전개적인 요소가 있었지만 매력적인 공포 영화,story,1
1646,2회차 더 빠져 들어가네요,story,1
1647,재미있게 봤어요 1000만 돌파 축하드려요,story,1
1648,진짜 재밌습니다!!!,story,1
1649,너무 재밌게 잘보고왔어요,story,1
1650,배우들의 명연기가 말잇못,actor,1
1651,배우들의 연기가 정말 멋집니다^^,actor,1
1652,진짜 재미있게 봤어요!!,story,1
1653,재밌음!!!!지루하지 않고 흥미진진함!!!!,story,1
1654,흥미진진하고 박진감 넘쳤어요! 배우분들 연기도 멋있어요,actor,1
1655,연기 넘 잘하심:) 믿고 보는 배우들,actor,1
1656,배우들과 연출 영상미 참 좋았습니다 후반부 스토리가 좀 쌩뚱맞은건 시크릿 일본인과 전쟁 컨셉? 또한 갸우뚱 ㅋㅋ 약간 웃음벨 ㅋㅋ,story,1
1657,시리즈로 나와도 좋을것 같아요,story,1
1658,"이제 나이들어 무서운 건 잘 못보는데, 적당한 수준의 공포네요.",story,0
1659,도현이 오빠가 저랑 결혼을 해줄까요? 고은이 언니가 저랑 결혼을 해줄까요? 오른쪽에 도현이 오빠 왼쪽에 고은이 언니 팔짱을 끼고 결혼식 입장하는 그날까지 열심히 살게요🫶🫶,story,1
1660,파묘 ~볼만할까 ? 거를까 ? 개봉 후 고민하다가 입소문 타고 난 뒤 봤어요 오랜만에 재밌게 봤어요 숨겨진 볼거리도 찾아보면서 의미있게 봤답니다 배우들 연기 최고예요,actor,1
1661,시나리오 구성 짜임새가 좋았어요!,story,1
1662,이야기도 재미있고 배우들의 연기가 다 탁월했어요. 긴 시간 순삭했습니다^^,actor,1
1663,천만이 당연한 영화였...,story,1
1664,재미있게 잘 봤어요 좋아요,story,1
1665,흥미진진하게 잘 봤어요~~,story,1
1666,역사의 의미를 한번더..,story,1
1667,내용도 탄탄하고 시간 가는줄 모르고 재미있게 보았습니다.,story,1
1668,무서웠지만 스릴 넘치고 좋았어요,story,1
1669,김고은님 연기가 너무 좋았어요,actor,1
1670,요즘 몇년만에 본 영화중 가장 재미있었다!!! 천만 간다!!!,story,1
1671,무서워요진짜 너무 무서워요,story,1
1672,1000만영화 갈거같아요 잘보았어요,story,1
1673,반전이 있어서 재미있고 배우 몰입도 최고,actor,1
1674,최근 봤던 영화 중 최고입니다~,story,1
1675,"재미있었어요. 전반부는 실감나는 분위기, 하지만 후반부는 약간 힘이 빠지네요. 영화는 지루하진 않아요.",directing,1
1676,너무 재미있게 봤어요.천만 축하드려요,story,1
1677,무서워.. 그치만 재밌는 2번 보ㅓ도 괜찮은 영화!,story,1
1678,시간 가는 줄 모르고 봤음요^^,story,1
1679,⭐파묘 천만관객 축하드립니다⭐ 배우분들 연기력에 몰입감 최고!! 무섭긴한데 또 보고싶은 영화에요,actor,1
1680,최고 몰입감 장난아니에여,story,1
1681,쇠말뚝은 뽑아야 맛이제,story,0
1682,무섭고 가끔 유치한 부분도 있었지만 전체적으로 재밌고 흥미로웠어요,story,1
1683,유해진오빠연기가최고에요 그니까 6주차 무대인사 내놔요 ㅠㅠㅠ,actor,1
1684,다시 봐도 다들 연기가 미쳤네요!!,actor,1
1685,"오컬트 영화는 그다지 좋아하진 않아 간만에 본거고 기대만큼 실망할까 우려된게 사실. 기대가 적어서인지(?)의외로 탄탄한 시나리오와 최민식,김고은의 열연으로 잘 봤습니다.",story,0
1686,공포와 재미의 절묘한 조화,story,1
1687,영화가 끝나고나서 더 찾아보게 만드는 매력적인 영화 배우들 연기는 기본적으로 더할나위없었다.,actor,1
1688,그렇게 우리는 대지를 통해서 이어져간다.,story,1
1689,"오컬트도 가능하다. 천만, 재미만 있으면.",story,1
1690,좋아요좋아요좋아요굿,story,1
1691,아 듄이나 한번 더 볼걸..,story,0
1692,진짜 한국 오컬트 너무 좋다..,story,1
1693,스토리가 있는 오컬트 영화여서 재밌어요,story,1
1694,가족이 다같이 가서 보았습니다 천만 관객 축하합니다,story,1
1695,"재미있게 시간 가는 줄 모르고 몰입해서 잘 봤습니다. 배우들의 연기도 좋았고, CG도 어색하지 않았고...",directing,1
1696,도입부 전개나 스토리 모두 신선하고 좋았음^^ 역사적인 부분 감미 안했으면 더 괜찮을듯하지만 연기력이 커버한듯합니다. 김고은님 다음 작품 기대 됩나다^^,story,1
1697,재미게 잘 봐습니다. 배우 연기 쩔어요,actor,1
1698,최고의 스릴러 였습니다,story,1
1699,N회 볼수록 더 재미있는 영화,story,1
1700,"몰입하여,배우들의신들린연기력 너무만족합니다",actor,1
1701,배우들 연기가 최고예요,actor,1
1702,배우들의 연기가 아주 인상적이었습니다,actor,1
1703,역시 파묘는 파묘였다 무대인사 배우님들 와주셔서 감사해요,actor,1
1704,킬링타임용인것 같은데 그속에서 뭔가를 알려주기도 하는 영화,story,1
1705,진짜 모두 연기를 잘하시네요 딸아이와 재미있게 봤습니다,story,1
1706,배우들의 연기가 볼 만했어요 장군영혼에서 좀 유치하긴 했지만ㅎ 재밌게 잘 봤어요^^,actor,1
1707,와우 이 영화는 무조건 봐야합니다~ 관객이 많은 건 다 이유가 있음,story,1
1708,스토리 전개는 다소 아쉬움 배우들의 연기 합은 좋다,actor,0
1709,좋아하는 사람이랑 재밌는 영화봐서 좋았어요,story,1
1710,무엇보다 다들 연기가 좋았어요,actor,1
1711,진짜 무서웟어요 식은땀흘리면서봄,story,1
1712,함더보고나서 해야지이이ㅣ잉,story,1
1713,잘봤습니다연기가좋아요,actor,1
1714,일본이 우리나라 명산에 말뚝 꽂아서 기를 막았다는 이야기를 들었는데...영화에다 접목해서 만들어서더 실감있게 몰입해서 본것같다. 배우님들에 연기력도 몰입하게 만드는데....넘 좋았다. 조상묘에 대한것도 다시 한 번 생각해보게 하네요. .,actor,1
1715,1 0 0 0 만!! ㅊㅋㅊㅋ,story,0
1716,기대하고 봤는데 지루하고 뜬금없는 이야기의 나열임 중간에 나오고 싶은걸 억지로 참았네 이런 영화가 천만이라니 어이없다,story,0
1717,"연기, 몰입감이 정말 좋았어요",actor,1
1718,스릴에 무엇보다 배우들 연기가 넘 좋았어요,actor,1
1719,보는 내내 흥미진진해서 재미있게 잘 봤어요,story,1
1720,너무 재밌었어요!!!!,story,1
1721,우리나라의 정기를 끈어버리는 일본의 죄!! 영화는 기록이다.,story,0
1722,15세 이상 학생들에게 교육차원에서 필수관람 추천합니다.. 제 아이들도 보고..바로 돌아와 정기끝는 말뚝에 대해 찾아보네요.. 조선을 말살하겠다는 의지가.. 저도 어릴적 속리산 문장대 바위 위에 쇠말뚝을 본적있는데..측량용이니라고 들었는데..영화보는 내내 생각나서 무서웠습니다..,story,1
1723,영화 전반에도 반일 감정이 흐르는 모습을 보며 더욱 흥미로워습니다!,story,1
1724,믿고보는 배우님들~~~ 고은씨 신들린듯한 굿판씬 대박,actor,1
1725,1000만 돌파 축하!,story,1
1726,배우들 연기가 좋았어요~ 몰입감 최고,actor,1
1727,재밌었어요~ 적당한 공포감 연기력 멋졌고,actor,1
1728,배우들의 연기력에 몰입감이 좋네요,actor,1
1729,좋았어요 ~~~ 잘봤어요,story,1
1730,평은 잘 안남기는데 최고네요! 또 보고싶어요 계속 아른아른,story,1
1731,연출을 참 잘한것 같다~시종일관 긴장하면서 봄.,directing,1
1732,재밌게 잘 봤습니다!!,story,1
1733,무섭지 않고 재미있는 영화,story,1
1734,넘 재밌었다 후반부 호불호 얘기해서 뭘까 했는데 결론은 호(好)!였다,story,1
1735,오랜만에 시간가는 줄 모르게 봤어요,story,1
1736,진짜 레전드였습니다 연기 실력이 다들 굿..👍,actor,1
1737,역시 잘봣어요!!! 최고최고,story,1
1738,"괜히 집안에 묘는 문제없나 생각하게 만드는 영화. 1부가 성공하자, 급하게 시리즈물로 2부까지 만들어낸 드라마 같이 전후반이 어색한 느낌은 아쉽다.",story,0
1739,시간 가는 줄 몰랐어요 중간에 최민식 애국투사 되는고 + 도깨비불 cg티 나는거가 옥의 티,directing,0
1740,명배우들의 명연기가 돋보인 작품.,story,1
1741,소문대로 내용이 탄탄한 영화네요 잘 봤어요,story,1
1742,역시 기대가 크면 실망이 큽니다.. 갑자기 저게 뭐지?하는 생각이 들었던 영화..,story,0
1743,재미있게 잘 봤습니다~,story,1
1744,재미있네요. 좀더 스토리가 복잡해도 좋을것 같아요.,story,1
1745,공포영화이기는 하지만 스릴감도 넘치고 풍수에 대해 이해할 수 있어서 유익했습니다.,story,1
1746,넘 재밌게 봤어요 ㅎㅎ 다같이 우르르가서 보는거 추천!,story,1
1747,몰입감이 좋아 흥미진진 했습니다.,story,1
1748,재밌어요. 전반부후반부 장르가 살짝 바뀌지만 잘만든 오컬트영화입니다.,story,1
1749,이야기가 재밌었어요!,story,1
1750,몰입감도 너무 좋고 배우 라인업도 너무 좋아서 재밌게 봤습니다!,actor,1
1751,아주 시설 좋고 재미있게 영화봤습니다,story,1
1752,배우들 연기 죽이네요. 결말이 좀 기대 밖이었어요.,actor,0
1753,공포라디오 시청자로서 이런류를 영화로 보니 흥미있고 재밌었어요 뭐.. 제목에 안 맞게 스토리 흐름이 이어질듯 아닌듯 다른 주제로 흘러가나 맥이 끊기지는 않았습니다 이쉽다면 아쉽지만 그럴수도 있겠구나 하여 재밌었고 원한이 얼마나 쌓인귀신인 도깨비가 직접만져 죽일정도인게 소름끼쳤네요,story,1
1754,역사와 감독의 연출의도등을 모르면 재미없을 수 있다 생각이 들지만 저는 오히려 신선하게 느껴져서 보면서 ‘이거 하나하나 연출을 어떻게 저렇게 표현했을까?’ 생각하며 보느라 즐거웠어요 직관적인 즐거움도 좋지만 이렇게 생각하게 하는 영화 또한 좋은거같아요,directing,1
1755,도깨비나와서 안무서워졌어요,story,0
1756,그냥저냥….햇어요 ㅡㅡ;,story,0
1757,시작부터 몰입감 및 긴장감 다 좋았는데..ㅎㅎ 일본귀신? 이거 나오는 순간..나는 3류영화로 추락되는 느낌 이였씀...,story,0
1758,두 번 봤는데 모두 즐거운 구경 하고 갑니다. 이도현잘생겼어요,story,1
1759,배우분들 연기도 분위기도 스토리도 뭐 하나 빠진 거 없이 재밌었어요.,story,1
1760,우리가 누구 덕에 편히 잠들고 있는지 잊지 않아야 한다. 4명의 주인공들이 만들어내는 시너지는 영화 속에거 그치지 않고 스크린을 나와 시청자들에게까지 전해진다. 영화가 너무 짧다고 느껴질 정도로 흥미로웠다.,story,1
1761,기대했던만큼 흥미진진한 영화,story,1
1762,스토리도 좋고 훌륭한 배우들의 연기 덕분에 몰입감이 최고였어요,actor,1
1763,한국형 오컬트 천만신화 보여준다,story,1
1764,영화의 기본은 스토리라고 생각합니다 나름 흘러가는 스토리 내용도 괜찮았어요,story,1
1765,짱. 그냥 짱. 완전 대박.,story,1
1766,깜놀 장면 많지만 재밌습니다^^,directing,1
1767,와이프랑 같이 봤습니다. 은근히 무섭기도 합니다.,story,1
1768,최근에 본 영화 중 제일 재미있게 본 영화 인 것 같 습니다.,story,1
1769,몰입감과 음향이 미쳤어요 진짜 이건 극장에서 봐야해요,directing,1
1770,두 번 보니까 안 보였던 게 또 보이는 느낌,story,0
1771,그냥 그저 그랬습니다ㅎㅎ,story,0
1772,너무 기억에남아서 한번 더 본 영화! 다들 한번이라도 보는거 추천드려요!!,story,1
1773,"(파)격적이진 않았지만 지루함도 없었고 일본 특유의 문화(음양사, 요괴 등)를 끌어와 무속과 연결하니 (묘)한 매력을 내뿜는 영화!",story,1
1774,기대 이상의 영화였어요,story,1
1775,생각보다 조금 아쉬웠지만 긴장하며 봤네요ㅎ,story,1
1776,무섭지 않았음. 연출은 좋았으나 스토리가 아주 별로… 이런 영화에 천만 관객이라니 믿기지 않았음,story,0
1777,몰입도가 좋았어요 좀 다듬어서 나왔으면 좋았으려만..아쉬운 부분들이 좀 보이지만 이정도면 꽤 팝콘영화!,story,1
1778,다시 한번 친일파에 대해 생각해보는 시간이었음,story,0
1779,오컬트 영화로 첫 첫만 영화라니..민식이횽 당신은 도덕책..,story,0
1780,잼나게 잘 봤습니다.배우들 연기력도 좋았고 끝까지 집중하며 봤어여ㅎ강추입니다,actor,1
1781,"하나의 사건으로 질질 끄는 영화가 아니라, 여러 사건들이 적절하게 치고 빠져서 지루하지 않았던",story,1
1782,또 보고 싶은 한국 오컬트,story,1
