index,Review,sentiment_predicted,category
1776,재미있게 보고 나왔어요,1,story
1777,재미있게 잘 보고 왔어요~~,1,story
1778,재밌네요 아이들이 좋아해요,1,story
1779,너무 재미있었어요👍👍,1,story
1780,너무 재미있고 스토리도 너무 좋았어요,1,story
1781,글치 제자리에 있는 것은..나에게하는말이다..감사:),1,story
1782,7500원과 2시간이 아깝지 않은 재밌는 히어로 영화였습니다. 새로 등장한 캐릭터도 매력적이고 재밌었던 영화였습니다!,1,actor
1783,좋아하는 시리즈라 아이들과 즐겁게봤어요,1,story
1784,재미있게 잘 봤습니다.,1,story
1785,재미있게 잘 봤어요~~^^,1,story
1786,뻔하지만 그래도 잘 봤어요,1,story
1787,변화하지않고 제자리에만 머물러있다면 자기의 색깔을 낼 수가 없다. 씨앗은 항상 나무의 꿈을 가지고있다.두려움이 없다는것은 싹수가 있다는말.스스로해내지 못한다면 성장할수 없다.내면의평화. 적임자를 찾는것도 하나의 리더가 할일이다,1,story
1788,카멜레온아 착하게 변해라 너의슬픔 따위는 관심없다,0,story
1789,"오래가는 프랜차이즈엔,그 이유가있다 허나 역대급 빌런의 최후가 너무 약했던건 아닐까",0,story
1790,아이가 아빠랑 보고왔는데 잼있었다고 하네요^^,1,story
1791,기대없이 보면 재밌게 볼 것 같네요~ 전체적으로 무난했어요~~,1,story
1792,귀여운 포오오오><,1,story
1793,나이가 들어서인지 이제 스토리가 빤히 보이지만 어른들에게도 변화에 대한 용기를 주었던 영화.,1,story
1794,재밌게 잘 봤어요~ 어른이 봐도 나쁘지 않았어요,1,story
1795,"좋았어요와 별로예요의 중간. 1,2,3보다 스토리가 다소 빈약하고 정신 없다. 하지만 지금까지 등장했던 빌런들을 한꺼번에 볼 수 있어서 반가웠고 새 빌런 또한 매력있었다. 파워가 충분치 못했을 뿐...",1,story
1796,아이가느므좋아해서 뿌듯합니다요,1,story
1797,길지도 않고 전편을 안봐도 재밌는 영화,0,story
1798,깔끔하게 빌런과 싸우는 스토리 새로운 젠 귀엽고 포는 언제나 귀염 포 보니 푸바오 떠오름....ㅎㅎ 스펙타클하진 않고 잔잔해요,1,story
1799,"2008 1편 2016 3편 무려 8년만에 돌아온 드림웍스의 시그니처 쿵푸펜더4 역시 실망시키지 않는다 스승이 되기 위해선 제자를 찾아야 하는 미션도 있고 강력한 적이 기다리고 있다 빠른 전개, 유머, 인생의 방향? 교훈, 화려한 볼거리 등 제작진의 땀과 노력이 곳곳에 있다 역대 흥행기록 갱신?^^",1,directing
1800,역시 어른이 봐도 재밌어요 ㅎㅎ,1,story
1801,"일단 악역 도마뱀 캐릭터가 너무매력있어요..성우목소리도 너무좋음.사실 예고편에서 이 캐릭터 보고 끌려서 예매한거임 쿵푸팬더 전 편들은 잘 기억나진 않지만 뭔가 무게감이 있고, 타이렁같이 어두운 부분은 확실히 어두운 느낌이었는데 이번편은 그냥 너무 가벼운 코믹용느낌? 그래도 재미있어요",1,story
1802,재밌게 영화 관람했습니다,1,story
1803,재밌게 영화 관람했습니다,1,story
1804,역시 믿고보는 쿵푸팬더! 너무 재밌게 잘 보았습니다^^,1,story
1805,그냥 평범한….crazy train 중국버전만 기억남,0,story
1806,재미있네요. 마지막 싸우는 신이 너무 짧은듯요. 그게 좀 아쉽다면 아쉽네요. ^^,1,story
1807,재미가 없진 않은데 옛날만큼의 감동이 사라진 느낌? 내가 나이가 들어서인지 초반 개그코드도 유치해서 잘 맞지 않았음..,0,story
1808,아이와 즐거운 시간 보냈습니다 이른시간영화여서 단둘이서 봤어요,1,story
1809,재밌어요 배우들 목소리들이 참 좋네요 1편부터 다시보플정도로 잘 봤습니다 ㅎ,1,actor
1810,쿵푸팬더는 항상 유쾌함 ㅋ,1,story
1811,역시 쿵푸팬더!!✨🌙🌙너무너무 재밌었습니다!!💚💚5도 만들어주세용!!!!,1,story
1812,생각보다 훨씬 유치하네...,0,story
1813,너무너무 재밌었어요 8년을 기다린 이유를 찾았습니다.,1,story
1814,inner peace🤣,1,story
1815,오랜만이지! 드림웍스 레전드 시리즈 마침내 컴백!,1,story
1816,재밌었어요 재밌었어요,1,story
1817,기대보단 별로였어요. 졸렸음..,0,story
1818,재미있게 보았습니다~!,1,story
1819,전편만 못한 전개와 영상이 아쉬워요,0,directing
1820,재밋엇어요 추천합니다,1,story
1821,여전히 귀여운 캐릭터들. 빌런과의 매치가 좀 아쉬웠다.,1,actor
1822,잘끓여놓은사골 아직 더 우려먹어도되겠다,0,story
1823,쿵푸팬더4. 기대 이상의 재미가 있었어요. 더빙이라 듣기도 편했고 집중도 잘 되었습니다.,1,story
1824,산만한영화. ADHD같은,0,story
1825,영화 잘 봤습니다~~~,1,story
1826,썩어도 준친데 이젠 아슬아슬하다,0,story
1827,Sodbdlvidocndu,1,story
1828,여우 내꺼얌~ 다음편도 기대,1,story
1829,스릴 넘치네요 마지막 부분에선 4d로 보는 게 실감이^^,1,story
1830,나쁘지 않지만 재미는 3탄에 비해 별로...핳,0,story
1831,좀 지루할수도 있지만 여우도 귀엽고 킬링타임용으로 괜찮아요!,1,story
1832,쿵푸 팬더 재미있게 봤습니다,1,story
1833,"쿵푸팬더1,2,3보다 이야기 내용의 의미가 좀 부족한 느낌이 있어요. 재미있지만 요즘 팬더에 관련 모두 것들 핫한 이슈가 돼서 유니버설 돈을 버는 기회를 봐서 영화를 만든 듯이에요 ㅋㅋㅋㅋ 그래도 재밌고 무료 팝콘을 받아서 좋아요.",1,story
1834,중간이 살짝 아쉽지만 그래도 그럭저럭 볼만합니다.,1,story
1835,"1편이후 점점 낮아지는 재미, 완성도. 속편 프랜차이즈의 한계인듯.",0,story
1836,재미있었대요 마지막에 급하게 마무리한 느낌난다고 히네요,1,story
1837,너무 재미있게 봤습니다,1,story
1838,아이들과 재미나게 잘 봤습니다.,1,story
1839,푸는 변함이 없네요~~,1,story
1840,재미와 아쉬움이 공존한다,1,story
1841,중간중간 재밌는 만화적 요소들이 있었지만 솔직히 너무 물 탔다.. 결말은 너무 엉망이고..,0,story
1842,초등학생 아이랑 봤는데 재밌다고 하네요!!,1,story
1843,"아이(초2)가 재미있게 봤어요. 성인들은 1편에서 봤던거 좋아서 비교하는데, 아이랑 보기에는 딱 좋았어요.",1,story
1844,"마침내 다시 돌아온 드래곤 워리어 Po... 여러 가지 아쉬움이 많지만, 옛날에 <Kung Fu Panda>를 처음 봤을 때의 그 압도적인 재미를 되새기며 관람하면 좀 괜찮다. 그래도 안 나오는 줄 알았던 Furious Five도 볼 수 있고, 뭔가 멋있는 대사들도 많다.",1,story
1845,시리즈가 마무리 되는거 같지만 새로운 용의전사 도 기대합니다. 무난하게 봤습니다.,1,story
1846,그럭저럭 볼만함 기대는 하지말고 가야될듯,0,story
1847,영화 잘 봤습니다 재밌네요,1,story
1848,재미있게 잘 봤어요 좋아요,1,story
1849,기대한만큼 즐거운 작품,1,story
1850,예전보다는 못한 듯 하다,0,story
1851,너무 재미있었어요 ㅎㅎ,1,story
1852,"특유의 리듬과 유머코드는 여전하다. 단, 후작으로 갈수록 스케일이 작아지고 영화라기 보단 TV시리즈에 적합한 수준의 연출이 보인다.",0,directing
1853,역시 이번에도 기대에 보답하는,1,story
1854,"1,2,3편보다 재미없고 지루했어요 엄청 기대하고 갔는데",0,story
1855,이너피스~ 내면의 평화!! 오랫만에 영화로 인해 마음의 평화를 얻는 기분입니다!!!!,1,story
1856,"적당한 메세지를 담은 이야기가 좋았으나, 타이그리스와 친구들이 안 나와서 아쉬웠던, 그리고 빌런들을 불러 모으는 부분에서 ㅅㅍㅇㄷㅁ ㄴㅇㅇㅎ의 냄새가…",0,story
1857,1편을 기억하는 아내와 함께 관람 다채로왔던 1편보다는 덜 하지만 재밋고 생생하게 그려낸 유니버샬 애니메이션이라 좋았습니다.,1,story
1858,영상미는 화려한데 뻔한 연출과 편집으로ㅠ지루함을 느낌,0,directing
1859,애니메이션 재미있게 잘 감상했어요.,1,story
1860,갈수록 재미가 떨어 진다는 표현이 맞는말인지..,0,story
1861,잘봤습니다 잘봤습니다,1,story
1862,가족과 보기 좋아요. 유쾌하고 재미있어요,1,story
1863,맥이 빠지는 기분. 재미는 있으나 딱 그정도.. 번역은 좋았어요,0,story
1864,더이상 진전없는 시리즈.. 킬링타임용으로 보면 나쁘지않지만 포를 사랑하지않는다면 굳이 볼필요는..,0,story
1865,쿵푸팬더4 잘보았습니다 잭블랙 연기는 역시 재밌었고 여우캐릭터도 전 좋았어요,1,actor
1866,가볍게 보기 좋아요! 믿고 보는 쿵푸팬더니까요 ㅎㅎ,1,story
1867,아들과 잼있게 봤어요~,1,story
1868,포가 다시 돌아와서 좋았지만 1편이 그립다.,1,story
1869,그냥저냥 킬링타임용 푸바오 보고싶은데 포에게서 푸바오가 보이네요,0,story
1870,진짜 푸 너무너무 귀엽습니다,1,story
1871,푸바오는 잘적응하고 있겠지요…?😆,0,story
1872,더이상 의 쌈박한 소재가 않생기나... 쿵푸팬더는 그만~~~,0,story
1873,쿵푸팬더에 빠졋서요.. 💭🩷🐼,1,story
1874,이전보다 극의 전개가 허술한 느낌 그래도 재미있게 봤어요,1,story
1875,Inner peace! 즐겁게 봤어요,1,story
1876,"유쾌, 통쾌, 상쾌! 그러나 아쉬움",1,story
1877,액션 멋지고 캐릭터들도 귀엽고 재밌어요,1,actor
1878,아이들이랑 보기에 좋아요 재밌어요. 다만 불광Cgv 1시 영화예매했는데 1시에 입장시작 그전부터 줄 서서 기다리는데 속터지는 줄 알았어요,1,story
1879,기존 시리즈와는 너무나 다른 느낌? 이걸 의도 했다고 하더라도 조금은 의아스러운 느낌이 강해요. 타이렁을 제외한 2명의 빌런은 그냥 병풍 수준이고.. 빌런은 뭘 보여줄려다가 싱겁게 끝나는 느낌.. 그래도 포가 이제야 좀 용의 전사 다운 모습을 보여줘서 그나마 킬링타임으로는 괜찮네요..,0,story
1880,기대이상으로 재미있었어요,1,story
1881,오랜만에 쿵푸팬더 시리즈 보니 유쾌하고 감동도 있구 넘 재밌었어요ㅎㅎ,1,story
1882,재미있다!! 귀엽다!!!,1,story
1883,즐겁게 관람했습니다~!,1,story
1884,음 옛날같지 않네요. 그냥저냥,0,story
1885,너무 재밌게 봤습니다..!!,1,story
1886,애정있는 캐릭터였는데 왜 이렇게 지루할까,0,actor
1887,재미있고 시간 가는줄 몰랐던 영화,1,story
1888,끝난줄 알았던 쿵푸팬두가 나와 좋았어요~,1,story
1889,귀엽고 사랑스럽고 멋지고~ 유익하고 통쾌하고 유쾌하네요~,1,story
1890,추후 수정해 올리겠습니다,0,story
1891,두 아빠가 감초역할!!ㅋㅋ,1,story
1892,그럭저럭 볼만해요 오랜만에 포를 봐서 반가운데 굳이 4를 왜 만들었는지 모를 약한 빌런이랑 좀 부실한 내용이 단점,0,story
1893,쉴틈 없는 진행과 액션으로 지루하지 않았고 중간중간 개그적인 요소도 있어서 어른도 재밌게 볼수있는 영화였습니다.,1,directing
1894,은퇴를 앞둔 판다곰탱쓰의 모험,0,story
1895,여전히 귀엽고 유쾌한 포,1,story
1896,재밌었지만 좀 예상이 가는 내용이었다!,0,story
1897,가족들과 재미있게 잘봤습니다~ 와닿는 명대사도 많네요 다음편도 기대됩니다~,1,story
1898,편안하게 보기 좋았다.,1,story
1899,( 별 5개 ) 벌써 후계자 양성이라니 너 못 본 사이에 많이 컸다 ? 🤍,1,story
1900,스토리가 좀 뻔하지만 연출이 좋았어요..,1,directing
1901,이전 시리즈에 비해 다소 아쉽네요,0,story
1902,엄청 재밌진 않다 생각하면서도 내내 웃으면서 본 것 같네요.,1,story
1903,쿵푸팬더는 늘 재밌다!!!,0,story
1904,4DX로 봐서 그나마...,0,story
1905,처음부터 끝까지 집중을 놓지 않게하는 몰입감과 중간중간의 개그요소가 재밌었던 영화 마지막 한방까지 시원하게 터뜨리면서 사이다 가득 마신 것 같은 청량함..,1,story
1906,"여느 시리즈 때보다 더욱 스펙타클하고 팬더의 재빠른 동작들이 한층 눈부시는 가운데, 너무 흥미진진하고 좋았습니다.영화가 끝날 때까지 전혀 지루하지 않아서 넘넘 재미있게 봤습니다 ^^",1,story
1907,팝콘무비로 적당해요 빌런 매력이 너무 떨어지는 것 제외하곤 재밌었어요,1,story
1908,믿고보눈 쿵푸팬더 ㅋㅋ푸바오생각나네요!!,1,story
1909,재미있게 관람했습니다.,1,story
1910,익숙하지만 특별한것이 없는 프랜차이즈 같이 아는 맛. 그래도 코미디와 액션의 재미는 여전하다.,0,story
1911,역시 드림웍스! 재밌어요~,1,story
1912,포가 너무 기엽네요 잼써요,1,story
1913,생각보다 많은 여운이 남는 재밌는 영화였어요! 인생의 교훈도 함께 녹아들어있는것 같네요.,1,story
1914,압 너무 잼있어요 여전히 귀여운 포~다만 마지막이 너무 흐지부지ㅎㅎ 시간가는줄 모르고 봤는데 끝이 아쉬웠습니당,1,story
1915,쿵푸팬더 재미있엇어요!!,1,story
1916,좋았어요 재미있게 잘 봤어요,1,story
1917,어제 재밌게 잘 봤어요 ㅎㅋ,1,story
1918,존잼ㅠㅠ어른이봐안유치하고 동물들이라너무귀여움,1,story
1919,더 이상 포를 볼 수 없을 것 같아 아쉽지만 정말 좋았어요. 사랑스러운 포! 꼭 만나시고 잭블랙의 베이비 원모어 타임 다 듣고 나오세요~,1,story
1920,역시나 위트있는 재밌는 영화 ㅎㅎ,1,story
1921,포 귀여워요 쿵푸바오4,1,story
1922,즐거웠습니다 감사합니다!,1,story
1923,아이와 즐겁게 봤어요. 재미있어요,1,story
1924,중국으로 떠난 푸바오 생각하며 힐링~~♡,1,story
1925,다른 캐릭터들이 안나와서 아쉬움..,0,actor
1926,가족들과 함께 보았는데 재미있고 즐거웠어요.,1,story
1927,포의 홀로서기 준비인듯,1,story
1928,오인방을 과감히 빼고 오로지 포 의 이야기로만 꾸민것 같은데 좋지만 뭔가 캐스팅 비용 줄인것 같은 느낌 ㅋㅋㅋㅋ,0,story
1929,재미있게 잘 관람했습니다.^^~,1,story
1930,너무 오랜만에 만난 쿵푸팬더 포~~ 세월은 흘렀지만 몸매는 그대로구나ㅋㅋㅋ,0,story
1931,성장보다 후행한듯한 쿵푸팬더,0,story
1932,오랜 사랑 쿵푸팬더 이번에도 재밌었어요,1,story
1933,포~! 너무 오랜만이야 다음편은 지도자가 되겠구나,1,story
1934,기대보다는 별루였어요ㅡ,1,story
1935,지루할 틈없이 재밌었어요. 액션씬도 화려하고 유쾌해서 좋았어요.,1,story
1936,아 솔직히 좀 지루했어요.. 그래도 중간중간 코믹한 장면과 귀여운 캐락터는 볼만 합니다,0,directing
1937,재밌었어요! 여러분들도 보시면 좋을거 같네여,1,story
1938,너무 너무 재밌어료~~~,1,story
1939,너무귀엽고 잼있었습니다. 쿵푸팬더영화를 무척 좋아해요~,1,story
1940,너무 귀엽고 깜찍했어용ㅎㅎ 오랜만에 에니메이션보니 더 재밌게 본 거 같아요,1,story
1941,절대 경지에 이른 포의 후계자 찾기. ★★★,1,story
1942,<에브리씽에브리웨어올앳원스>의 키호이콴이 아르마딜로 목소리로 출연해서 반가웠네요. 쿵푸팬더 시리즈의 이전 캐릭터들을 볼 수 있어서 어린 시절의 향수가 느껴졌어요. 언제나 그렇듯 동물들 특성과 쿵푸 스킬을 연관지어서 귀엽네요. 새로운 캐릭터인 젠과 포의 케미가 나쁘지 않았어요.,1,actor
1943,목적지가 변화인 영화가 정작 이전까지 밟아왔던 길을 따라가기만 한다.,0,story
1944,재미있게 잘 봤네요~~,1,story
1945,여전한 쿵푸팬더 캐릭터들 귀엽고 흥미진진 재밌었고 기존 캐릭터들 다시 봐서 반가웠음. 마지막 노래도 강렬했음.,1,directing
1946,전 작보다는 조금 덜 재미있었다. 하지만 재미는 있다~~,1,story
1947,재밌게 잘봤습니다~~~,1,story
1948,포 가 너무 강해서 사실 긴장은 안된다. 그렇다고 약하게 나왔으면 오히려 더 재미 없었을듯,0,story
1949,포 좋은친구가 생겨서 좋다,1,story
1950,좋았는데.. 이렇게 좋은 능력이 있는 빌런의 임팩트가 전작들에 비해서 더 떨어지지 않나 싶습니다 ㅠ,0,story
1951,오랜만에 쿵푸팬더를 만나니 좋네요^^,1,story
1952,쿵푸팬더 재밌게 봤습니다.,0,story
1953,라이온킹도 실사하는데 쿵푸팬더 실사 외않되? 푸바오 주인공으로 함 주라,0,story
1954,재밌게 잘 봤습니다. ㅎㅎㅎ,1,story
1955,볼 만한 액션과 시리즈의 마지막을 보게 된 영화 이젠 미국 애니메이션의 희망은 픽사밖에 안 남았다는 아쉬움,1,directing
1956,완전 킬링타임용 영화네요😅 영상은 멋있는데 빌런을 너무 손쉽게 처리해서 위기감은 없었던..🤣,0,directing
1957,좋아요 재미있어요. 다음편도 기대합니다,1,story
1958,기대 이상으로 코믹했고 지루하지 않은 빠른전개 좋아요,1,story
1959,추억용으로 기존 등장인물들을 등장시키긴 했으나 비중이 많이 적고 새로운 등장인물들의 서사가 부족했어요. 시리즈가 추구하던 유쾌함과 액션은 좋았어요,1,directing
1960,아들들과 지난 1 2 3편 추억을 살리며 보았습니다^^,1,story
1961,귀엽고 재밌어요🙂,1,story
1962,그림체가 갈수록 예뻐지고 있다,1,story
1963,잘 보았어요!!! 올만에 이런 영화보네요,1,story
1964,무의미한 시리즈물 최후,0,story
1965,쿵푸 장면이 너무 적어서 아쉬웠지만 그래도 잼나게 봤어요,1,directing
1966,박진감 넘치고 재밌게 잘 봤습니다.,1,story
1967,팝콘 영화로 괜찮아요 😊,1,story
1968,언제봐도 귀여운 쿵푸팬더,1,story
1969,스크린x 보시면 좋을 듯,0,story
1970,언제 봐도 재미 있는 쿵푸팬더!! 캐릭터가 너무 귀여워요 ^^,1,actor
1971,"기존 등장인물들의 비중이 거의 없고, 빌런의 매력을 잘 살리지 못해서 아쉬웠습니다. 또 새로운 등장인물의 서사가 너무 아쉬웠습니다. 하지만 캐릭터는 귀여웠습니다.",0,actor
1972,포바오의 매력으로도 한계가 선명해진 시리즈의 나태함. 🐼,0,story
1973,3까진 괜찮았는데...,0,story
1974,오랜만에 느끼는 쿵팬만의 감성은 여전하네요. 4편까지오면서도 길을 잃지않은점에서 추천 !,1,story
1975,음악 신나고 재미있어요,1,story
1976,재미 없다!!!! 빌런이 영혼들을 다 흡수해서 자기걸로 만들었는대 뭐 이리 약해 빠졌어,0,story
1977,역시 볼만한 영화였습니다,1,story
1978,애들과 함께하기 좋은 영화! 크게 한방은 없는듯^^,1,story
1979,빌런이 너무 허무하게 사라졌으나 팬더는 귀엽다. 냉면의 평화,1,story
1980,쿵푸팬더 4 잘 보고 재미있다 좋아요,1,story
1981,진짜 웃느라고 죽는 줄 알았어요,0,story
1982,킬링으로 이젠 그만...,0,story
1983,포가 명언 제조기 였네요!!ㅋㅋㅋ 잼있어요,1,story
1984,재밌어용 쿠키영상 없습니다,1,directing
1985,어른이를 위한 영화~~,1,story
1986,긴 공백으로 매력을 잃어버린 쿵푸팬더4 그래도 재미는 있어서 좋았습니다.,1,story
1987,추억이 있는 시리즈 가족단위 고객이 많기에 다소 소란스러운 분위기 (극장바이극장일듯),0,directing
1988,쿵푸팬더는 이번에 처음 봤는데 생각보다 괜찮네요 쿵푸팬더 1-3 요약본 46분짜리 배속으로 돌리고 바로 4 보러 들어갔는데 킬링타임용으로 보기 좋은듯!! 어린 아이들도 재미있게 볼 것 같아요,1,story
1989,그래픽 애니메이션 영화가 얼마나 잼나겠어요? 그냥 화려한 영상의 볼거리를 즐기는거죠~^^ 딱히....이렇다 할 후기글 적을게 없네요~ 🤣🤣🤣🤣🤣 초등학교 3학년 이하 자녀들은 좋아 하겠네요...,0,directing
1990,영상이 획기적?아이디어도 좋구요~ 즐기기좋아요,1,directing
1991,개그코드가 넘 잘 맞아요 믿고 보는 쿵푸팬더 지루할 틈이 없었네요,1,story
1992,너무 허겁지겁 끝을 맺어 아쉬움. 특히 5인방이 안나와 서운,0,story
1993,후속편이 나왔으면 좋겠네요,1,story
1994,철들어버린 포. 새로운 캐릭터도 좋지만 기존 캐릭터를 버리진 않았으면...,0,actor
1995,오랜만에 반가운 얼굴들 다 보곸ㅋㅋㅌ ㅋ굿굿 재밌었름 ㅋㅋㅋㅋㅌㅋ,1,story
1996,푸바오가생각나는건...ㅎㅎㅎ,1,story
1997,추억이야 포~ 앞으로도 포에버,1,story
1998,시간 잘 못 예약해서 못 봤어요..,0,story
1999,자기자신을 뛰어넘기위해서 노력함,0,story
2000,아이들과 함께 보기 좋아요.,1,story
2001,카멜레온이 기술 빨아들이고 별로 써먹지도 않고 끝나서 약간 맥빠졌지만 그래도 재밌게 봤음,1,story
2002,웃기고 귀여워요 재미있어요!,1,story
2003,이전 편에 비하면 스토리가 너무....,0,story
2004,그 어떤 액션영화보다 통쾌하고 박진감 넘쳤다! 대미를 장식한 추억의 노래는 갬동ㅠ 퍼.펙.트.,1,directing
2005,이도저도 아닌 엄청나게 쓰레기 영화가 아닌게 감지덕지인 쓰레기 영화,0,story
2006,옛날 생각하면서 재밌게봤는데..끝에사 너무 허무하네요..ㅠㅠ,1,story
2007,예전보다는 좀 약하지만 그래도 재미있게 봤고 마지막 브리트니 피어스 엔딩 곡 좋았어요~,1,story
2008,임팩트는 없지만 그냥저냥,0,story
2009,유쾌하고 재미있게. 봤어요,1,story
2010,푸바오를 향한 그리움 포가 채워주지 못했다,0,story
2011,너무너무재밋다 포 사랑햐,1,story
2012,쿵푸팬더4 볼만했다 괜찮았다,0,story
2013,너무너무 귀엽고 재미있었어요,1,story
2014,진짜 포 뱃살 효과음 너무 좋음,1,story
2015,재밌었습니다 역시 포!,1,story
2016,유쾌하고 재밌었어요 시리즈를 안봤는데도 재밌게 잘봤네요,1,story
2017,아들과 즐거운 시간 보냈습니다,1,story
2018,신나고 재밌는 영화였어요… 마지막 노래 끝장…,1,directing
2019,이제는 추억속으로 안녕,0,story
2020,재밌어용~ 스토리는 좀 뻔했는데 영상미가 늘어난 거 같아요 친구랑 재밌게 봤습니다^_^,1,directing
2021,뻔한 전개지만 그래도 보게되는 마법 옛 캐릭터들을 보는 반가움 :),0,actor
2022,볼거리가 풍성하고 재밌어요,1,directing
2023,이렇게까지 재미없을 줄이야…,0,story
2024,역시 쿵푸팬더 엔딩 노래도 좋고 카멜레온이 취향이네요.,1,directing
2025,역시 너무 재밌었습니다,1,story
2026,전편에 비해 크게 변횐것이 없다.,0,story
2027,아이들과 봤는데 재미있다고하네요. 지루하지 않게 시간 순삭,1,story
2028,역시 쿵푸팬더~~ 기대를 져버리지 않았어요^^,1,story
2029,푸바오생각 한사람 손들어,0,story
2030,내용 전개는 생략하고 각각에 장면마다 코믹한 요소들과 과거에 봤던 느낌을 잘 살려서 실실 웃으며 보게 되네요! 제일 공감되는 장면은 여행할 때 각가지의 새로운 음식들을 보며 희열을 느끼는 포의 표정을 잊을 수 없네요. 오랜만에 웃으면서 관람했네요!,1,directing
2031,우리 포는 회를 거듭할수록 더 멋있어지네♡,1,story
2032,좋아요 좋아요 좋아요 좋아요,1,story
2033,액션이 더 화려해졌어요 작은 크기의 여우랑 카멜레온 같은 동물들이 차기 용의 전사와 용의 전사의 숙적으로 나와 더 흥미로왔어요. 재미있게 봤어요,1,story
2034,아이들과 잼있게 관람했어요,1,story
2035,쿵푸팬더 변함없이 재밌어요 😄,1,story
2036,재밌게 잘 봤습니다 !!,1,story
2037,너무 재미 있게 봤음 짜릿한 액션 최고임,1,directing
2038,무난하게볼만했습니당,1,story
2039,재밌다고 해서 오빠와 같이 봤는데 쿵푸3보다 재미가 없네요,0,story
2040,내면의평화 내면의평화 냉면의평화,1,story
2041,재미있게잘 봤습니다.,1,story
2042,TTT 못받았으면 브로큰에그 줄 정도로 영화 중간은 지루했음. 근데 티켓이 너무 구성지게 나와서 영화보고 나오니 다 용서됨…,0,story
2043,3편의 나쁜점을 응축한것같다,0,story
2044,푸보니 만두가 먹고 싶어지네 식욕이 땡기는 영화^^,0,story
2045,좋았어요 재밌게 잘 봤어요,1,story
2046,좋았어요 재밌게 잘 봤어요,1,story
2047,"빠른 전개와 웃음 포인트 좋았고, 스토리는 그리 새롭지는 않습니다. 보는 내내 유쾌한 기분~",1,story
2048,재밌어요 ㅎㅎ애들이랑 같이 즐겁게봤어요,1,story
2049,재밌어요 포 귀요미 화장실 땜에 쿠키는 못본듯 했네요,1,story
2050,커엽 커엽 커엽 커엽 커엽 커엽,0,story
2051,기대가 컸나? 결투씬의 리얼함은 훌륭하나 내가 바란 포의 귀여움은...,0,story
2052,"규칙 1, 그 누구도 믿지말 것. 특히, 여우하고 카멜레온.",1,story
2053,너무 기대를 해서 인지 ㅜㅜ 카멜레온이 역대 최하의 빌런ㅡㅡ 스토리도 그렇고 별로였어요 ㅡㅡ,0,story
2054,나올 소재 다 나온 느낌. 담편에 친구들 총동원 감동의 작별 각이다,1,story
